No.     Time           Source                Destination           Protocol Length Info 
      1 0.000000       host                  1.5.0                 USB      36     GET DESCRIPTOR Request DEVICE

Frame 1: 36 bytes on wire (288 bits), 36 bytes captured (288 bits)
USB URB
    [Source: host]
    [Destination: 1.5.0]
    USBPcap pseudoheader length: 28
    IRP ID: 0x0000000000000000
    IRP USBD_STATUS: USBD_STATUS_SUCCESS (0x00000000)
    URB Function: URB_FUNCTION_GET_DESCRIPTOR_FROM_DEVICE (0x000b)
    IRP information: 0x00, Direction: FDO -> PDO
    URB bus id: 1
    Device address: 5
    Endpoint: 0x80, Direction: IN
    URB transfer type: URB_CONTROL (0x02)
    Packet Data Length: 8
    [Response in: 2]
    Control transfer stage: Setup (0)
Setup Data

No.     Time           Source                Destination           Protocol Length Info 
      2 0.000000       1.5.0                 host                  USB      46     GET DESCRIPTOR Response DEVICE

Frame 2: 46 bytes on wire (368 bits), 46 bytes captured (368 bits)
USB URB
    [Source: 1.5.0]
    [Destination: host]
    USBPcap pseudoheader length: 28
    IRP ID: 0x0000000000000000
    IRP USBD_STATUS: USBD_STATUS_SUCCESS (0x00000000)
    URB Function: URB_FUNCTION_CONTROL_TRANSFER (0x0008)
    IRP information: 0x01, Direction: PDO -> FDO
    URB bus id: 1
    Device address: 5
    Endpoint: 0x80, Direction: IN
    URB transfer type: URB_CONTROL (0x02)
    Packet Data Length: 18
    [Request in: 1]
    [Time from request: 0.000000000 seconds]
    Control transfer stage: Complete (3)
DEVICE DESCRIPTOR

No.     Time           Source                Destination           Protocol Length Info 
      3 0.000000       host                  1.5.0                 USB      36     GET DESCRIPTOR Request CONFIGURATION

Frame 3: 36 bytes on wire (288 bits), 36 bytes captured (288 bits)
USB URB
    [Source: host]
    [Destination: 1.5.0]
    USBPcap pseudoheader length: 28
    IRP ID: 0x0000000000000000
    IRP USBD_STATUS: USBD_STATUS_SUCCESS (0x00000000)
    URB Function: URB_FUNCTION_GET_DESCRIPTOR_FROM_DEVICE (0x000b)
    IRP information: 0x00, Direction: FDO -> PDO
    URB bus id: 1
    Device address: 5
    Endpoint: 0x80, Direction: IN
    URB transfer type: URB_CONTROL (0x02)
    Packet Data Length: 8
    [Response in: 4]
    Control transfer stage: Setup (0)
Setup Data

No.     Time           Source                Destination           Protocol Length Info 
      4 0.000000       1.5.0                 host                  USB      60     GET DESCRIPTOR Response CONFIGURATION

Frame 4: 60 bytes on wire (480 bits), 60 bytes captured (480 bits)
USB URB
    [Source: 1.5.0]
    [Destination: host]
    USBPcap pseudoheader length: 28
    IRP ID: 0x0000000000000000
    IRP USBD_STATUS: USBD_STATUS_SUCCESS (0x00000000)
    URB Function: URB_FUNCTION_CONTROL_TRANSFER (0x0008)
    IRP information: 0x01, Direction: PDO -> FDO
    URB bus id: 1
    Device address: 5
    Endpoint: 0x80, Direction: IN
    URB transfer type: URB_CONTROL (0x02)
    Packet Data Length: 32
    [Request in: 3]
    [Time from request: 0.000000000 seconds]
    Control transfer stage: Complete (3)
CONFIGURATION DESCRIPTOR
INTERFACE DESCRIPTOR (0.0): class Printer
ENDPOINT DESCRIPTOR
ENDPOINT DESCRIPTOR

No.     Time           Source                Destination           Protocol Length Info 
      5 0.000000       host                  1.5.0                 USB      36     SET CONFIGURATION Request

Frame 5: 36 bytes on wire (288 bits), 36 bytes captured (288 bits)
USB URB
    [Source: host]
    [Destination: 1.5.0]
    USBPcap pseudoheader length: 28
    IRP ID: 0x0000000000000000
    IRP USBD_STATUS: USBD_STATUS_SUCCESS (0x00000000)
    URB Function: URB_FUNCTION_SELECT_CONFIGURATION (0x0000)
    IRP information: 0x00, Direction: FDO -> PDO
    URB bus id: 1
    Device address: 5
    Endpoint: 0x00, Direction: OUT
    URB transfer type: URB_CONTROL (0x02)
    Packet Data Length: 8
    [Response in: 6]
    Control transfer stage: Setup (0)
Setup Data

No.     Time           Source                Destination           Protocol Length Info 
      6 0.000000       1.5.0                 host                  USB      28     SET CONFIGURATION Response

Frame 6: 28 bytes on wire (224 bits), 28 bytes captured (224 bits)
USB URB
    [Source: 1.5.0]
    [Destination: host]
    USBPcap pseudoheader length: 28
    IRP ID: 0x0000000000000000
    IRP USBD_STATUS: USBD_STATUS_SUCCESS (0x00000000)
    URB Function: URB_FUNCTION_SELECT_CONFIGURATION (0x0000)
    IRP information: 0x01, Direction: PDO -> FDO
    URB bus id: 1
    Device address: 5
    Endpoint: 0x00, Direction: OUT
    URB transfer type: URB_CONTROL (0x02)
    Packet Data Length: 0
    [Request in: 5]
    [Time from request: 0.000000000 seconds]
    Control transfer stage: Complete (3)

No.     Time           Source                Destination           Protocol Length Info 
      7 0.000000       host                  1.2.0                 USB      36     GET DESCRIPTOR Request DEVICE

Frame 7: 36 bytes on wire (288 bits), 36 bytes captured (288 bits)
USB URB
    [Source: host]
    [Destination: 1.2.0]
    USBPcap pseudoheader length: 28
    IRP ID: 0x0000000000000000
    IRP USBD_STATUS: USBD_STATUS_SUCCESS (0x00000000)
    URB Function: URB_FUNCTION_GET_DESCRIPTOR_FROM_DEVICE (0x000b)
    IRP information: 0x00, Direction: FDO -> PDO
    URB bus id: 1
    Device address: 2
    Endpoint: 0x80, Direction: IN
    URB transfer type: URB_CONTROL (0x02)
    Packet Data Length: 8
    [Response in: 8]
    Control transfer stage: Setup (0)
Setup Data

No.     Time           Source                Destination           Protocol Length Info 
      8 0.000000       1.2.0                 host                  USB      46     GET DESCRIPTOR Response DEVICE

Frame 8: 46 bytes on wire (368 bits), 46 bytes captured (368 bits)
USB URB
    [Source: 1.2.0]
    [Destination: host]
    USBPcap pseudoheader length: 28
    IRP ID: 0x0000000000000000
    IRP USBD_STATUS: USBD_STATUS_SUCCESS (0x00000000)
    URB Function: URB_FUNCTION_CONTROL_TRANSFER (0x0008)
    IRP information: 0x01, Direction: PDO -> FDO
    URB bus id: 1
    Device address: 2
    Endpoint: 0x80, Direction: IN
    URB transfer type: URB_CONTROL (0x02)
    Packet Data Length: 18
    [Request in: 7]
    [Time from request: 0.000000000 seconds]
    Control transfer stage: Complete (3)
DEVICE DESCRIPTOR

No.     Time           Source                Destination           Protocol Length Info 
      9 0.000000       host                  1.2.0                 USB      36     GET DESCRIPTOR Request CONFIGURATION

Frame 9: 36 bytes on wire (288 bits), 36 bytes captured (288 bits)
USB URB
    [Source: host]
    [Destination: 1.2.0]
    USBPcap pseudoheader length: 28
    IRP ID: 0x0000000000000000
    IRP USBD_STATUS: USBD_STATUS_SUCCESS (0x00000000)
    URB Function: URB_FUNCTION_GET_DESCRIPTOR_FROM_DEVICE (0x000b)
    IRP information: 0x00, Direction: FDO -> PDO
    URB bus id: 1
    Device address: 2
    Endpoint: 0x80, Direction: IN
    URB transfer type: URB_CONTROL (0x02)
    Packet Data Length: 8
    [Response in: 10]
    Control transfer stage: Setup (0)
Setup Data

No.     Time           Source                Destination           Protocol Length Info 
     10 0.000000       1.2.0                 host                  USB      167    GET DESCRIPTOR Response CONFIGURATION

Frame 10: 167 bytes on wire (1336 bits), 167 bytes captured (1336 bits)
USB URB
    [Source: 1.2.0]
    [Destination: host]
    USBPcap pseudoheader length: 28
    IRP ID: 0x0000000000000000
    IRP USBD_STATUS: USBD_STATUS_SUCCESS (0x00000000)
    URB Function: URB_FUNCTION_CONTROL_TRANSFER (0x0008)
    IRP information: 0x01, Direction: PDO -> FDO
    URB bus id: 1
    Device address: 2
    Endpoint: 0x80, Direction: IN
    URB transfer type: URB_CONTROL (0x02)
    Packet Data Length: 139
    [Request in: 9]
    [Time from request: 0.000000000 seconds]
    Control transfer stage: Complete (3)
CONFIGURATION DESCRIPTOR
INTERFACE DESCRIPTOR (0.0): class Application Specific
UNKNOWN DESCRIPTOR
ENDPOINT DESCRIPTOR
ENDPOINT DESCRIPTOR
ENDPOINT DESCRIPTOR
INTERFACE DESCRIPTOR (1.0): class Smart Card
SMART CARD DEVICE CLASS DESCRIPTOR
ENDPOINT DESCRIPTOR
ENDPOINT DESCRIPTOR
ENDPOINT DESCRIPTOR

No.     Time           Source                Destination           Protocol Length Info 
     11 0.000000       host                  1.2.0                 USB      36     SET CONFIGURATION Request

Frame 11: 36 bytes on wire (288 bits), 36 bytes captured (288 bits)
USB URB
    [Source: host]
    [Destination: 1.2.0]
    USBPcap pseudoheader length: 28
    IRP ID: 0x0000000000000000
    IRP USBD_STATUS: USBD_STATUS_SUCCESS (0x00000000)
    URB Function: URB_FUNCTION_SELECT_CONFIGURATION (0x0000)
    IRP information: 0x00, Direction: FDO -> PDO
    URB bus id: 1
    Device address: 2
    Endpoint: 0x00, Direction: OUT
    URB transfer type: URB_CONTROL (0x02)
    Packet Data Length: 8
    [Response in: 12]
    Control transfer stage: Setup (0)
Setup Data

No.     Time           Source                Destination           Protocol Length Info 
     12 0.000000       1.2.0                 host                  USB      28     SET CONFIGURATION Response

Frame 12: 28 bytes on wire (224 bits), 28 bytes captured (224 bits)
USB URB
    [Source: 1.2.0]
    [Destination: host]
    USBPcap pseudoheader length: 28
    IRP ID: 0x0000000000000000
    IRP USBD_STATUS: USBD_STATUS_SUCCESS (0x00000000)
    URB Function: URB_FUNCTION_SELECT_CONFIGURATION (0x0000)
    IRP information: 0x01, Direction: PDO -> FDO
    URB bus id: 1
    Device address: 2
    Endpoint: 0x00, Direction: OUT
    URB transfer type: URB_CONTROL (0x02)
    Packet Data Length: 0
    [Request in: 11]
    [Time from request: 0.000000000 seconds]
    Control transfer stage: Complete (3)

No.     Time           Source                Destination           Protocol Length Info 
     13 0.000000       host                  1.3.0                 USB      36     GET DESCRIPTOR Request DEVICE

Frame 13: 36 bytes on wire (288 bits), 36 bytes captured (288 bits)
USB URB
    [Source: host]
    [Destination: 1.3.0]
    USBPcap pseudoheader length: 28
    IRP ID: 0x0000000000000000
    IRP USBD_STATUS: USBD_STATUS_SUCCESS (0x00000000)
    URB Function: URB_FUNCTION_GET_DESCRIPTOR_FROM_DEVICE (0x000b)
    IRP information: 0x00, Direction: FDO -> PDO
    URB bus id: 1
    Device address: 3
    Endpoint: 0x80, Direction: IN
    URB transfer type: URB_CONTROL (0x02)
    Packet Data Length: 8
    [Response in: 14]
    Control transfer stage: Setup (0)
Setup Data

No.     Time           Source                Destination           Protocol Length Info 
     14 0.000000       1.3.0                 host                  USB      46     GET DESCRIPTOR Response DEVICE

Frame 14: 46 bytes on wire (368 bits), 46 bytes captured (368 bits)
USB URB
    [Source: 1.3.0]
    [Destination: host]
    USBPcap pseudoheader length: 28
    IRP ID: 0x0000000000000000
    IRP USBD_STATUS: USBD_STATUS_SUCCESS (0x00000000)
    URB Function: URB_FUNCTION_CONTROL_TRANSFER (0x0008)
    IRP information: 0x01, Direction: PDO -> FDO
    URB bus id: 1
    Device address: 3
    Endpoint: 0x80, Direction: IN
    URB transfer type: URB_CONTROL (0x02)
    Packet Data Length: 18
    [Request in: 13]
    [Time from request: 0.000000000 seconds]
    Control transfer stage: Complete (3)
DEVICE DESCRIPTOR

No.     Time           Source                Destination           Protocol Length Info 
     15 0.000000       host                  1.3.0                 USB      36     GET DESCRIPTOR Request CONFIGURATION

Frame 15: 36 bytes on wire (288 bits), 36 bytes captured (288 bits)
USB URB
    [Source: host]
    [Destination: 1.3.0]
    USBPcap pseudoheader length: 28
    IRP ID: 0x0000000000000000
    IRP USBD_STATUS: USBD_STATUS_SUCCESS (0x00000000)
    URB Function: URB_FUNCTION_GET_DESCRIPTOR_FROM_DEVICE (0x000b)
    IRP information: 0x00, Direction: FDO -> PDO
    URB bus id: 1
    Device address: 3
    Endpoint: 0x80, Direction: IN
    URB transfer type: URB_CONTROL (0x02)
    Packet Data Length: 8
    [Response in: 16]
    Control transfer stage: Setup (0)
Setup Data

No.     Time           Source                Destination           Protocol Length Info 
     16 0.000000       1.3.0                 host                  USB      1069   GET DESCRIPTOR Response CONFIGURATION

Frame 16: 1069 bytes on wire (8552 bits), 1069 bytes captured (8552 bits)
USB URB
    [Source: 1.3.0]
    [Destination: host]
    USBPcap pseudoheader length: 28
    IRP ID: 0x0000000000000000
    IRP USBD_STATUS: USBD_STATUS_SUCCESS (0x00000000)
    URB Function: URB_FUNCTION_CONTROL_TRANSFER (0x0008)
    IRP information: 0x01, Direction: PDO -> FDO
    URB bus id: 1
    Device address: 3
    Endpoint: 0x80, Direction: IN
    URB transfer type: URB_CONTROL (0x02)
    Packet Data Length: 1041
    [Request in: 15]
    [Time from request: 0.000000000 seconds]
    Control transfer stage: Complete (3)
CONFIGURATION DESCRIPTOR
UNKNOWN DESCRIPTOR
INTERFACE ASSOCIATION DESCRIPTOR
INTERFACE DESCRIPTOR (0.0): class Video
VIDEO CONTROL INTERFACE DESCRIPTOR [Header]
VIDEO CONTROL INTERFACE DESCRIPTOR [Input Terminal] (Entity 1)
VIDEO CONTROL INTERFACE DESCRIPTOR [Processing Unit] (Entity 2)
VIDEO CONTROL INTERFACE DESCRIPTOR [Output Terminal] (Entity 3)
VIDEO CONTROL INTERFACE DESCRIPTOR [Extension Unit] (Entity 4)
VIDEO CONTROL INTERFACE DESCRIPTOR [Extension Unit] (Entity 7)
ENDPOINT DESCRIPTOR
VIDEO CONTROL ENDPOINT DESCRIPTOR [Interrupt]
INTERFACE DESCRIPTOR (1.0): class Video
VIDEO STREAMING INTERFACE DESCRIPTOR [Input Header]
VIDEO STREAMING INTERFACE DESCRIPTOR [Format MJPEG]  (Format 1)
VIDEO STREAMING INTERFACE DESCRIPTOR [Frame MJPEG]   (Index  1): 1280 x  720
VIDEO STREAMING INTERFACE DESCRIPTOR [Frame MJPEG]   (Index  2):  960 x  540
VIDEO STREAMING INTERFACE DESCRIPTOR [Frame MJPEG]   (Index  3):  848 x  480
VIDEO STREAMING INTERFACE DESCRIPTOR [Frame MJPEG]   (Index  4):  640 x  480
VIDEO STREAMING INTERFACE DESCRIPTOR [Frame MJPEG]   (Index  5):  640 x  360
VIDEO STREAMING INTERFACE DESCRIPTOR [Colorformat]
VIDEO STREAMING INTERFACE DESCRIPTOR [Format Uncompressed]  (Format 2): YUY2
VIDEO STREAMING INTERFACE DESCRIPTOR [Frame Uncompressed]   (Index  1):  640 x  480
VIDEO STREAMING INTERFACE DESCRIPTOR [Frame Uncompressed]   (Index  2):  640 x  360
VIDEO STREAMING INTERFACE DESCRIPTOR [Frame Uncompressed]   (Index  3):  424 x  240
VIDEO STREAMING INTERFACE DESCRIPTOR [Frame Uncompressed]   (Index  4):  320 x  240
VIDEO STREAMING INTERFACE DESCRIPTOR [Frame Uncompressed]   (Index  5):  320 x  180
VIDEO STREAMING INTERFACE DESCRIPTOR [Frame Uncompressed]   (Index  6):  160 x  120
VIDEO STREAMING INTERFACE DESCRIPTOR [Colorformat]
INTERFACE DESCRIPTOR (1.1): class Video
ENDPOINT DESCRIPTOR
INTERFACE DESCRIPTOR (1.2): class Video
ENDPOINT DESCRIPTOR
INTERFACE DESCRIPTOR (1.3): class Video
ENDPOINT DESCRIPTOR
INTERFACE DESCRIPTOR (1.4): class Video
ENDPOINT DESCRIPTOR
INTERFACE DESCRIPTOR (1.5): class Video
ENDPOINT DESCRIPTOR
INTERFACE DESCRIPTOR (1.6): class Video
ENDPOINT DESCRIPTOR
INTERFACE DESCRIPTOR (1.7): class Video
ENDPOINT DESCRIPTOR
INTERFACE ASSOCIATION DESCRIPTOR
INTERFACE DESCRIPTOR (2.0): class Video
VIDEO CONTROL INTERFACE DESCRIPTOR [Header]
VIDEO CONTROL INTERFACE DESCRIPTOR [Input Terminal] (Entity 11)
VIDEO CONTROL INTERFACE DESCRIPTOR [Processing Unit] (Entity 9)
VIDEO CONTROL INTERFACE DESCRIPTOR [Output Terminal] (Entity 8)
VIDEO CONTROL INTERFACE DESCRIPTOR [Extension Unit] (Entity 12)
VIDEO CONTROL INTERFACE DESCRIPTOR [Extension Unit] (Entity 10)
ENDPOINT DESCRIPTOR
VIDEO CONTROL ENDPOINT DESCRIPTOR [Interrupt]
INTERFACE DESCRIPTOR (3.0): class Video
VIDEO STREAMING INTERFACE DESCRIPTOR [Input Header]
VIDEO STREAMING INTERFACE DESCRIPTOR [Format Uncompressed]  (Format 1): YUY2
VIDEO STREAMING INTERFACE DESCRIPTOR [Frame Uncompressed]   (Index  1):  340 x  340
VIDEO STREAMING INTERFACE DESCRIPTOR [Still Image Frame]
VIDEO STREAMING INTERFACE DESCRIPTOR [Colorformat]
INTERFACE DESCRIPTOR (3.1): class Video
ENDPOINT DESCRIPTOR
INTERFACE DESCRIPTOR (3.2): class Video
ENDPOINT DESCRIPTOR
INTERFACE DESCRIPTOR (3.3): class Video
ENDPOINT DESCRIPTOR
INTERFACE DESCRIPTOR (3.4): class Video
ENDPOINT DESCRIPTOR
INTERFACE DESCRIPTOR (3.5): class Video
ENDPOINT DESCRIPTOR
INTERFACE DESCRIPTOR (3.6): class Video
ENDPOINT DESCRIPTOR
INTERFACE DESCRIPTOR (3.7): class Video
ENDPOINT DESCRIPTOR

No.     Time           Source                Destination           Protocol Length Info 
     17 0.000000       host                  1.3.0                 USB      36     SET CONFIGURATION Request

Frame 17: 36 bytes on wire (288 bits), 36 bytes captured (288 bits)
USB URB
    [Source: host]
    [Destination: 1.3.0]
    USBPcap pseudoheader length: 28
    IRP ID: 0x0000000000000000
    IRP USBD_STATUS: USBD_STATUS_SUCCESS (0x00000000)
    URB Function: URB_FUNCTION_SELECT_CONFIGURATION (0x0000)
    IRP information: 0x00, Direction: FDO -> PDO
    URB bus id: 1
    Device address: 3
    Endpoint: 0x00, Direction: OUT
    URB transfer type: URB_CONTROL (0x02)
    Packet Data Length: 8
    [Response in: 18]
    Control transfer stage: Setup (0)
Setup Data

No.     Time           Source                Destination           Protocol Length Info 
     18 0.000000       1.3.0                 host                  USB      28     SET CONFIGURATION Response

Frame 18: 28 bytes on wire (224 bits), 28 bytes captured (224 bits)
USB URB
    [Source: 1.3.0]
    [Destination: host]
    USBPcap pseudoheader length: 28
    IRP ID: 0x0000000000000000
    IRP USBD_STATUS: USBD_STATUS_SUCCESS (0x00000000)
    URB Function: URB_FUNCTION_SELECT_CONFIGURATION (0x0000)
    IRP information: 0x01, Direction: PDO -> FDO
    URB bus id: 1
    Device address: 3
    Endpoint: 0x00, Direction: OUT
    URB transfer type: URB_CONTROL (0x02)
    Packet Data Length: 0
    [Request in: 17]
    [Time from request: 0.000000000 seconds]
    Control transfer stage: Complete (3)

No.     Time           Source                Destination           Protocol Length Info 
     19 0.000000       host                  1.4.0                 USB      36     GET DESCRIPTOR Request DEVICE

Frame 19: 36 bytes on wire (288 bits), 36 bytes captured (288 bits)
USB URB
    [Source: host]
    [Destination: 1.4.0]
    USBPcap pseudoheader length: 28
    IRP ID: 0x0000000000000000
    IRP USBD_STATUS: USBD_STATUS_SUCCESS (0x00000000)
    URB Function: URB_FUNCTION_GET_DESCRIPTOR_FROM_DEVICE (0x000b)
    IRP information: 0x00, Direction: FDO -> PDO
    URB bus id: 1
    Device address: 4
    Endpoint: 0x80, Direction: IN
    URB transfer type: URB_CONTROL (0x02)
    Packet Data Length: 8
    [Response in: 20]
    Control transfer stage: Setup (0)
Setup Data

No.     Time           Source                Destination           Protocol Length Info 
     20 0.000000       1.4.0                 host                  USB      46     GET DESCRIPTOR Response DEVICE

Frame 20: 46 bytes on wire (368 bits), 46 bytes captured (368 bits)
USB URB
    [Source: 1.4.0]
    [Destination: host]
    USBPcap pseudoheader length: 28
    IRP ID: 0x0000000000000000
    IRP USBD_STATUS: USBD_STATUS_SUCCESS (0x00000000)
    URB Function: URB_FUNCTION_CONTROL_TRANSFER (0x0008)
    IRP information: 0x01, Direction: PDO -> FDO
    URB bus id: 1
    Device address: 4
    Endpoint: 0x80, Direction: IN
    URB transfer type: URB_CONTROL (0x02)
    Packet Data Length: 18
    [Request in: 19]
    [Time from request: 0.000000000 seconds]
    Control transfer stage: Complete (3)
DEVICE DESCRIPTOR

No.     Time           Source                Destination           Protocol Length Info 
     21 0.000000       host                  1.4.0                 USB      36     GET DESCRIPTOR Request CONFIGURATION

Frame 21: 36 bytes on wire (288 bits), 36 bytes captured (288 bits)
USB URB
    [Source: host]
    [Destination: 1.4.0]
    USBPcap pseudoheader length: 28
    IRP ID: 0x0000000000000000
    IRP USBD_STATUS: USBD_STATUS_SUCCESS (0x00000000)
    URB Function: URB_FUNCTION_GET_DESCRIPTOR_FROM_DEVICE (0x000b)
    IRP information: 0x00, Direction: FDO -> PDO
    URB bus id: 1
    Device address: 4
    Endpoint: 0x80, Direction: IN
    URB transfer type: URB_CONTROL (0x02)
    Packet Data Length: 8
    [Response in: 22]
    Control transfer stage: Setup (0)
Setup Data

No.     Time           Source                Destination           Protocol Length Info 
     22 0.000000       1.4.0                 host                  USB      228    GET DESCRIPTOR Response CONFIGURATION

Frame 22: 228 bytes on wire (1824 bits), 228 bytes captured (1824 bits)
USB URB
    [Source: 1.4.0]
    [Destination: host]
    USBPcap pseudoheader length: 28
    IRP ID: 0x0000000000000000
    IRP USBD_STATUS: USBD_STATUS_SUCCESS (0x00000000)
    URB Function: URB_FUNCTION_CONTROL_TRANSFER (0x0008)
    IRP information: 0x01, Direction: PDO -> FDO
    URB bus id: 1
    Device address: 4
    Endpoint: 0x80, Direction: IN
    URB transfer type: URB_CONTROL (0x02)
    Packet Data Length: 200
    [Request in: 21]
    [Time from request: 0.000000000 seconds]
    Control transfer stage: Complete (3)
CONFIGURATION DESCRIPTOR
INTERFACE DESCRIPTOR (0.0): class Wireless Controller
ENDPOINT DESCRIPTOR
ENDPOINT DESCRIPTOR
ENDPOINT DESCRIPTOR
INTERFACE DESCRIPTOR (1.0): class Wireless Controller
ENDPOINT DESCRIPTOR
ENDPOINT DESCRIPTOR
INTERFACE DESCRIPTOR (1.1): class Wireless Controller
ENDPOINT DESCRIPTOR
ENDPOINT DESCRIPTOR
INTERFACE DESCRIPTOR (1.2): class Wireless Controller
ENDPOINT DESCRIPTOR
ENDPOINT DESCRIPTOR
INTERFACE DESCRIPTOR (1.3): class Wireless Controller
ENDPOINT DESCRIPTOR
ENDPOINT DESCRIPTOR
INTERFACE DESCRIPTOR (1.4): class Wireless Controller
ENDPOINT DESCRIPTOR
ENDPOINT DESCRIPTOR
INTERFACE DESCRIPTOR (1.5): class Wireless Controller
ENDPOINT DESCRIPTOR
ENDPOINT DESCRIPTOR
INTERFACE DESCRIPTOR (1.6): class Wireless Controller
ENDPOINT DESCRIPTOR
ENDPOINT DESCRIPTOR

No.     Time           Source                Destination           Protocol Length Info 
     23 0.000000       host                  1.4.0                 USB      36     SET CONFIGURATION Request

Frame 23: 36 bytes on wire (288 bits), 36 bytes captured (288 bits)
USB URB
    [Source: host]
    [Destination: 1.4.0]
    USBPcap pseudoheader length: 28
    IRP ID: 0x0000000000000000
    IRP USBD_STATUS: USBD_STATUS_SUCCESS (0x00000000)
    URB Function: URB_FUNCTION_SELECT_CONFIGURATION (0x0000)
    IRP information: 0x00, Direction: FDO -> PDO
    URB bus id: 1
    Device address: 4
    Endpoint: 0x00, Direction: OUT
    URB transfer type: URB_CONTROL (0x02)
    Packet Data Length: 8
    [Response in: 24]
    Control transfer stage: Setup (0)
Setup Data

No.     Time           Source                Destination           Protocol Length Info 
     24 0.000000       1.4.0                 host                  USB      28     SET CONFIGURATION Response

Frame 24: 28 bytes on wire (224 bits), 28 bytes captured (224 bits)
USB URB
    [Source: 1.4.0]
    [Destination: host]
    USBPcap pseudoheader length: 28
    IRP ID: 0x0000000000000000
    IRP USBD_STATUS: USBD_STATUS_SUCCESS (0x00000000)
    URB Function: URB_FUNCTION_SELECT_CONFIGURATION (0x0000)
    IRP information: 0x01, Direction: PDO -> FDO
    URB bus id: 1
    Device address: 4
    Endpoint: 0x00, Direction: OUT
    URB transfer type: URB_CONTROL (0x02)
    Packet Data Length: 0
    [Request in: 23]
    [Time from request: 0.000000000 seconds]
    Control transfer stage: Complete (3)

No.     Time           Source                Destination           Protocol Length Info 
     25 19.432985      host                  1.5.2                 USB      33     URB_BULK out

Frame 25: 33 bytes on wire (264 bits), 33 bytes captured (264 bits)
USB URB
    [Source: host]
    [Destination: 1.5.2]
    USBPcap pseudoheader length: 27
    IRP ID: 0xffffaf8202653780
    IRP USBD_STATUS: USBD_STATUS_SUCCESS (0x00000000)
    URB Function: URB_FUNCTION_BULK_OR_INTERRUPT_TRANSFER (0x0009)
    IRP information: 0x00, Direction: FDO -> PDO
    URB bus id: 1
    Device address: 5
    Endpoint: 0x02, Direction: OUT
    URB transfer type: URB_BULK (0x03)
    Packet Data Length: 6
    [Response in: 26]
    [bInterfaceClass: Printer (0x07)]
Leftover Capture Data: 1b7b43463f7d

No.     Time           Source                Destination           Protocol Length Info 
     26 19.433050      1.5.2                 host                  USB      27     URB_BULK out

Frame 26: 27 bytes on wire (216 bits), 27 bytes captured (216 bits)
USB URB
    [Source: 1.5.2]
    [Destination: host]
    USBPcap pseudoheader length: 27
    IRP ID: 0xffffaf8202653780
    IRP USBD_STATUS: USBD_STATUS_SUCCESS (0x00000000)
    URB Function: URB_FUNCTION_BULK_OR_INTERRUPT_TRANSFER (0x0009)
    IRP information: 0x01, Direction: PDO -> FDO
    URB bus id: 1
    Device address: 5
    Endpoint: 0x02, Direction: OUT
    URB transfer type: URB_BULK (0x03)
    Packet Data Length: 0
    [Request in: 25]
    [Time from request: 0.000065000 seconds]
    [bInterfaceClass: Printer (0x07)]

No.     Time           Source                Destination           Protocol Length Info 
     27 19.433106      host                  1.5.1                 USB      27     URB_BULK in

Frame 27: 27 bytes on wire (216 bits), 27 bytes captured (216 bits)
USB URB
    [Source: host]
    [Destination: 1.5.1]
    USBPcap pseudoheader length: 27
    IRP ID: 0xffffaf8202653780
    IRP USBD_STATUS: USBD_STATUS_SUCCESS (0x00000000)
    URB Function: URB_FUNCTION_BULK_OR_INTERRUPT_TRANSFER (0x0009)
    IRP information: 0x00, Direction: FDO -> PDO
    URB bus id: 1
    Device address: 5
    Endpoint: 0x81, Direction: IN
    URB transfer type: URB_BULK (0x03)
    Packet Data Length: 0
    [Response in: 28]
    [bInterfaceClass: Printer (0x07)]

No.     Time           Source                Destination           Protocol Length Info 
     28 19.453719      1.5.1                 host                  USB      73     URB_BULK in

Frame 28: 73 bytes on wire (584 bits), 73 bytes captured (584 bits)
USB URB
    [Source: 1.5.1]
    [Destination: host]
    USBPcap pseudoheader length: 27
    IRP ID: 0xffffaf8202653780
    IRP USBD_STATUS: USBD_STATUS_SUCCESS (0x00000000)
    URB Function: URB_FUNCTION_BULK_OR_INTERRUPT_TRANSFER (0x0009)
    IRP information: 0x01, Direction: PDO -> FDO
    URB bus id: 1
    Device address: 5
    Endpoint: 0x81, Direction: IN
    URB transfer type: URB_BULK (0x03)
    Packet Data Length: 46
    [Request in: 27]
    [Time from request: 0.020613000 seconds]
    [bInterfaceClass: Printer (0x07)]
Leftover Capture Data: 7b4346214c3a455a3b423a3131353b503a4e3b4e3a383b48…

No.     Time           Source                Destination           Protocol Length Info 
     29 19.554481      host                  1.5.2                 USB      34     URB_BULK out

Frame 29: 34 bytes on wire (272 bits), 34 bytes captured (272 bits)
USB URB
    [Source: host]
    [Destination: 1.5.2]
    USBPcap pseudoheader length: 27
    IRP ID: 0xffffaf8202082910
    IRP USBD_STATUS: USBD_STATUS_SUCCESS (0x00000000)
    URB Function: URB_FUNCTION_BULK_OR_INTERRUPT_TRANSFER (0x0009)
    IRP information: 0x00, Direction: FDO -> PDO
    URB bus id: 1
    Device address: 5
    Endpoint: 0x02, Direction: OUT
    URB transfer type: URB_BULK (0x03)
    Packet Data Length: 7
    [Response in: 30]
    [bInterfaceClass: Printer (0x07)]
Leftover Capture Data: 1b455a7b4c507d

No.     Time           Source                Destination           Protocol Length Info 
     30 19.554542      1.5.2                 host                  USB      27     URB_BULK out

Frame 30: 27 bytes on wire (216 bits), 27 bytes captured (216 bits)
USB URB
    [Source: 1.5.2]
    [Destination: host]
    USBPcap pseudoheader length: 27
    IRP ID: 0xffffaf8202082910
    IRP USBD_STATUS: USBD_STATUS_SUCCESS (0x00000000)
    URB Function: URB_FUNCTION_BULK_OR_INTERRUPT_TRANSFER (0x0009)
    IRP information: 0x01, Direction: PDO -> FDO
    URB bus id: 1
    Device address: 5
    Endpoint: 0x02, Direction: OUT
    URB transfer type: URB_BULK (0x03)
    Packet Data Length: 0
    [Request in: 29]
    [Time from request: 0.000061000 seconds]
    [bInterfaceClass: Printer (0x07)]

No.     Time           Source                Destination           Protocol Length Info 
     31 19.554594      host                  1.5.1                 USB      27     URB_BULK in

Frame 31: 27 bytes on wire (216 bits), 27 bytes captured (216 bits)
USB URB
    [Source: host]
    [Destination: 1.5.1]
    USBPcap pseudoheader length: 27
    IRP ID: 0xffffaf8202082910
    IRP USBD_STATUS: USBD_STATUS_SUCCESS (0x00000000)
    URB Function: URB_FUNCTION_BULK_OR_INTERRUPT_TRANSFER (0x0009)
    IRP information: 0x00, Direction: FDO -> PDO
    URB bus id: 1
    Device address: 5
    Endpoint: 0x81, Direction: IN
    URB transfer type: URB_BULK (0x03)
    Packet Data Length: 0
    [Response in: 32]
    [bInterfaceClass: Printer (0x07)]

No.     Time           Source                Destination           Protocol Length Info 
     32 20.554699      1.5.1                 host                  USB      27     URB_BULK in

Frame 32: 27 bytes on wire (216 bits), 27 bytes captured (216 bits)
USB URB
    [Source: 1.5.1]
    [Destination: host]
    USBPcap pseudoheader length: 27
    IRP ID: 0xffffaf8202082910
    IRP USBD_STATUS: USBD_STATUS_CANCELED (0xc0010000)
    URB Function: URB_FUNCTION_BULK_OR_INTERRUPT_TRANSFER (0x0009)
    IRP information: 0x01, Direction: PDO -> FDO
    URB bus id: 1
    Device address: 5
    Endpoint: 0x81, Direction: IN
    URB transfer type: URB_BULK (0x03)
    Packet Data Length: 0
    [Request in: 31]
    [Time from request: 1.000105000 seconds]
    [bInterfaceClass: Printer (0x07)]

No.     Time           Source                Destination           Protocol Length Info 
     33 20.554724      host                  1.5.1                 USB      27     URB_FUNCTION_SYNC_RESET_PIPE_AND_CLEAR_STALL

Frame 33: 27 bytes on wire (216 bits), 27 bytes captured (216 bits)
USB URB
    [Source: host]
    [Destination: 1.5.1]
    USBPcap pseudoheader length: 27
    IRP ID: 0xffffaf82246d8ab0
    IRP USBD_STATUS: USBD_STATUS_SUCCESS (0x00000000)
    URB Function: URB_FUNCTION_SYNC_RESET_PIPE_AND_CLEAR_STALL (0x001e)
    IRP information: 0x00, Direction: FDO -> PDO
    URB bus id: 1
    Device address: 5
    Endpoint: 0x81, Direction: IN
    URB transfer type: USB IRP Info (0xfe)
    Packet Data Length: 0
    [Response in: 34]

No.     Time           Source                Destination           Protocol Length Info 
     34 20.555048      1.5.1                 host                  USB      27     URB_FUNCTION_SYNC_RESET_PIPE_AND_CLEAR_STALL

Frame 34: 27 bytes on wire (216 bits), 27 bytes captured (216 bits)
USB URB
    [Source: 1.5.1]
    [Destination: host]
    USBPcap pseudoheader length: 27
    IRP ID: 0xffffaf82246d8ab0
    IRP USBD_STATUS: USBD_STATUS_SUCCESS (0x00000000)
    URB Function: URB_FUNCTION_SYNC_RESET_PIPE_AND_CLEAR_STALL (0x001e)
    IRP information: 0x01, Direction: PDO -> FDO
    URB bus id: 1
    Device address: 5
    Endpoint: 0x81, Direction: IN
    URB transfer type: USB IRP Info (0xfe)
    Packet Data Length: 0
    [Request in: 33]
    [Time from request: 0.000324000 seconds]

No.     Time           Source                Destination           Protocol Length Info 
     35 20.565647      host                  1.5.1                 USB      27     URB_BULK in

Frame 35: 27 bytes on wire (216 bits), 27 bytes captured (216 bits)
USB URB
    [Source: host]
    [Destination: 1.5.1]
    USBPcap pseudoheader length: 27
    IRP ID: 0xffffaf8202732ab0
    IRP USBD_STATUS: USBD_STATUS_SUCCESS (0x00000000)
    URB Function: URB_FUNCTION_BULK_OR_INTERRUPT_TRANSFER (0x0009)
    IRP information: 0x00, Direction: FDO -> PDO
    URB bus id: 1
    Device address: 5
    Endpoint: 0x81, Direction: IN
    URB transfer type: URB_BULK (0x03)
    Packet Data Length: 0
    [Response in: 36]
    [bInterfaceClass: Printer (0x07)]

No.     Time           Source                Destination           Protocol Length Info 
     36 21.565998      1.5.1                 host                  USB      27     URB_BULK in

Frame 36: 27 bytes on wire (216 bits), 27 bytes captured (216 bits)
USB URB
    [Source: 1.5.1]
    [Destination: host]
    USBPcap pseudoheader length: 27
    IRP ID: 0xffffaf8202732ab0
    IRP USBD_STATUS: USBD_STATUS_CANCELED (0xc0010000)
    URB Function: URB_FUNCTION_BULK_OR_INTERRUPT_TRANSFER (0x0009)
    IRP information: 0x01, Direction: PDO -> FDO
    URB bus id: 1
    Device address: 5
    Endpoint: 0x81, Direction: IN
    URB transfer type: URB_BULK (0x03)
    Packet Data Length: 0
    [Request in: 35]
    [Time from request: 1.000351000 seconds]
    [bInterfaceClass: Printer (0x07)]

No.     Time           Source                Destination           Protocol Length Info 
     37 21.566066      host                  1.5.1                 USB      27     URB_FUNCTION_SYNC_RESET_PIPE_AND_CLEAR_STALL

Frame 37: 27 bytes on wire (216 bits), 27 bytes captured (216 bits)
USB URB
    [Source: host]
    [Destination: 1.5.1]
    USBPcap pseudoheader length: 27
    IRP ID: 0xffffaf8202433ab0
    IRP USBD_STATUS: USBD_STATUS_SUCCESS (0x00000000)
    URB Function: URB_FUNCTION_SYNC_RESET_PIPE_AND_CLEAR_STALL (0x001e)
    IRP information: 0x00, Direction: FDO -> PDO
    URB bus id: 1
    Device address: 5
    Endpoint: 0x81, Direction: IN
    URB transfer type: USB IRP Info (0xfe)
    Packet Data Length: 0
    [Response in: 38]

No.     Time           Source                Destination           Protocol Length Info 
     38 21.566414      1.5.1                 host                  USB      27     URB_FUNCTION_SYNC_RESET_PIPE_AND_CLEAR_STALL

Frame 38: 27 bytes on wire (216 bits), 27 bytes captured (216 bits)
USB URB
    [Source: 1.5.1]
    [Destination: host]
    USBPcap pseudoheader length: 27
    IRP ID: 0xffffaf8202433ab0
    IRP USBD_STATUS: USBD_STATUS_SUCCESS (0x00000000)
    URB Function: URB_FUNCTION_SYNC_RESET_PIPE_AND_CLEAR_STALL (0x001e)
    IRP information: 0x01, Direction: PDO -> FDO
    URB bus id: 1
    Device address: 5
    Endpoint: 0x81, Direction: IN
    URB transfer type: USB IRP Info (0xfe)
    Packet Data Length: 0
    [Request in: 37]
    [Time from request: 0.000348000 seconds]

No.     Time           Source                Destination           Protocol Length Info 
     39 21.677937      host                  1.5.2                 USB      36     URB_BULK out

Frame 39: 36 bytes on wire (288 bits), 36 bytes captured (288 bits)
USB URB
    [Source: host]
    [Destination: 1.5.2]
    USBPcap pseudoheader length: 27
    IRP ID: 0xffffaf8202732ab0
    IRP USBD_STATUS: USBD_STATUS_SUCCESS (0x00000000)
    URB Function: URB_FUNCTION_BULK_OR_INTERRUPT_TRANSFER (0x0009)
    IRP information: 0x00, Direction: FDO -> PDO
    URB bus id: 1
    Device address: 5
    Endpoint: 0x02, Direction: OUT
    URB transfer type: URB_BULK (0x03)
    Packet Data Length: 9
    [Response in: 40]
    [bInterfaceClass: Printer (0x07)]
Leftover Capture Data: 1b7b5153543a56527d

No.     Time           Source                Destination           Protocol Length Info 
     40 21.677983      1.5.2                 host                  USB      27     URB_BULK out

Frame 40: 27 bytes on wire (216 bits), 27 bytes captured (216 bits)
USB URB
    [Source: 1.5.2]
    [Destination: host]
    USBPcap pseudoheader length: 27
    IRP ID: 0xffffaf8202732ab0
    IRP USBD_STATUS: USBD_STATUS_SUCCESS (0x00000000)
    URB Function: URB_FUNCTION_BULK_OR_INTERRUPT_TRANSFER (0x0009)
    IRP information: 0x01, Direction: PDO -> FDO
    URB bus id: 1
    Device address: 5
    Endpoint: 0x02, Direction: OUT
    URB transfer type: URB_BULK (0x03)
    Packet Data Length: 0
    [Request in: 39]
    [Time from request: 0.000046000 seconds]
    [bInterfaceClass: Printer (0x07)]

No.     Time           Source                Destination           Protocol Length Info 
     41 21.677999      host                  1.5.1                 USB      27     URB_BULK in

Frame 41: 27 bytes on wire (216 bits), 27 bytes captured (216 bits)
USB URB
    [Source: host]
    [Destination: 1.5.1]
    USBPcap pseudoheader length: 27
    IRP ID: 0xffffaf8202732ab0
    IRP USBD_STATUS: USBD_STATUS_SUCCESS (0x00000000)
    URB Function: URB_FUNCTION_BULK_OR_INTERRUPT_TRANSFER (0x0009)
    IRP information: 0x00, Direction: FDO -> PDO
    URB bus id: 1
    Device address: 5
    Endpoint: 0x81, Direction: IN
    URB transfer type: URB_BULK (0x03)
    Packet Data Length: 0
    [Response in: 42]
    [bInterfaceClass: Printer (0x07)]

No.     Time           Source                Destination           Protocol Length Info 
     42 21.708353      1.5.1                 host                  USB      57     URB_BULK in

Frame 42: 57 bytes on wire (456 bits), 57 bytes captured (456 bits)
USB URB
    [Source: 1.5.1]
    [Destination: host]
    USBPcap pseudoheader length: 27
    IRP ID: 0xffffaf8202732ab0
    IRP USBD_STATUS: USBD_STATUS_SUCCESS (0x00000000)
    URB Function: URB_FUNCTION_BULK_OR_INTERRUPT_TRANSFER (0x0009)
    IRP information: 0x01, Direction: PDO -> FDO
    URB bus id: 1
    Device address: 5
    Endpoint: 0x81, Direction: IN
    URB transfer type: URB_BULK (0x03)
    Packet Data Length: 30
    [Request in: 41]
    [Time from request: 0.030354000 seconds]
    [bInterfaceClass: Printer (0x07)]
Leftover Capture Data: 7b5153543a56523a5042353120285665722031312e382e30…

No.     Time           Source                Destination           Protocol Length Info 
     43 21.808506      host                  1.5.2                 USB      33     URB_BULK out

Frame 43: 33 bytes on wire (264 bits), 33 bytes captured (264 bits)
USB URB
    [Source: host]
    [Destination: 1.5.2]
    USBPcap pseudoheader length: 27
    IRP ID: 0xffffaf82026d3010
    IRP USBD_STATUS: USBD_STATUS_SUCCESS (0x00000000)
    URB Function: URB_FUNCTION_BULK_OR_INTERRUPT_TRANSFER (0x0009)
    IRP information: 0x00, Direction: FDO -> PDO
    URB bus id: 1
    Device address: 5
    Endpoint: 0x02, Direction: OUT
    URB transfer type: URB_BULK (0x03)
    Packet Data Length: 6
    [Response in: 44]
    [bInterfaceClass: Printer (0x07)]
Leftover Capture Data: 1b7b49523f7d

No.     Time           Source                Destination           Protocol Length Info 
     44 21.808550      1.5.2                 host                  USB      27     URB_BULK out

Frame 44: 27 bytes on wire (216 bits), 27 bytes captured (216 bits)
USB URB
    [Source: 1.5.2]
    [Destination: host]
    USBPcap pseudoheader length: 27
    IRP ID: 0xffffaf82026d3010
    IRP USBD_STATUS: USBD_STATUS_SUCCESS (0x00000000)
    URB Function: URB_FUNCTION_BULK_OR_INTERRUPT_TRANSFER (0x0009)
    IRP information: 0x01, Direction: PDO -> FDO
    URB bus id: 1
    Device address: 5
    Endpoint: 0x02, Direction: OUT
    URB transfer type: URB_BULK (0x03)
    Packet Data Length: 0
    [Request in: 43]
    [Time from request: 0.000044000 seconds]
    [bInterfaceClass: Printer (0x07)]

No.     Time           Source                Destination           Protocol Length Info 
     45 21.808605      host                  1.5.1                 USB      27     URB_BULK in

Frame 45: 27 bytes on wire (216 bits), 27 bytes captured (216 bits)
USB URB
    [Source: host]
    [Destination: 1.5.1]
    USBPcap pseudoheader length: 27
    IRP ID: 0xffffaf820236e380
    IRP USBD_STATUS: USBD_STATUS_SUCCESS (0x00000000)
    URB Function: URB_FUNCTION_BULK_OR_INTERRUPT_TRANSFER (0x0009)
    IRP information: 0x00, Direction: FDO -> PDO
    URB bus id: 1
    Device address: 5
    Endpoint: 0x81, Direction: IN
    URB transfer type: URB_BULK (0x03)
    Packet Data Length: 0
    [Response in: 46]
    [bInterfaceClass: Printer (0x07)]

No.     Time           Source                Destination           Protocol Length Info 
     46 21.865819      1.5.1                 host                  USB      104    URB_BULK in

Frame 46: 104 bytes on wire (832 bits), 104 bytes captured (832 bits)
USB URB
    [Source: 1.5.1]
    [Destination: host]
    USBPcap pseudoheader length: 27
    IRP ID: 0xffffaf820236e380
    IRP USBD_STATUS: USBD_STATUS_SUCCESS (0x00000000)
    URB Function: URB_FUNCTION_BULK_OR_INTERRUPT_TRANSFER (0x0009)
    IRP information: 0x01, Direction: PDO -> FDO
    URB bus id: 1
    Device address: 5
    Endpoint: 0x81, Direction: IN
    URB transfer type: URB_BULK (0x03)
    Packet Data Length: 77
    [Request in: 45]
    [Time from request: 0.057214000 seconds]
    [bInterfaceClass: Printer (0x07)]
Leftover Capture Data: 7b495221503a4f46463b41563a4e6f7420737570706f7274…

No.     Time           Source                Destination           Protocol Length Info 
     47 21.966055      host                  1.5.2                 USB      36     URB_BULK out

Frame 47: 36 bytes on wire (288 bits), 36 bytes captured (288 bits)
USB URB
    [Source: host]
    [Destination: 1.5.2]
    USBPcap pseudoheader length: 27
    IRP ID: 0xffffaf82027f99b0
    IRP USBD_STATUS: USBD_STATUS_SUCCESS (0x00000000)
    URB Function: URB_FUNCTION_BULK_OR_INTERRUPT_TRANSFER (0x0009)
    IRP information: 0x00, Direction: FDO -> PDO
    URB bus id: 1
    Device address: 5
    Endpoint: 0x02, Direction: OUT
    URB transfer type: URB_BULK (0x03)
    Packet Data Length: 9
    [Response in: 48]
    [bInterfaceClass: Printer (0x07)]
Leftover Capture Data: 1b7b5153543a534e7d

No.     Time           Source                Destination           Protocol Length Info 
     48 21.966100      1.5.2                 host                  USB      27     URB_BULK out

Frame 48: 27 bytes on wire (216 bits), 27 bytes captured (216 bits)
USB URB
    [Source: 1.5.2]
    [Destination: host]
    USBPcap pseudoheader length: 27
    IRP ID: 0xffffaf82027f99b0
    IRP USBD_STATUS: USBD_STATUS_SUCCESS (0x00000000)
    URB Function: URB_FUNCTION_BULK_OR_INTERRUPT_TRANSFER (0x0009)
    IRP information: 0x01, Direction: PDO -> FDO
    URB bus id: 1
    Device address: 5
    Endpoint: 0x02, Direction: OUT
    URB transfer type: URB_BULK (0x03)
    Packet Data Length: 0
    [Request in: 47]
    [Time from request: 0.000045000 seconds]
    [bInterfaceClass: Printer (0x07)]

No.     Time           Source                Destination           Protocol Length Info 
     49 21.966120      host                  1.5.1                 USB      27     URB_BULK in

Frame 49: 27 bytes on wire (216 bits), 27 bytes captured (216 bits)
USB URB
    [Source: host]
    [Destination: 1.5.1]
    USBPcap pseudoheader length: 27
    IRP ID: 0xffffaf820365c010
    IRP USBD_STATUS: USBD_STATUS_SUCCESS (0x00000000)
    URB Function: URB_FUNCTION_BULK_OR_INTERRUPT_TRANSFER (0x0009)
    IRP information: 0x00, Direction: FDO -> PDO
    URB bus id: 1
    Device address: 5
    Endpoint: 0x81, Direction: IN
    URB transfer type: URB_BULK (0x03)
    Packet Data Length: 0
    [Response in: 50]
    [bInterfaceClass: Printer (0x07)]

No.     Time           Source                Destination           Protocol Length Info 
     50 22.015423      1.5.1                 host                  USB      47     URB_BULK in

Frame 50: 47 bytes on wire (376 bits), 47 bytes captured (376 bits)
USB URB
    [Source: 1.5.1]
    [Destination: host]
    USBPcap pseudoheader length: 27
    IRP ID: 0xffffaf820365c010
    IRP USBD_STATUS: USBD_STATUS_SUCCESS (0x00000000)
    URB Function: URB_FUNCTION_BULK_OR_INTERRUPT_TRANSFER (0x0009)
    IRP information: 0x01, Direction: PDO -> FDO
    URB bus id: 1
    Device address: 5
    Endpoint: 0x81, Direction: IN
    URB transfer type: URB_BULK (0x03)
    Packet Data Length: 20
    [Request in: 49]
    [Time from request: 0.049303000 seconds]
    [bInterfaceClass: Printer (0x07)]
Leftover Capture Data: 7b5153543a534e3a32313732313032343030327d

No.     Time           Source                Destination           Protocol Length Info 
     51 22.115646      host                  1.5.2                 USB      48     URB_BULK out

Frame 51: 48 bytes on wire (384 bits), 48 bytes captured (384 bits)
USB URB
    [Source: host]
    [Destination: 1.5.2]
    USBPcap pseudoheader length: 27
    IRP ID: 0xffffaf8202732ab0
    IRP USBD_STATUS: USBD_STATUS_SUCCESS (0x00000000)
    URB Function: URB_FUNCTION_BULK_OR_INTERRUPT_TRANSFER (0x0009)
    IRP information: 0x00, Direction: FDO -> PDO
    URB bus id: 1
    Device address: 5
    Endpoint: 0x02, Direction: OUT
    URB transfer type: URB_BULK (0x03)
    Packet Data Length: 21
    [Response in: 52]
    [bInterfaceClass: Printer (0x07)]
Leftover Capture Data: 1b7b5359533a52554e3a676574656e76204d41437d

No.     Time           Source                Destination           Protocol Length Info 
     52 22.115699      1.5.2                 host                  USB      27     URB_BULK out

Frame 52: 27 bytes on wire (216 bits), 27 bytes captured (216 bits)
USB URB
    [Source: 1.5.2]
    [Destination: host]
    USBPcap pseudoheader length: 27
    IRP ID: 0xffffaf8202732ab0
    IRP USBD_STATUS: USBD_STATUS_SUCCESS (0x00000000)
    URB Function: URB_FUNCTION_BULK_OR_INTERRUPT_TRANSFER (0x0009)
    IRP information: 0x01, Direction: PDO -> FDO
    URB bus id: 1
    Device address: 5
    Endpoint: 0x02, Direction: OUT
    URB transfer type: URB_BULK (0x03)
    Packet Data Length: 0
    [Request in: 51]
    [Time from request: 0.000053000 seconds]
    [bInterfaceClass: Printer (0x07)]

No.     Time           Source                Destination           Protocol Length Info 
     53 22.115753      host                  1.5.1                 USB      27     URB_BULK in

Frame 53: 27 bytes on wire (216 bits), 27 bytes captured (216 bits)
USB URB
    [Source: host]
    [Destination: 1.5.1]
    USBPcap pseudoheader length: 27
    IRP ID: 0xffffaf820237bab0
    IRP USBD_STATUS: USBD_STATUS_SUCCESS (0x00000000)
    URB Function: URB_FUNCTION_BULK_OR_INTERRUPT_TRANSFER (0x0009)
    IRP information: 0x00, Direction: FDO -> PDO
    URB bus id: 1
    Device address: 5
    Endpoint: 0x81, Direction: IN
    URB transfer type: URB_BULK (0x03)
    Packet Data Length: 0
    [Response in: 54]
    [bInterfaceClass: Printer (0x07)]

No.     Time           Source                Destination           Protocol Length Info 
     54 22.169214      1.5.1                 host                  USB      38     URB_BULK in

Frame 54: 38 bytes on wire (304 bits), 38 bytes captured (304 bits)
USB URB
    [Source: 1.5.1]
    [Destination: host]
    USBPcap pseudoheader length: 27
    IRP ID: 0xffffaf820237bab0
    IRP USBD_STATUS: USBD_STATUS_SUCCESS (0x00000000)
    URB Function: URB_FUNCTION_BULK_OR_INTERRUPT_TRANSFER (0x0009)
    IRP information: 0x01, Direction: PDO -> FDO
    URB bus id: 1
    Device address: 5
    Endpoint: 0x81, Direction: IN
    URB transfer type: URB_BULK (0x03)
    Packet Data Length: 11
    [Request in: 53]
    [Time from request: 0.053461000 seconds]
    [bInterfaceClass: Printer (0x07)]
Leftover Capture Data: 7b5359533a52554e3a307d

No.     Time           Source                Destination           Protocol Length Info 
     55 22.269241      host                  1.5.2                 USB      30     URB_BULK out

Frame 55: 30 bytes on wire (240 bits), 30 bytes captured (240 bits)
USB URB
    [Source: host]
    [Destination: 1.5.2]
    USBPcap pseudoheader length: 27
    IRP ID: 0xffffaf82021ac010
    IRP USBD_STATUS: USBD_STATUS_SUCCESS (0x00000000)
    URB Function: URB_FUNCTION_BULK_OR_INTERRUPT_TRANSFER (0x0009)
    IRP information: 0x00, Direction: FDO -> PDO
    URB bus id: 1
    Device address: 5
    Endpoint: 0x02, Direction: OUT
    URB transfer type: URB_BULK (0x03)
    Packet Data Length: 3
    [Response in: 56]
    [bInterfaceClass: Printer (0x07)]
Leftover Capture Data: 1b455a

No.     Time           Source                Destination           Protocol Length Info 
     56 22.269285      1.5.2                 host                  USB      27     URB_BULK out

Frame 56: 27 bytes on wire (216 bits), 27 bytes captured (216 bits)
USB URB
    [Source: 1.5.2]
    [Destination: host]
    USBPcap pseudoheader length: 27
    IRP ID: 0xffffaf82021ac010
    IRP USBD_STATUS: USBD_STATUS_SUCCESS (0x00000000)
    URB Function: URB_FUNCTION_BULK_OR_INTERRUPT_TRANSFER (0x0009)
    IRP information: 0x01, Direction: PDO -> FDO
    URB bus id: 1
    Device address: 5
    Endpoint: 0x02, Direction: OUT
    URB transfer type: URB_BULK (0x03)
    Packet Data Length: 0
    [Request in: 55]
    [Time from request: 0.000044000 seconds]
    [bInterfaceClass: Printer (0x07)]

No.     Time           Source                Destination           Protocol Length Info 
     57 22.269313      host                  1.5.1                 USB      27     URB_BULK in

Frame 57: 27 bytes on wire (216 bits), 27 bytes captured (216 bits)
USB URB
    [Source: host]
    [Destination: 1.5.1]
    USBPcap pseudoheader length: 27
    IRP ID: 0xffffaf8226ae7ab0
    IRP USBD_STATUS: USBD_STATUS_SUCCESS (0x00000000)
    URB Function: URB_FUNCTION_BULK_OR_INTERRUPT_TRANSFER (0x0009)
    IRP information: 0x00, Direction: FDO -> PDO
    URB bus id: 1
    Device address: 5
    Endpoint: 0x81, Direction: IN
    URB transfer type: URB_BULK (0x03)
    Packet Data Length: 0
    [Response in: 58]
    [bInterfaceClass: Printer (0x07)]

No.     Time           Source                Destination           Protocol Length Info 
     58 23.269507      1.5.1                 host                  USB      27     URB_BULK in

Frame 58: 27 bytes on wire (216 bits), 27 bytes captured (216 bits)
USB URB
    [Source: 1.5.1]
    [Destination: host]
    USBPcap pseudoheader length: 27
    IRP ID: 0xffffaf8226ae7ab0
    IRP USBD_STATUS: USBD_STATUS_CANCELED (0xc0010000)
    URB Function: URB_FUNCTION_BULK_OR_INTERRUPT_TRANSFER (0x0009)
    IRP information: 0x01, Direction: PDO -> FDO
    URB bus id: 1
    Device address: 5
    Endpoint: 0x81, Direction: IN
    URB transfer type: URB_BULK (0x03)
    Packet Data Length: 0
    [Request in: 57]
    [Time from request: 1.000194000 seconds]
    [bInterfaceClass: Printer (0x07)]

No.     Time           Source                Destination           Protocol Length Info 
     59 23.269585      host                  1.5.1                 USB      27     URB_FUNCTION_SYNC_RESET_PIPE_AND_CLEAR_STALL

Frame 59: 27 bytes on wire (216 bits), 27 bytes captured (216 bits)
USB URB
    [Source: host]
    [Destination: 1.5.1]
    USBPcap pseudoheader length: 27
    IRP ID: 0xffffaf82025d82b0
    IRP USBD_STATUS: USBD_STATUS_SUCCESS (0x00000000)
    URB Function: URB_FUNCTION_SYNC_RESET_PIPE_AND_CLEAR_STALL (0x001e)
    IRP information: 0x00, Direction: FDO -> PDO
    URB bus id: 1
    Device address: 5
    Endpoint: 0x81, Direction: IN
    URB transfer type: USB IRP Info (0xfe)
    Packet Data Length: 0
    [Response in: 60]

No.     Time           Source                Destination           Protocol Length Info 
     60 23.270259      1.5.1                 host                  USB      27     URB_FUNCTION_SYNC_RESET_PIPE_AND_CLEAR_STALL

Frame 60: 27 bytes on wire (216 bits), 27 bytes captured (216 bits)
USB URB
    [Source: 1.5.1]
    [Destination: host]
    USBPcap pseudoheader length: 27
    IRP ID: 0xffffaf82025d82b0
    IRP USBD_STATUS: USBD_STATUS_SUCCESS (0x00000000)
    URB Function: URB_FUNCTION_SYNC_RESET_PIPE_AND_CLEAR_STALL (0x001e)
    IRP information: 0x01, Direction: PDO -> FDO
    URB bus id: 1
    Device address: 5
    Endpoint: 0x81, Direction: IN
    URB transfer type: USB IRP Info (0xfe)
    Packet Data Length: 0
    [Request in: 59]
    [Time from request: 0.000674000 seconds]

No.     Time           Source                Destination           Protocol Length Info 
     61 23.280386      host                  1.5.1                 USB      27     URB_BULK in

Frame 61: 27 bytes on wire (216 bits), 27 bytes captured (216 bits)
USB URB
    [Source: host]
    [Destination: 1.5.1]
    USBPcap pseudoheader length: 27
    IRP ID: 0xffffaf8202369ab0
    IRP USBD_STATUS: USBD_STATUS_SUCCESS (0x00000000)
    URB Function: URB_FUNCTION_BULK_OR_INTERRUPT_TRANSFER (0x0009)
    IRP information: 0x00, Direction: FDO -> PDO
    URB bus id: 1
    Device address: 5
    Endpoint: 0x81, Direction: IN
    URB transfer type: URB_BULK (0x03)
    Packet Data Length: 0
    [Response in: 62]
    [bInterfaceClass: Printer (0x07)]

No.     Time           Source                Destination           Protocol Length Info 
     62 24.280763      1.5.1                 host                  USB      27     URB_BULK in

Frame 62: 27 bytes on wire (216 bits), 27 bytes captured (216 bits)
USB URB
    [Source: 1.5.1]
    [Destination: host]
    USBPcap pseudoheader length: 27
    IRP ID: 0xffffaf8202369ab0
    IRP USBD_STATUS: USBD_STATUS_CANCELED (0xc0010000)
    URB Function: URB_FUNCTION_BULK_OR_INTERRUPT_TRANSFER (0x0009)
    IRP information: 0x01, Direction: PDO -> FDO
    URB bus id: 1
    Device address: 5
    Endpoint: 0x81, Direction: IN
    URB transfer type: URB_BULK (0x03)
    Packet Data Length: 0
    [Request in: 61]
    [Time from request: 1.000377000 seconds]
    [bInterfaceClass: Printer (0x07)]

No.     Time           Source                Destination           Protocol Length Info 
     63 24.280853      host                  1.5.1                 USB      27     URB_FUNCTION_SYNC_RESET_PIPE_AND_CLEAR_STALL

Frame 63: 27 bytes on wire (216 bits), 27 bytes captured (216 bits)
USB URB
    [Source: host]
    [Destination: 1.5.1]
    USBPcap pseudoheader length: 27
    IRP ID: 0xffffaf8221a77ab0
    IRP USBD_STATUS: USBD_STATUS_SUCCESS (0x00000000)
    URB Function: URB_FUNCTION_SYNC_RESET_PIPE_AND_CLEAR_STALL (0x001e)
    IRP information: 0x00, Direction: FDO -> PDO
    URB bus id: 1
    Device address: 5
    Endpoint: 0x81, Direction: IN
    URB transfer type: USB IRP Info (0xfe)
    Packet Data Length: 0
    [Response in: 64]

No.     Time           Source                Destination           Protocol Length Info 
     64 24.281209      1.5.1                 host                  USB      27     URB_FUNCTION_SYNC_RESET_PIPE_AND_CLEAR_STALL

Frame 64: 27 bytes on wire (216 bits), 27 bytes captured (216 bits)
USB URB
    [Source: 1.5.1]
    [Destination: host]
    USBPcap pseudoheader length: 27
    IRP ID: 0xffffaf8221a77ab0
    IRP USBD_STATUS: USBD_STATUS_SUCCESS (0x00000000)
    URB Function: URB_FUNCTION_SYNC_RESET_PIPE_AND_CLEAR_STALL (0x001e)
    IRP information: 0x01, Direction: PDO -> FDO
    URB bus id: 1
    Device address: 5
    Endpoint: 0x81, Direction: IN
    URB transfer type: USB IRP Info (0xfe)
    Packet Data Length: 0
    [Request in: 63]
    [Time from request: 0.000356000 seconds]

No.     Time           Source                Destination           Protocol Length Info 
     65 24.392688      host                  1.5.2                 USB      68     URB_BULK out

Frame 65: 68 bytes on wire (544 bits), 68 bytes captured (544 bits)
USB URB
    [Source: host]
    [Destination: 1.5.2]
    USBPcap pseudoheader length: 27
    IRP ID: 0xffffaf8202364010
    IRP USBD_STATUS: USBD_STATUS_SUCCESS (0x00000000)
    URB Function: URB_FUNCTION_BULK_OR_INTERRUPT_TRANSFER (0x0009)
    IRP information: 0x00, Direction: FDO -> PDO
    URB bus id: 1
    Device address: 5
    Endpoint: 0x02, Direction: OUT
    URB transfer type: URB_BULK (0x03)
    Packet Data Length: 41
    [Response in: 66]
    [bInterfaceClass: Printer (0x07)]
Leftover Capture Data: 7b53432c4e3120252c4e352041524142542c442041726162…

No.     Time           Source                Destination           Protocol Length Info 
     66 24.392753      1.5.2                 host                  USB      27     URB_BULK out

Frame 66: 27 bytes on wire (216 bits), 27 bytes captured (216 bits)
USB URB
    [Source: 1.5.2]
    [Destination: host]
    USBPcap pseudoheader length: 27
    IRP ID: 0xffffaf8202364010
    IRP USBD_STATUS: USBD_STATUS_SUCCESS (0x00000000)
    URB Function: URB_FUNCTION_BULK_OR_INTERRUPT_TRANSFER (0x0009)
    IRP information: 0x01, Direction: PDO -> FDO
    URB bus id: 1
    Device address: 5
    Endpoint: 0x02, Direction: OUT
    URB transfer type: URB_BULK (0x03)
    Packet Data Length: 0
    [Request in: 65]
    [Time from request: 0.000065000 seconds]
    [bInterfaceClass: Printer (0x07)]

No.     Time           Source                Destination           Protocol Length Info 
     67 24.392811      host                  1.5.1                 USB      27     URB_BULK in

Frame 67: 27 bytes on wire (216 bits), 27 bytes captured (216 bits)
USB URB
    [Source: host]
    [Destination: 1.5.1]
    USBPcap pseudoheader length: 27
    IRP ID: 0xffffaf8202364010
    IRP USBD_STATUS: USBD_STATUS_SUCCESS (0x00000000)
    URB Function: URB_FUNCTION_BULK_OR_INTERRUPT_TRANSFER (0x0009)
    IRP information: 0x00, Direction: FDO -> PDO
    URB bus id: 1
    Device address: 5
    Endpoint: 0x81, Direction: IN
    URB transfer type: URB_BULK (0x03)
    Packet Data Length: 0
    [Response in: 68]
    [bInterfaceClass: Printer (0x07)]

No.     Time           Source                Destination           Protocol Length Info 
     68 25.392788      1.5.1                 host                  USB      27     URB_BULK in

Frame 68: 27 bytes on wire (216 bits), 27 bytes captured (216 bits)
USB URB
    [Source: 1.5.1]
    [Destination: host]
    USBPcap pseudoheader length: 27
    IRP ID: 0xffffaf8202364010
    IRP USBD_STATUS: USBD_STATUS_CANCELED (0xc0010000)
    URB Function: URB_FUNCTION_BULK_OR_INTERRUPT_TRANSFER (0x0009)
    IRP information: 0x01, Direction: PDO -> FDO
    URB bus id: 1
    Device address: 5
    Endpoint: 0x81, Direction: IN
    URB transfer type: URB_BULK (0x03)
    Packet Data Length: 0
    [Request in: 67]
    [Time from request: 0.999977000 seconds]
    [bInterfaceClass: Printer (0x07)]

No.     Time           Source                Destination           Protocol Length Info 
     69 25.392844      host                  1.5.1                 USB      27     URB_FUNCTION_SYNC_RESET_PIPE_AND_CLEAR_STALL

Frame 69: 27 bytes on wire (216 bits), 27 bytes captured (216 bits)
USB URB
    [Source: host]
    [Destination: 1.5.1]
    USBPcap pseudoheader length: 27
    IRP ID: 0xffffaf8202254ab0
    IRP USBD_STATUS: USBD_STATUS_SUCCESS (0x00000000)
    URB Function: URB_FUNCTION_SYNC_RESET_PIPE_AND_CLEAR_STALL (0x001e)
    IRP information: 0x00, Direction: FDO -> PDO
    URB bus id: 1
    Device address: 5
    Endpoint: 0x81, Direction: IN
    URB transfer type: USB IRP Info (0xfe)
    Packet Data Length: 0
    [Response in: 70]

No.     Time           Source                Destination           Protocol Length Info 
     70 25.393199      1.5.1                 host                  USB      27     URB_FUNCTION_SYNC_RESET_PIPE_AND_CLEAR_STALL

Frame 70: 27 bytes on wire (216 bits), 27 bytes captured (216 bits)
USB URB
    [Source: 1.5.1]
    [Destination: host]
    USBPcap pseudoheader length: 27
    IRP ID: 0xffffaf8202254ab0
    IRP USBD_STATUS: USBD_STATUS_SUCCESS (0x00000000)
    URB Function: URB_FUNCTION_SYNC_RESET_PIPE_AND_CLEAR_STALL (0x001e)
    IRP information: 0x01, Direction: PDO -> FDO
    URB bus id: 1
    Device address: 5
    Endpoint: 0x81, Direction: IN
    URB transfer type: USB IRP Info (0xfe)
    Packet Data Length: 0
    [Request in: 69]
    [Time from request: 0.000355000 seconds]

No.     Time           Source                Destination           Protocol Length Info 
     71 25.402927      host                  1.5.1                 USB      27     URB_BULK in

Frame 71: 27 bytes on wire (216 bits), 27 bytes captured (216 bits)
USB URB
    [Source: host]
    [Destination: 1.5.1]
    USBPcap pseudoheader length: 27
    IRP ID: 0xffffaf8202732ab0
    IRP USBD_STATUS: USBD_STATUS_SUCCESS (0x00000000)
    URB Function: URB_FUNCTION_BULK_OR_INTERRUPT_TRANSFER (0x0009)
    IRP information: 0x00, Direction: FDO -> PDO
    URB bus id: 1
    Device address: 5
    Endpoint: 0x81, Direction: IN
    URB transfer type: URB_BULK (0x03)
    Packet Data Length: 0
    [Response in: 72]
    [bInterfaceClass: Printer (0x07)]

No.     Time           Source                Destination           Protocol Length Info 
     72 26.403101      1.5.1                 host                  USB      27     URB_BULK in

Frame 72: 27 bytes on wire (216 bits), 27 bytes captured (216 bits)
USB URB
    [Source: 1.5.1]
    [Destination: host]
    USBPcap pseudoheader length: 27
    IRP ID: 0xffffaf8202732ab0
    IRP USBD_STATUS: USBD_STATUS_CANCELED (0xc0010000)
    URB Function: URB_FUNCTION_BULK_OR_INTERRUPT_TRANSFER (0x0009)
    IRP information: 0x01, Direction: PDO -> FDO
    URB bus id: 1
    Device address: 5
    Endpoint: 0x81, Direction: IN
    URB transfer type: URB_BULK (0x03)
    Packet Data Length: 0
    [Request in: 71]
    [Time from request: 1.000174000 seconds]
    [bInterfaceClass: Printer (0x07)]

No.     Time           Source                Destination           Protocol Length Info 
     73 26.403125      host                  1.5.1                 USB      27     URB_FUNCTION_SYNC_RESET_PIPE_AND_CLEAR_STALL

Frame 73: 27 bytes on wire (216 bits), 27 bytes captured (216 bits)
USB URB
    [Source: host]
    [Destination: 1.5.1]
    USBPcap pseudoheader length: 27
    IRP ID: 0xffffaf8202254ab0
    IRP USBD_STATUS: USBD_STATUS_SUCCESS (0x00000000)
    URB Function: URB_FUNCTION_SYNC_RESET_PIPE_AND_CLEAR_STALL (0x001e)
    IRP information: 0x00, Direction: FDO -> PDO
    URB bus id: 1
    Device address: 5
    Endpoint: 0x81, Direction: IN
    URB transfer type: USB IRP Info (0xfe)
    Packet Data Length: 0
    [Response in: 74]

No.     Time           Source                Destination           Protocol Length Info 
     74 26.403454      1.5.1                 host                  USB      27     URB_FUNCTION_SYNC_RESET_PIPE_AND_CLEAR_STALL

Frame 74: 27 bytes on wire (216 bits), 27 bytes captured (216 bits)
USB URB
    [Source: 1.5.1]
    [Destination: host]
    USBPcap pseudoheader length: 27
    IRP ID: 0xffffaf8202254ab0
    IRP USBD_STATUS: USBD_STATUS_SUCCESS (0x00000000)
    URB Function: URB_FUNCTION_SYNC_RESET_PIPE_AND_CLEAR_STALL (0x001e)
    IRP information: 0x01, Direction: PDO -> FDO
    URB bus id: 1
    Device address: 5
    Endpoint: 0x81, Direction: IN
    URB transfer type: USB IRP Info (0xfe)
    Packet Data Length: 0
    [Request in: 73]
    [Time from request: 0.000329000 seconds]

No.     Time           Source                Destination           Protocol Length Info 
     75 26.516021      host                  1.5.2                 USB      4130   URB_BULK out

Frame 75: 4130 bytes on wire (33040 bits), 4130 bytes captured (33040 bits)
USB URB
    [Source: host]
    [Destination: 1.5.2]
    USBPcap pseudoheader length: 27
    IRP ID: 0xffffaf8225cb1010
    IRP USBD_STATUS: USBD_STATUS_SUCCESS (0x00000000)
    URB Function: URB_FUNCTION_BULK_OR_INTERRUPT_TRANSFER (0x0009)
    IRP information: 0x00, Direction: FDO -> PDO
    URB bus id: 1
    Device address: 5
    Endpoint: 0x02, Direction: OUT
    URB transfer type: URB_BULK (0x03)
    Packet Data Length: 4103
    [Response in: 76]
    [bInterfaceClass: Printer (0x07)]
Leftover Capture Data: 7b20001036230000312e3044415241425425000a00140002…

No.     Time           Source                Destination           Protocol Length Info 
     76 26.519481      1.5.2                 host                  USB      27     URB_BULK out

Frame 76: 27 bytes on wire (216 bits), 27 bytes captured (216 bits)
USB URB
    [Source: 1.5.2]
    [Destination: host]
    USBPcap pseudoheader length: 27
    IRP ID: 0xffffaf8225cb1010
    IRP USBD_STATUS: USBD_STATUS_SUCCESS (0x00000000)
    URB Function: URB_FUNCTION_BULK_OR_INTERRUPT_TRANSFER (0x0009)
    IRP information: 0x01, Direction: PDO -> FDO
    URB bus id: 1
    Device address: 5
    Endpoint: 0x02, Direction: OUT
    URB transfer type: URB_BULK (0x03)
    Packet Data Length: 0
    [Request in: 75]
    [Time from request: 0.003460000 seconds]
    [bInterfaceClass: Printer (0x07)]

No.     Time           Source                Destination           Protocol Length Info 
     77 26.519536      host                  1.5.1                 USB      27     URB_BULK in

Frame 77: 27 bytes on wire (216 bits), 27 bytes captured (216 bits)
USB URB
    [Source: host]
    [Destination: 1.5.1]
    USBPcap pseudoheader length: 27
    IRP ID: 0xffffaf8225cb1010
    IRP USBD_STATUS: USBD_STATUS_SUCCESS (0x00000000)
    URB Function: URB_FUNCTION_BULK_OR_INTERRUPT_TRANSFER (0x0009)
    IRP information: 0x00, Direction: FDO -> PDO
    URB bus id: 1
    Device address: 5
    Endpoint: 0x81, Direction: IN
    URB transfer type: URB_BULK (0x03)
    Packet Data Length: 0
    [Response in: 78]
    [bInterfaceClass: Printer (0x07)]

No.     Time           Source                Destination           Protocol Length Info 
     78 26.613856      1.5.1                 host                  USB      32     URB_BULK in

Frame 78: 32 bytes on wire (256 bits), 32 bytes captured (256 bits)
USB URB
    [Source: 1.5.1]
    [Destination: host]
    USBPcap pseudoheader length: 27
    IRP ID: 0xffffaf8225cb1010
    IRP USBD_STATUS: USBD_STATUS_SUCCESS (0x00000000)
    URB Function: URB_FUNCTION_BULK_OR_INTERRUPT_TRANSFER (0x0009)
    IRP information: 0x01, Direction: PDO -> FDO
    URB bus id: 1
    Device address: 5
    Endpoint: 0x81, Direction: IN
    URB transfer type: URB_BULK (0x03)
    Packet Data Length: 5
    [Request in: 77]
    [Time from request: 0.094320000 seconds]
    [bInterfaceClass: Printer (0x07)]
Leftover Capture Data: 7b41e5587d

No.     Time           Source                Destination           Protocol Length Info 
     79 26.714335      host                  1.5.2                 USB      4130   URB_BULK out

Frame 79: 4130 bytes on wire (33040 bits), 4130 bytes captured (33040 bits)
USB URB
    [Source: host]
    [Destination: 1.5.2]
    USBPcap pseudoheader length: 27
    IRP ID: 0xffffaf8225cb1010
    IRP USBD_STATUS: USBD_STATUS_SUCCESS (0x00000000)
    URB Function: URB_FUNCTION_BULK_OR_INTERRUPT_TRANSFER (0x0009)
    IRP information: 0x00, Direction: FDO -> PDO
    URB bus id: 1
    Device address: 5
    Endpoint: 0x02, Direction: OUT
    URB transfer type: URB_BULK (0x03)
    Packet Data Length: 4103
    [Response in: 80]
    [bInterfaceClass: Printer (0x07)]
Leftover Capture Data: 7b20001000000000000000000000000000000000ffc00000…

No.     Time           Source                Destination           Protocol Length Info 
     80 26.717913      1.5.2                 host                  USB      27     URB_BULK out

Frame 80: 27 bytes on wire (216 bits), 27 bytes captured (216 bits)
USB URB
    [Source: 1.5.2]
    [Destination: host]
    USBPcap pseudoheader length: 27
    IRP ID: 0xffffaf8225cb1010
    IRP USBD_STATUS: USBD_STATUS_SUCCESS (0x00000000)
    URB Function: URB_FUNCTION_BULK_OR_INTERRUPT_TRANSFER (0x0009)
    IRP information: 0x01, Direction: PDO -> FDO
    URB bus id: 1
    Device address: 5
    Endpoint: 0x02, Direction: OUT
    URB transfer type: URB_BULK (0x03)
    Packet Data Length: 0
    [Request in: 79]
    [Time from request: 0.003578000 seconds]
    [bInterfaceClass: Printer (0x07)]

No.     Time           Source                Destination           Protocol Length Info 
     81 26.717935      host                  1.5.1                 USB      27     URB_BULK in

Frame 81: 27 bytes on wire (216 bits), 27 bytes captured (216 bits)
USB URB
    [Source: host]
    [Destination: 1.5.1]
    USBPcap pseudoheader length: 27
    IRP ID: 0xffffaf8225cb1010
    IRP USBD_STATUS: USBD_STATUS_SUCCESS (0x00000000)
    URB Function: URB_FUNCTION_BULK_OR_INTERRUPT_TRANSFER (0x0009)
    IRP information: 0x00, Direction: FDO -> PDO
    URB bus id: 1
    Device address: 5
    Endpoint: 0x81, Direction: IN
    URB transfer type: URB_BULK (0x03)
    Packet Data Length: 0
    [Response in: 82]
    [bInterfaceClass: Printer (0x07)]

No.     Time           Source                Destination           Protocol Length Info 
     82 26.805709      1.5.1                 host                  USB      32     URB_BULK in

Frame 82: 32 bytes on wire (256 bits), 32 bytes captured (256 bits)
USB URB
    [Source: 1.5.1]
    [Destination: host]
    USBPcap pseudoheader length: 27
    IRP ID: 0xffffaf8225cb1010
    IRP USBD_STATUS: USBD_STATUS_SUCCESS (0x00000000)
    URB Function: URB_FUNCTION_BULK_OR_INTERRUPT_TRANSFER (0x0009)
    IRP information: 0x01, Direction: PDO -> FDO
    URB bus id: 1
    Device address: 5
    Endpoint: 0x81, Direction: IN
    URB transfer type: URB_BULK (0x03)
    Packet Data Length: 5
    [Request in: 81]
    [Time from request: 0.087774000 seconds]
    [bInterfaceClass: Printer (0x07)]
Leftover Capture Data: 7b41e5587d

No.     Time           Source                Destination           Protocol Length Info 
     83 26.905838      host                  1.5.2                 USB      856    URB_BULK out

Frame 83: 856 bytes on wire (6848 bits), 856 bytes captured (6848 bits)
USB URB
    [Source: host]
    [Destination: 1.5.2]
    USBPcap pseudoheader length: 27
    IRP ID: 0xffffaf8202419010
    IRP USBD_STATUS: USBD_STATUS_SUCCESS (0x00000000)
    URB Function: URB_FUNCTION_BULK_OR_INTERRUPT_TRANSFER (0x0009)
    IRP information: 0x00, Direction: FDO -> PDO
    URB bus id: 1
    Device address: 5
    Endpoint: 0x02, Direction: OUT
    URB transfer type: URB_BULK (0x03)
    Packet Data Length: 829
    [Response in: 84]
    [bInterfaceClass: Printer (0x07)]
Leftover Capture Data: 7b20360301804bc0ce40cfc087808400cc00fc0078000000…

No.     Time           Source                Destination           Protocol Length Info 
     84 26.906555      1.5.2                 host                  USB      27     URB_BULK out

Frame 84: 27 bytes on wire (216 bits), 27 bytes captured (216 bits)
USB URB
    [Source: 1.5.2]
    [Destination: host]
    USBPcap pseudoheader length: 27
    IRP ID: 0xffffaf8202419010
    IRP USBD_STATUS: USBD_STATUS_SUCCESS (0x00000000)
    URB Function: URB_FUNCTION_BULK_OR_INTERRUPT_TRANSFER (0x0009)
    IRP information: 0x01, Direction: PDO -> FDO
    URB bus id: 1
    Device address: 5
    Endpoint: 0x02, Direction: OUT
    URB transfer type: URB_BULK (0x03)
    Packet Data Length: 0
    [Request in: 83]
    [Time from request: 0.000717000 seconds]
    [bInterfaceClass: Printer (0x07)]

No.     Time           Source                Destination           Protocol Length Info 
     85 26.906579      host                  1.5.1                 USB      27     URB_BULK in

Frame 85: 27 bytes on wire (216 bits), 27 bytes captured (216 bits)
USB URB
    [Source: host]
    [Destination: 1.5.1]
    USBPcap pseudoheader length: 27
    IRP ID: 0xffffaf8225cb1010
    IRP USBD_STATUS: USBD_STATUS_SUCCESS (0x00000000)
    URB Function: URB_FUNCTION_BULK_OR_INTERRUPT_TRANSFER (0x0009)
    IRP information: 0x00, Direction: FDO -> PDO
    URB bus id: 1
    Device address: 5
    Endpoint: 0x81, Direction: IN
    URB transfer type: URB_BULK (0x03)
    Packet Data Length: 0
    [Response in: 86]
    [bInterfaceClass: Printer (0x07)]

No.     Time           Source                Destination           Protocol Length Info 
     86 27.008631      1.5.1                 host                  USB      32     URB_BULK in

Frame 86: 32 bytes on wire (256 bits), 32 bytes captured (256 bits)
USB URB
    [Source: 1.5.1]
    [Destination: host]
    USBPcap pseudoheader length: 27
    IRP ID: 0xffffaf8225cb1010
    IRP USBD_STATUS: USBD_STATUS_SUCCESS (0x00000000)
    URB Function: URB_FUNCTION_BULK_OR_INTERRUPT_TRANSFER (0x0009)
    IRP information: 0x01, Direction: PDO -> FDO
    URB bus id: 1
    Device address: 5
    Endpoint: 0x81, Direction: IN
    URB transfer type: URB_BULK (0x03)
    Packet Data Length: 5
    [Request in: 85]
    [Time from request: 0.102052000 seconds]
    [bInterfaceClass: Printer (0x07)]
Leftover Capture Data: 7b41e5587d

No.     Time           Source                Destination           Protocol Length Info 
     87 27.109281      host                  1.5.2                 USB      32     URB_BULK out

Frame 87: 32 bytes on wire (256 bits), 32 bytes captured (256 bits)
USB URB
    [Source: host]
    [Destination: 1.5.2]
    USBPcap pseudoheader length: 27
    IRP ID: 0xffffaf82027a1010
    IRP USBD_STATUS: USBD_STATUS_SUCCESS (0x00000000)
    URB Function: URB_FUNCTION_BULK_OR_INTERRUPT_TRANSFER (0x0009)
    IRP information: 0x00, Direction: FDO -> PDO
    URB bus id: 1
    Device address: 5
    Endpoint: 0x02, Direction: OUT
    URB transfer type: URB_BULK (0x03)
    Packet Data Length: 5
    [Response in: 88]
    [bInterfaceClass: Printer (0x07)]
Leftover Capture Data: 7b45612e7d

No.     Time           Source                Destination           Protocol Length Info 
     88 27.109326      1.5.2                 host                  USB      27     URB_BULK out

Frame 88: 27 bytes on wire (216 bits), 27 bytes captured (216 bits)
USB URB
    [Source: 1.5.2]
    [Destination: host]
    USBPcap pseudoheader length: 27
    IRP ID: 0xffffaf82027a1010
    IRP USBD_STATUS: USBD_STATUS_SUCCESS (0x00000000)
    URB Function: URB_FUNCTION_BULK_OR_INTERRUPT_TRANSFER (0x0009)
    IRP information: 0x01, Direction: PDO -> FDO
    URB bus id: 1
    Device address: 5
    Endpoint: 0x02, Direction: OUT
    URB transfer type: URB_BULK (0x03)
    Packet Data Length: 0
    [Request in: 87]
    [Time from request: 0.000045000 seconds]
    [bInterfaceClass: Printer (0x07)]

No.     Time           Source                Destination           Protocol Length Info 
     89 27.109352      host                  1.5.1                 USB      27     URB_BULK in

Frame 89: 27 bytes on wire (216 bits), 27 bytes captured (216 bits)
USB URB
    [Source: host]
    [Destination: 1.5.1]
    USBPcap pseudoheader length: 27
    IRP ID: 0xffffaf8202018010
    IRP USBD_STATUS: USBD_STATUS_SUCCESS (0x00000000)
    URB Function: URB_FUNCTION_BULK_OR_INTERRUPT_TRANSFER (0x0009)
    IRP information: 0x00, Direction: FDO -> PDO
    URB bus id: 1
    Device address: 5
    Endpoint: 0x81, Direction: IN
    URB transfer type: URB_BULK (0x03)
    Packet Data Length: 0
    [Response in: 90]
    [bInterfaceClass: Printer (0x07)]

No.     Time           Source                Destination           Protocol Length Info 
     90 27.180510      1.5.1                 host                  USB      32     URB_BULK in

Frame 90: 32 bytes on wire (256 bits), 32 bytes captured (256 bits)
USB URB
    [Source: 1.5.1]
    [Destination: host]
    USBPcap pseudoheader length: 27
    IRP ID: 0xffffaf8202018010
    IRP USBD_STATUS: USBD_STATUS_SUCCESS (0x00000000)
    URB Function: URB_FUNCTION_BULK_OR_INTERRUPT_TRANSFER (0x0009)
    IRP information: 0x01, Direction: PDO -> FDO
    URB bus id: 1
    Device address: 5
    Endpoint: 0x81, Direction: IN
    URB transfer type: URB_BULK (0x03)
    Packet Data Length: 5
    [Request in: 89]
    [Time from request: 0.071158000 seconds]
    [bInterfaceClass: Printer (0x07)]
Leftover Capture Data: 7b4440087d

No.     Time           Source                Destination           Protocol Length Info 
     91 27.280912      host                  1.5.2                 USB      34     URB_BULK out

Frame 91: 34 bytes on wire (272 bits), 34 bytes captured (272 bits)
USB URB
    [Source: host]
    [Destination: 1.5.2]
    USBPcap pseudoheader length: 27
    IRP ID: 0xffffaf8203614010
    IRP USBD_STATUS: USBD_STATUS_SUCCESS (0x00000000)
    URB Function: URB_FUNCTION_BULK_OR_INTERRUPT_TRANSFER (0x0009)
    IRP information: 0x00, Direction: FDO -> PDO
    URB bus id: 1
    Device address: 5
    Endpoint: 0x02, Direction: OUT
    URB transfer type: URB_BULK (0x03)
    Packet Data Length: 7
    [Response in: 92]
    [bInterfaceClass: Printer (0x07)]
Leftover Capture Data: 1b455a7b4c507d

No.     Time           Source                Destination           Protocol Length Info 
     92 27.280985      1.5.2                 host                  USB      27     URB_BULK out

Frame 92: 27 bytes on wire (216 bits), 27 bytes captured (216 bits)
USB URB
    [Source: 1.5.2]
    [Destination: host]
    USBPcap pseudoheader length: 27
    IRP ID: 0xffffaf8203614010
    IRP USBD_STATUS: USBD_STATUS_SUCCESS (0x00000000)
    URB Function: URB_FUNCTION_BULK_OR_INTERRUPT_TRANSFER (0x0009)
    IRP information: 0x01, Direction: PDO -> FDO
    URB bus id: 1
    Device address: 5
    Endpoint: 0x02, Direction: OUT
    URB transfer type: URB_BULK (0x03)
    Packet Data Length: 0
    [Request in: 91]
    [Time from request: 0.000073000 seconds]
    [bInterfaceClass: Printer (0x07)]

No.     Time           Source                Destination           Protocol Length Info 
     93 27.281016      host                  1.5.1                 USB      27     URB_BULK in

Frame 93: 27 bytes on wire (216 bits), 27 bytes captured (216 bits)
USB URB
    [Source: host]
    [Destination: 1.5.1]
    USBPcap pseudoheader length: 27
    IRP ID: 0xffffaf82023d4ab0
    IRP USBD_STATUS: USBD_STATUS_SUCCESS (0x00000000)
    URB Function: URB_FUNCTION_BULK_OR_INTERRUPT_TRANSFER (0x0009)
    IRP information: 0x00, Direction: FDO -> PDO
    URB bus id: 1
    Device address: 5
    Endpoint: 0x81, Direction: IN
    URB transfer type: URB_BULK (0x03)
    Packet Data Length: 0
    [Response in: 94]
    [bInterfaceClass: Printer (0x07)]

No.     Time           Source                Destination           Protocol Length Info 
     94 28.281034      1.5.1                 host                  USB      27     URB_BULK in

Frame 94: 27 bytes on wire (216 bits), 27 bytes captured (216 bits)
USB URB
    [Source: 1.5.1]
    [Destination: host]
    USBPcap pseudoheader length: 27
    IRP ID: 0xffffaf82023d4ab0
    IRP USBD_STATUS: USBD_STATUS_CANCELED (0xc0010000)
    URB Function: URB_FUNCTION_BULK_OR_INTERRUPT_TRANSFER (0x0009)
    IRP information: 0x01, Direction: PDO -> FDO
    URB bus id: 1
    Device address: 5
    Endpoint: 0x81, Direction: IN
    URB transfer type: URB_BULK (0x03)
    Packet Data Length: 0
    [Request in: 93]
    [Time from request: 1.000018000 seconds]
    [bInterfaceClass: Printer (0x07)]

No.     Time           Source                Destination           Protocol Length Info 
     95 28.281071      host                  1.5.1                 USB      27     URB_FUNCTION_SYNC_RESET_PIPE_AND_CLEAR_STALL

Frame 95: 27 bytes on wire (216 bits), 27 bytes captured (216 bits)
USB URB
    [Source: host]
    [Destination: 1.5.1]
    USBPcap pseudoheader length: 27
    IRP ID: 0xffffaf822191a910
    IRP USBD_STATUS: USBD_STATUS_SUCCESS (0x00000000)
    URB Function: URB_FUNCTION_SYNC_RESET_PIPE_AND_CLEAR_STALL (0x001e)
    IRP information: 0x00, Direction: FDO -> PDO
    URB bus id: 1
    Device address: 5
    Endpoint: 0x81, Direction: IN
    URB transfer type: USB IRP Info (0xfe)
    Packet Data Length: 0
    [Response in: 96]

No.     Time           Source                Destination           Protocol Length Info 
     96 28.281399      1.5.1                 host                  USB      27     URB_FUNCTION_SYNC_RESET_PIPE_AND_CLEAR_STALL

Frame 96: 27 bytes on wire (216 bits), 27 bytes captured (216 bits)
USB URB
    [Source: 1.5.1]
    [Destination: host]
    USBPcap pseudoheader length: 27
    IRP ID: 0xffffaf822191a910
    IRP USBD_STATUS: USBD_STATUS_SUCCESS (0x00000000)
    URB Function: URB_FUNCTION_SYNC_RESET_PIPE_AND_CLEAR_STALL (0x001e)
    IRP information: 0x01, Direction: PDO -> FDO
    URB bus id: 1
    Device address: 5
    Endpoint: 0x81, Direction: IN
    URB transfer type: USB IRP Info (0xfe)
    Packet Data Length: 0
    [Request in: 95]
    [Time from request: 0.000328000 seconds]

No.     Time           Source                Destination           Protocol Length Info 
     97 28.291949      host                  1.5.1                 USB      27     URB_BULK in

Frame 97: 27 bytes on wire (216 bits), 27 bytes captured (216 bits)
USB URB
    [Source: host]
    [Destination: 1.5.1]
    USBPcap pseudoheader length: 27
    IRP ID: 0xffffaf82027d6ab0
    IRP USBD_STATUS: USBD_STATUS_SUCCESS (0x00000000)
    URB Function: URB_FUNCTION_BULK_OR_INTERRUPT_TRANSFER (0x0009)
    IRP information: 0x00, Direction: FDO -> PDO
    URB bus id: 1
    Device address: 5
    Endpoint: 0x81, Direction: IN
    URB transfer type: URB_BULK (0x03)
    Packet Data Length: 0
    [Response in: 98]
    [bInterfaceClass: Printer (0x07)]

No.     Time           Source                Destination           Protocol Length Info 
     98 29.292332      1.5.1                 host                  USB      27     URB_BULK in

Frame 98: 27 bytes on wire (216 bits), 27 bytes captured (216 bits)
USB URB
    [Source: 1.5.1]
    [Destination: host]
    USBPcap pseudoheader length: 27
    IRP ID: 0xffffaf82027d6ab0
    IRP USBD_STATUS: USBD_STATUS_CANCELED (0xc0010000)
    URB Function: URB_FUNCTION_BULK_OR_INTERRUPT_TRANSFER (0x0009)
    IRP information: 0x01, Direction: PDO -> FDO
    URB bus id: 1
    Device address: 5
    Endpoint: 0x81, Direction: IN
    URB transfer type: URB_BULK (0x03)
    Packet Data Length: 0
    [Request in: 97]
    [Time from request: 1.000383000 seconds]
    [bInterfaceClass: Printer (0x07)]

No.     Time           Source                Destination           Protocol Length Info 
     99 29.292431      host                  1.5.1                 USB      27     URB_FUNCTION_SYNC_RESET_PIPE_AND_CLEAR_STALL

Frame 99: 27 bytes on wire (216 bits), 27 bytes captured (216 bits)
USB URB
    [Source: host]
    [Destination: 1.5.1]
    USBPcap pseudoheader length: 27
    IRP ID: 0xffffaf820228e010
    IRP USBD_STATUS: USBD_STATUS_SUCCESS (0x00000000)
    URB Function: URB_FUNCTION_SYNC_RESET_PIPE_AND_CLEAR_STALL (0x001e)
    IRP information: 0x00, Direction: FDO -> PDO
    URB bus id: 1
    Device address: 5
    Endpoint: 0x81, Direction: IN
    URB transfer type: USB IRP Info (0xfe)
    Packet Data Length: 0
    [Response in: 100]

No.     Time           Source                Destination           Protocol Length Info 
    100 29.292800      1.5.1                 host                  USB      27     URB_FUNCTION_SYNC_RESET_PIPE_AND_CLEAR_STALL

Frame 100: 27 bytes on wire (216 bits), 27 bytes captured (216 bits)
USB URB
    [Source: 1.5.1]
    [Destination: host]
    USBPcap pseudoheader length: 27
    IRP ID: 0xffffaf820228e010
    IRP USBD_STATUS: USBD_STATUS_SUCCESS (0x00000000)
    URB Function: URB_FUNCTION_SYNC_RESET_PIPE_AND_CLEAR_STALL (0x001e)
    IRP information: 0x01, Direction: PDO -> FDO
    URB bus id: 1
    Device address: 5
    Endpoint: 0x81, Direction: IN
    URB transfer type: USB IRP Info (0xfe)
    Packet Data Length: 0
    [Request in: 99]
    [Time from request: 0.000369000 seconds]

No.     Time           Source                Destination           Protocol Length Info 
    101 29.405281      host                  1.5.2                 USB      33     URB_BULK out

Frame 101: 33 bytes on wire (264 bits), 33 bytes captured (264 bits)
USB URB
    [Source: host]
    [Destination: 1.5.2]
    USBPcap pseudoheader length: 27
    IRP ID: 0xffffaf82237c9010
    IRP USBD_STATUS: USBD_STATUS_SUCCESS (0x00000000)
    URB Function: URB_FUNCTION_BULK_OR_INTERRUPT_TRANSFER (0x0009)
    IRP information: 0x00, Direction: FDO -> PDO
    URB bus id: 1
    Device address: 5
    Endpoint: 0x02, Direction: OUT
    URB transfer type: URB_BULK (0x03)
    Packet Data Length: 6
    [Response in: 102]
    [bInterfaceClass: Printer (0x07)]
Leftover Capture Data: 1b7b43463f7d

No.     Time           Source                Destination           Protocol Length Info 
    102 29.405326      1.5.2                 host                  USB      27     URB_BULK out

Frame 102: 27 bytes on wire (216 bits), 27 bytes captured (216 bits)
USB URB
    [Source: 1.5.2]
    [Destination: host]
    USBPcap pseudoheader length: 27
    IRP ID: 0xffffaf82237c9010
    IRP USBD_STATUS: USBD_STATUS_SUCCESS (0x00000000)
    URB Function: URB_FUNCTION_BULK_OR_INTERRUPT_TRANSFER (0x0009)
    IRP information: 0x01, Direction: PDO -> FDO
    URB bus id: 1
    Device address: 5
    Endpoint: 0x02, Direction: OUT
    URB transfer type: URB_BULK (0x03)
    Packet Data Length: 0
    [Request in: 101]
    [Time from request: 0.000045000 seconds]
    [bInterfaceClass: Printer (0x07)]

No.     Time           Source                Destination           Protocol Length Info 
    103 29.405378      host                  1.5.1                 USB      27     URB_BULK in

Frame 103: 27 bytes on wire (216 bits), 27 bytes captured (216 bits)
USB URB
    [Source: host]
    [Destination: 1.5.1]
    USBPcap pseudoheader length: 27
    IRP ID: 0xffffaf82237c9010
    IRP USBD_STATUS: USBD_STATUS_SUCCESS (0x00000000)
    URB Function: URB_FUNCTION_BULK_OR_INTERRUPT_TRANSFER (0x0009)
    IRP information: 0x00, Direction: FDO -> PDO
    URB bus id: 1
    Device address: 5
    Endpoint: 0x81, Direction: IN
    URB transfer type: URB_BULK (0x03)
    Packet Data Length: 0
    [Response in: 104]
    [bInterfaceClass: Printer (0x07)]

No.     Time           Source                Destination           Protocol Length Info 
    104 29.464504      1.5.1                 host                  USB      73     URB_BULK in

Frame 104: 73 bytes on wire (584 bits), 73 bytes captured (584 bits)
USB URB
    [Source: 1.5.1]
    [Destination: host]
    USBPcap pseudoheader length: 27
    IRP ID: 0xffffaf82237c9010
    IRP USBD_STATUS: USBD_STATUS_SUCCESS (0x00000000)
    URB Function: URB_FUNCTION_BULK_OR_INTERRUPT_TRANSFER (0x0009)
    IRP information: 0x01, Direction: PDO -> FDO
    URB bus id: 1
    Device address: 5
    Endpoint: 0x81, Direction: IN
    URB transfer type: URB_BULK (0x03)
    Packet Data Length: 46
    [Request in: 103]
    [Time from request: 0.059126000 seconds]
    [bInterfaceClass: Printer (0x07)]
Leftover Capture Data: 7b4346214c3a4c503b423a3131353b503a4e3b4e3a383b48…

No.     Time           Source                Destination           Protocol Length Info 
    105 29.665437      host                  1.5.2                 USB      50     URB_BULK out

Frame 105: 50 bytes on wire (400 bits), 50 bytes captured (400 bits)
USB URB
    [Source: host]
    [Destination: 1.5.2]
    USBPcap pseudoheader length: 27
    IRP ID: 0xffffaf8225cb1010
    IRP USBD_STATUS: USBD_STATUS_SUCCESS (0x00000000)
    URB Function: URB_FUNCTION_BULK_OR_INTERRUPT_TRANSFER (0x0009)
    IRP information: 0x00, Direction: FDO -> PDO
    URB bus id: 1
    Device address: 5
    Endpoint: 0x02, Direction: OUT
    URB transfer type: URB_BULK (0x03)
    Packet Data Length: 23
    [Response in: 106]
    [bInterfaceClass: Printer (0x07)]
Leftover Capture Data: 1b7b5353433a533a3131353230302c4e2c382c312c487d

No.     Time           Source                Destination           Protocol Length Info 
    106 29.665509      1.5.2                 host                  USB      27     URB_BULK out

Frame 106: 27 bytes on wire (216 bits), 27 bytes captured (216 bits)
USB URB
    [Source: 1.5.2]
    [Destination: host]
    USBPcap pseudoheader length: 27
    IRP ID: 0xffffaf8225cb1010
    IRP USBD_STATUS: USBD_STATUS_SUCCESS (0x00000000)
    URB Function: URB_FUNCTION_BULK_OR_INTERRUPT_TRANSFER (0x0009)
    IRP information: 0x01, Direction: PDO -> FDO
    URB bus id: 1
    Device address: 5
    Endpoint: 0x02, Direction: OUT
    URB transfer type: URB_BULK (0x03)
    Packet Data Length: 0
    [Request in: 105]
    [Time from request: 0.000072000 seconds]
    [bInterfaceClass: Printer (0x07)]

No.     Time           Source                Destination           Protocol Length Info 
    107 29.665562      host                  1.5.1                 USB      27     URB_BULK in

Frame 107: 27 bytes on wire (216 bits), 27 bytes captured (216 bits)
USB URB
    [Source: host]
    [Destination: 1.5.1]
    USBPcap pseudoheader length: 27
    IRP ID: 0xffffaf8225cb1010
    IRP USBD_STATUS: USBD_STATUS_SUCCESS (0x00000000)
    URB Function: URB_FUNCTION_BULK_OR_INTERRUPT_TRANSFER (0x0009)
    IRP information: 0x00, Direction: FDO -> PDO
    URB bus id: 1
    Device address: 5
    Endpoint: 0x81, Direction: IN
    URB transfer type: URB_BULK (0x03)
    Packet Data Length: 0
    [Response in: 108]
    [bInterfaceClass: Printer (0x07)]

No.     Time           Source                Destination           Protocol Length Info 
    108 29.724279      1.5.1                 host                  USB      36     URB_BULK in

Frame 108: 36 bytes on wire (288 bits), 36 bytes captured (288 bits)
USB URB
    [Source: 1.5.1]
    [Destination: host]
    USBPcap pseudoheader length: 27
    IRP ID: 0xffffaf8225cb1010
    IRP USBD_STATUS: USBD_STATUS_SUCCESS (0x00000000)
    URB Function: URB_FUNCTION_BULK_OR_INTERRUPT_TRANSFER (0x0009)
    IRP information: 0x01, Direction: PDO -> FDO
    URB bus id: 1
    Device address: 5
    Endpoint: 0x81, Direction: IN
    URB transfer type: URB_BULK (0x03)
    Packet Data Length: 9
    [Request in: 107]
    [Time from request: 0.058717000 seconds]
    [bInterfaceClass: Printer (0x07)]
Leftover Capture Data: 7b5353433a533a307d

No.     Time           Source                Destination           Protocol Length Info 
    109 29.825071      host                  1.5.2                 USB      37     URB_BULK out

Frame 109: 37 bytes on wire (296 bits), 37 bytes captured (296 bits)
USB URB
    [Source: host]
    [Destination: 1.5.2]
    USBPcap pseudoheader length: 27
    IRP ID: 0xffffaf8202434ab0
    IRP USBD_STATUS: USBD_STATUS_SUCCESS (0x00000000)
    URB Function: URB_FUNCTION_BULK_OR_INTERRUPT_TRANSFER (0x0009)
    IRP information: 0x00, Direction: FDO -> PDO
    URB bus id: 1
    Device address: 5
    Endpoint: 0x02, Direction: OUT
    URB transfer type: URB_BULK (0x03)
    Packet Data Length: 10
    [Response in: 110]
    [bInterfaceClass: Printer (0x07)]
Leftover Capture Data: 1b7b5342543a423a597d

No.     Time           Source                Destination           Protocol Length Info 
    110 29.825114      1.5.2                 host                  USB      27     URB_BULK out

Frame 110: 27 bytes on wire (216 bits), 27 bytes captured (216 bits)
USB URB
    [Source: 1.5.2]
    [Destination: host]
    USBPcap pseudoheader length: 27
    IRP ID: 0xffffaf8202434ab0
    IRP USBD_STATUS: USBD_STATUS_SUCCESS (0x00000000)
    URB Function: URB_FUNCTION_BULK_OR_INTERRUPT_TRANSFER (0x0009)
    IRP information: 0x01, Direction: PDO -> FDO
    URB bus id: 1
    Device address: 5
    Endpoint: 0x02, Direction: OUT
    URB transfer type: URB_BULK (0x03)
    Packet Data Length: 0
    [Request in: 109]
    [Time from request: 0.000043000 seconds]
    [bInterfaceClass: Printer (0x07)]

No.     Time           Source                Destination           Protocol Length Info 
    111 29.825168      host                  1.5.1                 USB      27     URB_BULK in

Frame 111: 27 bytes on wire (216 bits), 27 bytes captured (216 bits)
USB URB
    [Source: host]
    [Destination: 1.5.1]
    USBPcap pseudoheader length: 27
    IRP ID: 0xffffaf8202434ab0
    IRP USBD_STATUS: USBD_STATUS_SUCCESS (0x00000000)
    URB Function: URB_FUNCTION_BULK_OR_INTERRUPT_TRANSFER (0x0009)
    IRP information: 0x00, Direction: FDO -> PDO
    URB bus id: 1
    Device address: 5
    Endpoint: 0x81, Direction: IN
    URB transfer type: URB_BULK (0x03)
    Packet Data Length: 0
    [Response in: 112]
    [bInterfaceClass: Printer (0x07)]

No.     Time           Source                Destination           Protocol Length Info 
    112 29.939330      1.5.1                 host                  USB      36     URB_BULK in

Frame 112: 36 bytes on wire (288 bits), 36 bytes captured (288 bits)
USB URB
    [Source: 1.5.1]
    [Destination: host]
    USBPcap pseudoheader length: 27
    IRP ID: 0xffffaf8202434ab0
    IRP USBD_STATUS: USBD_STATUS_SUCCESS (0x00000000)
    URB Function: URB_FUNCTION_BULK_OR_INTERRUPT_TRANSFER (0x0009)
    IRP information: 0x01, Direction: PDO -> FDO
    URB bus id: 1
    Device address: 5
    Endpoint: 0x81, Direction: IN
    URB transfer type: URB_BULK (0x03)
    Packet Data Length: 9
    [Request in: 111]
    [Time from request: 0.114162000 seconds]
    [bInterfaceClass: Printer (0x07)]
Leftover Capture Data: 7b5342543a423a307d

No.     Time           Source                Destination           Protocol Length Info 
    113 30.039465      host                  1.5.2                 USB      52     URB_BULK out

Frame 113: 52 bytes on wire (416 bits), 52 bytes captured (416 bits)
USB URB
    [Source: host]
    [Destination: 1.5.2]
    USBPcap pseudoheader length: 27
    IRP ID: 0xffffaf820272cab0
    IRP USBD_STATUS: USBD_STATUS_SUCCESS (0x00000000)
    URB Function: URB_FUNCTION_BULK_OR_INTERRUPT_TRANSFER (0x0009)
    IRP information: 0x00, Direction: FDO -> PDO
    URB bus id: 1
    Device address: 5
    Endpoint: 0x02, Direction: OUT
    URB transfer type: URB_BULK (0x03)
    Packet Data Length: 25
    [Response in: 114]
    [bInterfaceClass: Printer (0x07)]
Leftover Capture Data: 1b7b5342543a463a504235312d3231373231303234303032…

No.     Time           Source                Destination           Protocol Length Info 
    114 30.039519      1.5.2                 host                  USB      27     URB_BULK out

Frame 114: 27 bytes on wire (216 bits), 27 bytes captured (216 bits)
USB URB
    [Source: 1.5.2]
    [Destination: host]
    USBPcap pseudoheader length: 27
    IRP ID: 0xffffaf820272cab0
    IRP USBD_STATUS: USBD_STATUS_SUCCESS (0x00000000)
    URB Function: URB_FUNCTION_BULK_OR_INTERRUPT_TRANSFER (0x0009)
    IRP information: 0x01, Direction: PDO -> FDO
    URB bus id: 1
    Device address: 5
    Endpoint: 0x02, Direction: OUT
    URB transfer type: URB_BULK (0x03)
    Packet Data Length: 0
    [Request in: 113]
    [Time from request: 0.000054000 seconds]
    [bInterfaceClass: Printer (0x07)]

No.     Time           Source                Destination           Protocol Length Info 
    115 30.039542      host                  1.5.1                 USB      27     URB_BULK in

Frame 115: 27 bytes on wire (216 bits), 27 bytes captured (216 bits)
USB URB
    [Source: host]
    [Destination: 1.5.1]
    USBPcap pseudoheader length: 27
    IRP ID: 0xffffaf8226ae7ab0
    IRP USBD_STATUS: USBD_STATUS_SUCCESS (0x00000000)
    URB Function: URB_FUNCTION_BULK_OR_INTERRUPT_TRANSFER (0x0009)
    IRP information: 0x00, Direction: FDO -> PDO
    URB bus id: 1
    Device address: 5
    Endpoint: 0x81, Direction: IN
    URB transfer type: URB_BULK (0x03)
    Packet Data Length: 0
    [Response in: 116]
    [bInterfaceClass: Printer (0x07)]

No.     Time           Source                Destination           Protocol Length Info 
    116 30.106957      1.5.1                 host                  USB      36     URB_BULK in

Frame 116: 36 bytes on wire (288 bits), 36 bytes captured (288 bits)
USB URB
    [Source: 1.5.1]
    [Destination: host]
    USBPcap pseudoheader length: 27
    IRP ID: 0xffffaf8226ae7ab0
    IRP USBD_STATUS: USBD_STATUS_SUCCESS (0x00000000)
    URB Function: URB_FUNCTION_BULK_OR_INTERRUPT_TRANSFER (0x0009)
    IRP information: 0x01, Direction: PDO -> FDO
    URB bus id: 1
    Device address: 5
    Endpoint: 0x81, Direction: IN
    URB transfer type: URB_BULK (0x03)
    Packet Data Length: 9
    [Request in: 115]
    [Time from request: 0.067415000 seconds]
    [bInterfaceClass: Printer (0x07)]
Leftover Capture Data: 7b5342543a463a307d

No.     Time           Source                Destination           Protocol Length Info 
    117 30.207995      host                  1.5.2                 USB      37     URB_BULK out

Frame 117: 37 bytes on wire (296 bits), 37 bytes captured (296 bits)
USB URB
    [Source: host]
    [Destination: 1.5.2]
    USBPcap pseudoheader length: 27
    IRP ID: 0xffffaf8202434ab0
    IRP USBD_STATUS: USBD_STATUS_SUCCESS (0x00000000)
    URB Function: URB_FUNCTION_BULK_OR_INTERRUPT_TRANSFER (0x0009)
    IRP information: 0x00, Direction: FDO -> PDO
    URB bus id: 1
    Device address: 5
    Endpoint: 0x02, Direction: OUT
    URB transfer type: URB_BULK (0x03)
    Packet Data Length: 10
    [Response in: 118]
    [bInterfaceClass: Printer (0x07)]
Leftover Capture Data: 1b7b5342543a413a4e7d

No.     Time           Source                Destination           Protocol Length Info 
    118 30.208041      1.5.2                 host                  USB      27     URB_BULK out

Frame 118: 27 bytes on wire (216 bits), 27 bytes captured (216 bits)
USB URB
    [Source: 1.5.2]
    [Destination: host]
    USBPcap pseudoheader length: 27
    IRP ID: 0xffffaf8202434ab0
    IRP USBD_STATUS: USBD_STATUS_SUCCESS (0x00000000)
    URB Function: URB_FUNCTION_BULK_OR_INTERRUPT_TRANSFER (0x0009)
    IRP information: 0x01, Direction: PDO -> FDO
    URB bus id: 1
    Device address: 5
    Endpoint: 0x02, Direction: OUT
    URB transfer type: URB_BULK (0x03)
    Packet Data Length: 0
    [Request in: 117]
    [Time from request: 0.000046000 seconds]
    [bInterfaceClass: Printer (0x07)]

No.     Time           Source                Destination           Protocol Length Info 
    119 30.208058      host                  1.5.1                 USB      27     URB_BULK in

Frame 119: 27 bytes on wire (216 bits), 27 bytes captured (216 bits)
USB URB
    [Source: host]
    [Destination: 1.5.1]
    USBPcap pseudoheader length: 27
    IRP ID: 0xffffaf8202434ab0
    IRP USBD_STATUS: USBD_STATUS_SUCCESS (0x00000000)
    URB Function: URB_FUNCTION_BULK_OR_INTERRUPT_TRANSFER (0x0009)
    IRP information: 0x00, Direction: FDO -> PDO
    URB bus id: 1
    Device address: 5
    Endpoint: 0x81, Direction: IN
    URB transfer type: URB_BULK (0x03)
    Packet Data Length: 0
    [Response in: 120]
    [bInterfaceClass: Printer (0x07)]

No.     Time           Source                Destination           Protocol Length Info 
    120 30.279453      1.5.1                 host                  USB      36     URB_BULK in

Frame 120: 36 bytes on wire (288 bits), 36 bytes captured (288 bits)
USB URB
    [Source: 1.5.1]
    [Destination: host]
    USBPcap pseudoheader length: 27
    IRP ID: 0xffffaf8202434ab0
    IRP USBD_STATUS: USBD_STATUS_SUCCESS (0x00000000)
    URB Function: URB_FUNCTION_BULK_OR_INTERRUPT_TRANSFER (0x0009)
    IRP information: 0x01, Direction: PDO -> FDO
    URB bus id: 1
    Device address: 5
    Endpoint: 0x81, Direction: IN
    URB transfer type: URB_BULK (0x03)
    Packet Data Length: 9
    [Request in: 119]
    [Time from request: 0.071395000 seconds]
    [bInterfaceClass: Printer (0x07)]
Leftover Capture Data: 7b5342543a413a307d

No.     Time           Source                Destination           Protocol Length Info 
    121 30.380516      host                  1.5.2                 USB      37     URB_BULK out

Frame 121: 37 bytes on wire (296 bits), 37 bytes captured (296 bits)
USB URB
    [Source: host]
    [Destination: 1.5.2]
    USBPcap pseudoheader length: 27
    IRP ID: 0xffffaf820272cab0
    IRP USBD_STATUS: USBD_STATUS_SUCCESS (0x00000000)
    URB Function: URB_FUNCTION_BULK_OR_INTERRUPT_TRANSFER (0x0009)
    IRP information: 0x00, Direction: FDO -> PDO
    URB bus id: 1
    Device address: 5
    Endpoint: 0x02, Direction: OUT
    URB transfer type: URB_BULK (0x03)
    Packet Data Length: 10
    [Response in: 122]
    [bInterfaceClass: Printer (0x07)]
Leftover Capture Data: 1b7b5342543a453a4e7d

No.     Time           Source                Destination           Protocol Length Info 
    122 30.380562      1.5.2                 host                  USB      27     URB_BULK out

Frame 122: 27 bytes on wire (216 bits), 27 bytes captured (216 bits)
USB URB
    [Source: 1.5.2]
    [Destination: host]
    USBPcap pseudoheader length: 27
    IRP ID: 0xffffaf820272cab0
    IRP USBD_STATUS: USBD_STATUS_SUCCESS (0x00000000)
    URB Function: URB_FUNCTION_BULK_OR_INTERRUPT_TRANSFER (0x0009)
    IRP information: 0x01, Direction: PDO -> FDO
    URB bus id: 1
    Device address: 5
    Endpoint: 0x02, Direction: OUT
    URB transfer type: URB_BULK (0x03)
    Packet Data Length: 0
    [Request in: 121]
    [Time from request: 0.000046000 seconds]
    [bInterfaceClass: Printer (0x07)]

No.     Time           Source                Destination           Protocol Length Info 
    123 30.380586      host                  1.5.1                 USB      27     URB_BULK in

Frame 123: 27 bytes on wire (216 bits), 27 bytes captured (216 bits)
USB URB
    [Source: host]
    [Destination: 1.5.1]
    USBPcap pseudoheader length: 27
    IRP ID: 0xffffaf822191a910
    IRP USBD_STATUS: USBD_STATUS_SUCCESS (0x00000000)
    URB Function: URB_FUNCTION_BULK_OR_INTERRUPT_TRANSFER (0x0009)
    IRP information: 0x00, Direction: FDO -> PDO
    URB bus id: 1
    Device address: 5
    Endpoint: 0x81, Direction: IN
    URB transfer type: URB_BULK (0x03)
    Packet Data Length: 0
    [Response in: 124]
    [bInterfaceClass: Printer (0x07)]

No.     Time           Source                Destination           Protocol Length Info 
    124 30.443105      1.5.1                 host                  USB      36     URB_BULK in

Frame 124: 36 bytes on wire (288 bits), 36 bytes captured (288 bits)
USB URB
    [Source: 1.5.1]
    [Destination: host]
    USBPcap pseudoheader length: 27
    IRP ID: 0xffffaf822191a910
    IRP USBD_STATUS: USBD_STATUS_SUCCESS (0x00000000)
    URB Function: URB_FUNCTION_BULK_OR_INTERRUPT_TRANSFER (0x0009)
    IRP information: 0x01, Direction: PDO -> FDO
    URB bus id: 1
    Device address: 5
    Endpoint: 0x81, Direction: IN
    URB transfer type: URB_BULK (0x03)
    Packet Data Length: 9
    [Request in: 123]
    [Time from request: 0.062519000 seconds]
    [bInterfaceClass: Printer (0x07)]
Leftover Capture Data: 7b5342543a453a307d

No.     Time           Source                Destination           Protocol Length Info 
    125 30.544130      host                  1.5.2                 USB      37     URB_BULK out

Frame 125: 37 bytes on wire (296 bits), 37 bytes captured (296 bits)
USB URB
    [Source: host]
    [Destination: 1.5.2]
    USBPcap pseudoheader length: 27
    IRP ID: 0xffffaf8202342ab0
    IRP USBD_STATUS: USBD_STATUS_SUCCESS (0x00000000)
    URB Function: URB_FUNCTION_BULK_OR_INTERRUPT_TRANSFER (0x0009)
    IRP information: 0x00, Direction: FDO -> PDO
    URB bus id: 1
    Device address: 5
    Endpoint: 0x02, Direction: OUT
    URB transfer type: URB_BULK (0x03)
    Packet Data Length: 10
    [Response in: 126]
    [bInterfaceClass: Printer (0x07)]
Leftover Capture Data: 1b7b5342543a423a4e7d

No.     Time           Source                Destination           Protocol Length Info 
    126 30.544174      1.5.2                 host                  USB      27     URB_BULK out

Frame 126: 27 bytes on wire (216 bits), 27 bytes captured (216 bits)
USB URB
    [Source: 1.5.2]
    [Destination: host]
    USBPcap pseudoheader length: 27
    IRP ID: 0xffffaf8202342ab0
    IRP USBD_STATUS: USBD_STATUS_SUCCESS (0x00000000)
    URB Function: URB_FUNCTION_BULK_OR_INTERRUPT_TRANSFER (0x0009)
    IRP information: 0x01, Direction: PDO -> FDO
    URB bus id: 1
    Device address: 5
    Endpoint: 0x02, Direction: OUT
    URB transfer type: URB_BULK (0x03)
    Packet Data Length: 0
    [Request in: 125]
    [Time from request: 0.000044000 seconds]
    [bInterfaceClass: Printer (0x07)]

No.     Time           Source                Destination           Protocol Length Info 
    127 30.544228      host                  1.5.1                 USB      27     URB_BULK in

Frame 127: 27 bytes on wire (216 bits), 27 bytes captured (216 bits)
USB URB
    [Source: host]
    [Destination: 1.5.1]
    USBPcap pseudoheader length: 27
    IRP ID: 0xffffaf8202342ab0
    IRP USBD_STATUS: USBD_STATUS_SUCCESS (0x00000000)
    URB Function: URB_FUNCTION_BULK_OR_INTERRUPT_TRANSFER (0x0009)
    IRP information: 0x00, Direction: FDO -> PDO
    URB bus id: 1
    Device address: 5
    Endpoint: 0x81, Direction: IN
    URB transfer type: URB_BULK (0x03)
    Packet Data Length: 0
    [Response in: 128]
    [bInterfaceClass: Printer (0x07)]

No.     Time           Source                Destination           Protocol Length Info 
    128 30.621104      1.5.1                 host                  USB      36     URB_BULK in

Frame 128: 36 bytes on wire (288 bits), 36 bytes captured (288 bits)
USB URB
    [Source: 1.5.1]
    [Destination: host]
    USBPcap pseudoheader length: 27
    IRP ID: 0xffffaf8202342ab0
    IRP USBD_STATUS: USBD_STATUS_SUCCESS (0x00000000)
    URB Function: URB_FUNCTION_BULK_OR_INTERRUPT_TRANSFER (0x0009)
    IRP information: 0x01, Direction: PDO -> FDO
    URB bus id: 1
    Device address: 5
    Endpoint: 0x81, Direction: IN
    URB transfer type: URB_BULK (0x03)
    Packet Data Length: 9
    [Request in: 127]
    [Time from request: 0.076876000 seconds]
    [bInterfaceClass: Printer (0x07)]
Leftover Capture Data: 7b5342543a423a307d

No.     Time           Source                Destination           Protocol Length Info 
    129 30.721662      host                  1.5.2                 USB      40     URB_BULK out

Frame 129: 40 bytes on wire (320 bits), 40 bytes captured (320 bits)
USB URB
    [Source: host]
    [Destination: 1.5.2]
    USBPcap pseudoheader length: 27
    IRP ID: 0xffffaf8202783ab0
    IRP USBD_STATUS: USBD_STATUS_SUCCESS (0x00000000)
    URB Function: URB_FUNCTION_BULK_OR_INTERRUPT_TRANSFER (0x0009)
    IRP information: 0x00, Direction: FDO -> PDO
    URB bus id: 1
    Device address: 5
    Endpoint: 0x02, Direction: OUT
    URB transfer type: URB_BULK (0x03)
    Packet Data Length: 13
    [Response in: 130]
    [bInterfaceClass: Printer (0x07)]
Leftover Capture Data: 1b7b5342543a503a313233347d

No.     Time           Source                Destination           Protocol Length Info 
    130 30.721710      1.5.2                 host                  USB      27     URB_BULK out

Frame 130: 27 bytes on wire (216 bits), 27 bytes captured (216 bits)
USB URB
    [Source: 1.5.2]
    [Destination: host]
    USBPcap pseudoheader length: 27
    IRP ID: 0xffffaf8202783ab0
    IRP USBD_STATUS: USBD_STATUS_SUCCESS (0x00000000)
    URB Function: URB_FUNCTION_BULK_OR_INTERRUPT_TRANSFER (0x0009)
    IRP information: 0x01, Direction: PDO -> FDO
    URB bus id: 1
    Device address: 5
    Endpoint: 0x02, Direction: OUT
    URB transfer type: URB_BULK (0x03)
    Packet Data Length: 0
    [Request in: 129]
    [Time from request: 0.000048000 seconds]
    [bInterfaceClass: Printer (0x07)]

No.     Time           Source                Destination           Protocol Length Info 
    131 30.721764      host                  1.5.1                 USB      27     URB_BULK in

Frame 131: 27 bytes on wire (216 bits), 27 bytes captured (216 bits)
USB URB
    [Source: host]
    [Destination: 1.5.1]
    USBPcap pseudoheader length: 27
    IRP ID: 0xffffaf8202783ab0
    IRP USBD_STATUS: USBD_STATUS_SUCCESS (0x00000000)
    URB Function: URB_FUNCTION_BULK_OR_INTERRUPT_TRANSFER (0x0009)
    IRP information: 0x00, Direction: FDO -> PDO
    URB bus id: 1
    Device address: 5
    Endpoint: 0x81, Direction: IN
    URB transfer type: URB_BULK (0x03)
    Packet Data Length: 0
    [Response in: 132]
    [bInterfaceClass: Printer (0x07)]

No.     Time           Source                Destination           Protocol Length Info 
    132 30.786631      1.5.1                 host                  USB      36     URB_BULK in

Frame 132: 36 bytes on wire (288 bits), 36 bytes captured (288 bits)
USB URB
    [Source: 1.5.1]
    [Destination: host]
    USBPcap pseudoheader length: 27
    IRP ID: 0xffffaf8202783ab0
    IRP USBD_STATUS: USBD_STATUS_SUCCESS (0x00000000)
    URB Function: URB_FUNCTION_BULK_OR_INTERRUPT_TRANSFER (0x0009)
    IRP information: 0x01, Direction: PDO -> FDO
    URB bus id: 1
    Device address: 5
    Endpoint: 0x81, Direction: IN
    URB transfer type: URB_BULK (0x03)
    Packet Data Length: 9
    [Request in: 131]
    [Time from request: 0.064867000 seconds]
    [bInterfaceClass: Printer (0x07)]
Leftover Capture Data: 7b5342543a503a307d

No.     Time           Source                Destination           Protocol Length Info 
    133 30.887218      host                  1.5.2                 USB      37     URB_BULK out

Frame 133: 37 bytes on wire (296 bits), 37 bytes captured (296 bits)
USB URB
    [Source: host]
    [Destination: 1.5.2]
    USBPcap pseudoheader length: 27
    IRP ID: 0xffffaf8225cb1010
    IRP USBD_STATUS: USBD_STATUS_SUCCESS (0x00000000)
    URB Function: URB_FUNCTION_BULK_OR_INTERRUPT_TRANSFER (0x0009)
    IRP information: 0x00, Direction: FDO -> PDO
    URB bus id: 1
    Device address: 5
    Endpoint: 0x02, Direction: OUT
    URB transfer type: URB_BULK (0x03)
    Packet Data Length: 10
    [Response in: 134]
    [bInterfaceClass: Printer (0x07)]
Leftover Capture Data: 1b7b5342543a433a597d

No.     Time           Source                Destination           Protocol Length Info 
    134 30.887336      1.5.2                 host                  USB      27     URB_BULK out

Frame 134: 27 bytes on wire (216 bits), 27 bytes captured (216 bits)
USB URB
    [Source: 1.5.2]
    [Destination: host]
    USBPcap pseudoheader length: 27
    IRP ID: 0xffffaf8225cb1010
    IRP USBD_STATUS: USBD_STATUS_SUCCESS (0x00000000)
    URB Function: URB_FUNCTION_BULK_OR_INTERRUPT_TRANSFER (0x0009)
    IRP information: 0x01, Direction: PDO -> FDO
    URB bus id: 1
    Device address: 5
    Endpoint: 0x02, Direction: OUT
    URB transfer type: URB_BULK (0x03)
    Packet Data Length: 0
    [Request in: 133]
    [Time from request: 0.000118000 seconds]
    [bInterfaceClass: Printer (0x07)]

No.     Time           Source                Destination           Protocol Length Info 
    135 30.887399      host                  1.5.1                 USB      27     URB_BULK in

Frame 135: 27 bytes on wire (216 bits), 27 bytes captured (216 bits)
USB URB
    [Source: host]
    [Destination: 1.5.1]
    USBPcap pseudoheader length: 27
    IRP ID: 0xffffaf8226724010
    IRP USBD_STATUS: USBD_STATUS_SUCCESS (0x00000000)
    URB Function: URB_FUNCTION_BULK_OR_INTERRUPT_TRANSFER (0x0009)
    IRP information: 0x00, Direction: FDO -> PDO
    URB bus id: 1
    Device address: 5
    Endpoint: 0x81, Direction: IN
    URB transfer type: URB_BULK (0x03)
    Packet Data Length: 0
    [Response in: 136]
    [bInterfaceClass: Printer (0x07)]

No.     Time           Source                Destination           Protocol Length Info 
    136 30.953354      1.5.1                 host                  USB      36     URB_BULK in

Frame 136: 36 bytes on wire (288 bits), 36 bytes captured (288 bits)
USB URB
    [Source: 1.5.1]
    [Destination: host]
    USBPcap pseudoheader length: 27
    IRP ID: 0xffffaf8226724010
    IRP USBD_STATUS: USBD_STATUS_SUCCESS (0x00000000)
    URB Function: URB_FUNCTION_BULK_OR_INTERRUPT_TRANSFER (0x0009)
    IRP information: 0x01, Direction: PDO -> FDO
    URB bus id: 1
    Device address: 5
    Endpoint: 0x81, Direction: IN
    URB transfer type: URB_BULK (0x03)
    Packet Data Length: 9
    [Request in: 135]
    [Time from request: 0.065955000 seconds]
    [bInterfaceClass: Printer (0x07)]
Leftover Capture Data: 7b5342543a433a307d

No.     Time           Source                Destination           Protocol Length Info 
    137 31.053735      host                  1.5.2                 USB      37     URB_BULK out

Frame 137: 37 bytes on wire (296 bits), 37 bytes captured (296 bits)
USB URB
    [Source: host]
    [Destination: 1.5.2]
    USBPcap pseudoheader length: 27
    IRP ID: 0xffffaf8202082910
    IRP USBD_STATUS: USBD_STATUS_SUCCESS (0x00000000)
    URB Function: URB_FUNCTION_BULK_OR_INTERRUPT_TRANSFER (0x0009)
    IRP information: 0x00, Direction: FDO -> PDO
    URB bus id: 1
    Device address: 5
    Endpoint: 0x02, Direction: OUT
    URB transfer type: URB_BULK (0x03)
    Packet Data Length: 10
    [Response in: 138]
    [bInterfaceClass: Printer (0x07)]
Leftover Capture Data: 1b7b5342543a443a597d

No.     Time           Source                Destination           Protocol Length Info 
    138 31.053802      1.5.2                 host                  USB      27     URB_BULK out

Frame 138: 27 bytes on wire (216 bits), 27 bytes captured (216 bits)
USB URB
    [Source: 1.5.2]
    [Destination: host]
    USBPcap pseudoheader length: 27
    IRP ID: 0xffffaf8202082910
    IRP USBD_STATUS: USBD_STATUS_SUCCESS (0x00000000)
    URB Function: URB_FUNCTION_BULK_OR_INTERRUPT_TRANSFER (0x0009)
    IRP information: 0x01, Direction: PDO -> FDO
    URB bus id: 1
    Device address: 5
    Endpoint: 0x02, Direction: OUT
    URB transfer type: URB_BULK (0x03)
    Packet Data Length: 0
    [Request in: 137]
    [Time from request: 0.000067000 seconds]
    [bInterfaceClass: Printer (0x07)]

No.     Time           Source                Destination           Protocol Length Info 
    139 31.053819      host                  1.5.1                 USB      27     URB_BULK in

Frame 139: 27 bytes on wire (216 bits), 27 bytes captured (216 bits)
USB URB
    [Source: host]
    [Destination: 1.5.1]
    USBPcap pseudoheader length: 27
    IRP ID: 0xffffaf8202082910
    IRP USBD_STATUS: USBD_STATUS_SUCCESS (0x00000000)
    URB Function: URB_FUNCTION_BULK_OR_INTERRUPT_TRANSFER (0x0009)
    IRP information: 0x00, Direction: FDO -> PDO
    URB bus id: 1
    Device address: 5
    Endpoint: 0x81, Direction: IN
    URB transfer type: URB_BULK (0x03)
    Packet Data Length: 0
    [Response in: 140]
    [bInterfaceClass: Printer (0x07)]

No.     Time           Source                Destination           Protocol Length Info 
    140 31.117803      1.5.1                 host                  USB      36     URB_BULK in

Frame 140: 36 bytes on wire (288 bits), 36 bytes captured (288 bits)
USB URB
    [Source: 1.5.1]
    [Destination: host]
    USBPcap pseudoheader length: 27
    IRP ID: 0xffffaf8202082910
    IRP USBD_STATUS: USBD_STATUS_SUCCESS (0x00000000)
    URB Function: URB_FUNCTION_BULK_OR_INTERRUPT_TRANSFER (0x0009)
    IRP information: 0x01, Direction: PDO -> FDO
    URB bus id: 1
    Device address: 5
    Endpoint: 0x81, Direction: IN
    URB transfer type: URB_BULK (0x03)
    Packet Data Length: 9
    [Request in: 139]
    [Time from request: 0.063984000 seconds]
    [bInterfaceClass: Printer (0x07)]
Leftover Capture Data: 7b5342543a443a307d

No.     Time           Source                Destination           Protocol Length Info 
    141 31.218514      host                  1.5.2                 USB      41     URB_BULK out

Frame 141: 41 bytes on wire (328 bits), 41 bytes captured (328 bits)
USB URB
    [Source: host]
    [Destination: 1.5.2]
    USBPcap pseudoheader length: 27
    IRP ID: 0xffffaf82026d83a0
    IRP USBD_STATUS: USBD_STATUS_SUCCESS (0x00000000)
    URB Function: URB_FUNCTION_BULK_OR_INTERRUPT_TRANSFER (0x0009)
    IRP information: 0x00, Direction: FDO -> PDO
    URB bus id: 1
    Device address: 5
    Endpoint: 0x02, Direction: OUT
    URB transfer type: URB_BULK (0x03)
    Packet Data Length: 14
    [Response in: 142]
    [bInterfaceClass: Printer (0x07)]
Leftover Capture Data: 1b7b5350573a543a32302c33307d

No.     Time           Source                Destination           Protocol Length Info 
    142 31.218581      1.5.2                 host                  USB      27     URB_BULK out

Frame 142: 27 bytes on wire (216 bits), 27 bytes captured (216 bits)
USB URB
    [Source: 1.5.2]
    [Destination: host]
    USBPcap pseudoheader length: 27
    IRP ID: 0xffffaf82026d83a0
    IRP USBD_STATUS: USBD_STATUS_SUCCESS (0x00000000)
    URB Function: URB_FUNCTION_BULK_OR_INTERRUPT_TRANSFER (0x0009)
    IRP information: 0x01, Direction: PDO -> FDO
    URB bus id: 1
    Device address: 5
    Endpoint: 0x02, Direction: OUT
    URB transfer type: URB_BULK (0x03)
    Packet Data Length: 0
    [Request in: 141]
    [Time from request: 0.000067000 seconds]
    [bInterfaceClass: Printer (0x07)]

No.     Time           Source                Destination           Protocol Length Info 
    143 31.218605      host                  1.5.1                 USB      27     URB_BULK in

Frame 143: 27 bytes on wire (216 bits), 27 bytes captured (216 bits)
USB URB
    [Source: host]
    [Destination: 1.5.1]
    USBPcap pseudoheader length: 27
    IRP ID: 0xffffaf82265e9ab0
    IRP USBD_STATUS: USBD_STATUS_SUCCESS (0x00000000)
    URB Function: URB_FUNCTION_BULK_OR_INTERRUPT_TRANSFER (0x0009)
    IRP information: 0x00, Direction: FDO -> PDO
    URB bus id: 1
    Device address: 5
    Endpoint: 0x81, Direction: IN
    URB transfer type: URB_BULK (0x03)
    Packet Data Length: 0
    [Response in: 144]
    [bInterfaceClass: Printer (0x07)]

No.     Time           Source                Destination           Protocol Length Info 
    144 31.277952      1.5.1                 host                  USB      36     URB_BULK in

Frame 144: 36 bytes on wire (288 bits), 36 bytes captured (288 bits)
USB URB
    [Source: 1.5.1]
    [Destination: host]
    USBPcap pseudoheader length: 27
    IRP ID: 0xffffaf82265e9ab0
    IRP USBD_STATUS: USBD_STATUS_SUCCESS (0x00000000)
    URB Function: URB_FUNCTION_BULK_OR_INTERRUPT_TRANSFER (0x0009)
    IRP information: 0x01, Direction: PDO -> FDO
    URB bus id: 1
    Device address: 5
    Endpoint: 0x81, Direction: IN
    URB transfer type: URB_BULK (0x03)
    Packet Data Length: 9
    [Request in: 143]
    [Time from request: 0.059347000 seconds]
    [bInterfaceClass: Printer (0x07)]
Leftover Capture Data: 7b5350573a543a307d

No.     Time           Source                Destination           Protocol Length Info 
    145 31.480416      host                  1.5.2                 USB      39     URB_BULK out

Frame 145: 39 bytes on wire (312 bits), 39 bytes captured (312 bits)
USB URB
    [Source: host]
    [Destination: 1.5.2]
    USBPcap pseudoheader length: 27
    IRP ID: 0xffffaf82023d4ab0
    IRP USBD_STATUS: USBD_STATUS_SUCCESS (0x00000000)
    URB Function: URB_FUNCTION_BULK_OR_INTERRUPT_TRANSFER (0x0009)
    IRP information: 0x00, Direction: FDO -> PDO
    URB bus id: 1
    Device address: 5
    Endpoint: 0x02, Direction: OUT
    URB transfer type: URB_BULK (0x03)
    Packet Data Length: 12
    [Response in: 146]
    [bInterfaceClass: Printer (0x07)]
Leftover Capture Data: 1b7b5353433a563a302e307d

No.     Time           Source                Destination           Protocol Length Info 
    146 31.480483      1.5.2                 host                  USB      27     URB_BULK out

Frame 146: 27 bytes on wire (216 bits), 27 bytes captured (216 bits)
USB URB
    [Source: 1.5.2]
    [Destination: host]
    USBPcap pseudoheader length: 27
    IRP ID: 0xffffaf82023d4ab0
    IRP USBD_STATUS: USBD_STATUS_SUCCESS (0x00000000)
    URB Function: URB_FUNCTION_BULK_OR_INTERRUPT_TRANSFER (0x0009)
    IRP information: 0x01, Direction: PDO -> FDO
    URB bus id: 1
    Device address: 5
    Endpoint: 0x02, Direction: OUT
    URB transfer type: URB_BULK (0x03)
    Packet Data Length: 0
    [Request in: 145]
    [Time from request: 0.000067000 seconds]
    [bInterfaceClass: Printer (0x07)]

No.     Time           Source                Destination           Protocol Length Info 
    147 31.480524      host                  1.5.1                 USB      27     URB_BULK in

Frame 147: 27 bytes on wire (216 bits), 27 bytes captured (216 bits)
USB URB
    [Source: host]
    [Destination: 1.5.1]
    USBPcap pseudoheader length: 27
    IRP ID: 0xffffaf8203631140
    IRP USBD_STATUS: USBD_STATUS_SUCCESS (0x00000000)
    URB Function: URB_FUNCTION_BULK_OR_INTERRUPT_TRANSFER (0x0009)
    IRP information: 0x00, Direction: FDO -> PDO
    URB bus id: 1
    Device address: 5
    Endpoint: 0x81, Direction: IN
    URB transfer type: URB_BULK (0x03)
    Packet Data Length: 0
    [Response in: 148]
    [bInterfaceClass: Printer (0x07)]

No.     Time           Source                Destination           Protocol Length Info 
    148 31.551586      1.5.1                 host                  USB      36     URB_BULK in

Frame 148: 36 bytes on wire (288 bits), 36 bytes captured (288 bits)
USB URB
    [Source: 1.5.1]
    [Destination: host]
    USBPcap pseudoheader length: 27
    IRP ID: 0xffffaf8203631140
    IRP USBD_STATUS: USBD_STATUS_SUCCESS (0x00000000)
    URB Function: URB_FUNCTION_BULK_OR_INTERRUPT_TRANSFER (0x0009)
    IRP information: 0x01, Direction: PDO -> FDO
    URB bus id: 1
    Device address: 5
    Endpoint: 0x81, Direction: IN
    URB transfer type: URB_BULK (0x03)
    Packet Data Length: 9
    [Request in: 147]
    [Time from request: 0.071062000 seconds]
    [bInterfaceClass: Printer (0x07)]
Leftover Capture Data: 7b5353433a563a307d

No.     Time           Source                Destination           Protocol Length Info 
    149 31.652159      host                  1.5.2                 USB      41     URB_BULK out

Frame 149: 41 bytes on wire (328 bits), 41 bytes captured (328 bits)
USB URB
    [Source: host]
    [Destination: 1.5.2]
    USBPcap pseudoheader length: 27
    IRP ID: 0xffffaf8202082910
    IRP USBD_STATUS: USBD_STATUS_SUCCESS (0x00000000)
    URB Function: URB_FUNCTION_BULK_OR_INTERRUPT_TRANSFER (0x0009)
    IRP information: 0x00, Direction: FDO -> PDO
    URB bus id: 1
    Device address: 5
    Endpoint: 0x02, Direction: OUT
    URB transfer type: URB_BULK (0x03)
    Packet Data Length: 14
    [Response in: 150]
    [bInterfaceClass: Printer (0x07)]
Leftover Capture Data: 1b7b5353433a453a4b2c3130307d

No.     Time           Source                Destination           Protocol Length Info 
    150 31.652208      1.5.2                 host                  USB      27     URB_BULK out

Frame 150: 27 bytes on wire (216 bits), 27 bytes captured (216 bits)
USB URB
    [Source: 1.5.2]
    [Destination: host]
    USBPcap pseudoheader length: 27
    IRP ID: 0xffffaf8202082910
    IRP USBD_STATUS: USBD_STATUS_SUCCESS (0x00000000)
    URB Function: URB_FUNCTION_BULK_OR_INTERRUPT_TRANSFER (0x0009)
    IRP information: 0x01, Direction: PDO -> FDO
    URB bus id: 1
    Device address: 5
    Endpoint: 0x02, Direction: OUT
    URB transfer type: URB_BULK (0x03)
    Packet Data Length: 0
    [Request in: 149]
    [Time from request: 0.000049000 seconds]
    [bInterfaceClass: Printer (0x07)]

No.     Time           Source                Destination           Protocol Length Info 
    151 31.652260      host                  1.5.1                 USB      27     URB_BULK in

Frame 151: 27 bytes on wire (216 bits), 27 bytes captured (216 bits)
USB URB
    [Source: host]
    [Destination: 1.5.1]
    USBPcap pseudoheader length: 27
    IRP ID: 0xffffaf8202082910
    IRP USBD_STATUS: USBD_STATUS_SUCCESS (0x00000000)
    URB Function: URB_FUNCTION_BULK_OR_INTERRUPT_TRANSFER (0x0009)
    IRP information: 0x00, Direction: FDO -> PDO
    URB bus id: 1
    Device address: 5
    Endpoint: 0x81, Direction: IN
    URB transfer type: URB_BULK (0x03)
    Packet Data Length: 0
    [Response in: 152]
    [bInterfaceClass: Printer (0x07)]

No.     Time           Source                Destination           Protocol Length Info 
    152 31.714052      1.5.1                 host                  USB      36     URB_BULK in

Frame 152: 36 bytes on wire (288 bits), 36 bytes captured (288 bits)
USB URB
    [Source: 1.5.1]
    [Destination: host]
    USBPcap pseudoheader length: 27
    IRP ID: 0xffffaf8202082910
    IRP USBD_STATUS: USBD_STATUS_SUCCESS (0x00000000)
    URB Function: URB_FUNCTION_BULK_OR_INTERRUPT_TRANSFER (0x0009)
    IRP information: 0x01, Direction: PDO -> FDO
    URB bus id: 1
    Device address: 5
    Endpoint: 0x81, Direction: IN
    URB transfer type: URB_BULK (0x03)
    Packet Data Length: 9
    [Request in: 151]
    [Time from request: 0.061792000 seconds]
    [bInterfaceClass: Printer (0x07)]
Leftover Capture Data: 7b5353433a453a307d

No.     Time           Source                Destination           Protocol Length Info 
    153 31.814754      host                  1.5.2                 USB      30     URB_BULK out

Frame 153: 30 bytes on wire (240 bits), 30 bytes captured (240 bits)
USB URB
    [Source: host]
    [Destination: 1.5.2]
    USBPcap pseudoheader length: 27
    IRP ID: 0xffffaf820361dab0
    IRP USBD_STATUS: USBD_STATUS_SUCCESS (0x00000000)
    URB Function: URB_FUNCTION_BULK_OR_INTERRUPT_TRANSFER (0x0009)
    IRP information: 0x00, Direction: FDO -> PDO
    URB bus id: 1
    Device address: 5
    Endpoint: 0x02, Direction: OUT
    URB transfer type: URB_BULK (0x03)
    Packet Data Length: 3
    [Response in: 154]
    [bInterfaceClass: Printer (0x07)]
Leftover Capture Data: 1b455a

No.     Time           Source                Destination           Protocol Length Info 
    154 31.814821      1.5.2                 host                  USB      27     URB_BULK out

Frame 154: 27 bytes on wire (216 bits), 27 bytes captured (216 bits)
USB URB
    [Source: 1.5.2]
    [Destination: host]
    USBPcap pseudoheader length: 27
    IRP ID: 0xffffaf820361dab0
    IRP USBD_STATUS: USBD_STATUS_SUCCESS (0x00000000)
    URB Function: URB_FUNCTION_BULK_OR_INTERRUPT_TRANSFER (0x0009)
    IRP information: 0x01, Direction: PDO -> FDO
    URB bus id: 1
    Device address: 5
    Endpoint: 0x02, Direction: OUT
    URB transfer type: URB_BULK (0x03)
    Packet Data Length: 0
    [Request in: 153]
    [Time from request: 0.000067000 seconds]
    [bInterfaceClass: Printer (0x07)]

No.     Time           Source                Destination           Protocol Length Info 
    155 31.814840      host                  1.5.1                 USB      27     URB_BULK in

Frame 155: 27 bytes on wire (216 bits), 27 bytes captured (216 bits)
USB URB
    [Source: host]
    [Destination: 1.5.1]
    USBPcap pseudoheader length: 27
    IRP ID: 0xffffaf820361dab0
    IRP USBD_STATUS: USBD_STATUS_SUCCESS (0x00000000)
    URB Function: URB_FUNCTION_BULK_OR_INTERRUPT_TRANSFER (0x0009)
    IRP information: 0x00, Direction: FDO -> PDO
    URB bus id: 1
    Device address: 5
    Endpoint: 0x81, Direction: IN
    URB transfer type: URB_BULK (0x03)
    Packet Data Length: 0
    [Response in: 156]
    [bInterfaceClass: Printer (0x07)]

No.     Time           Source                Destination           Protocol Length Info 
    156 32.814941      1.5.1                 host                  USB      27     URB_BULK in

Frame 156: 27 bytes on wire (216 bits), 27 bytes captured (216 bits)
USB URB
    [Source: 1.5.1]
    [Destination: host]
    USBPcap pseudoheader length: 27
    IRP ID: 0xffffaf820361dab0
    IRP USBD_STATUS: USBD_STATUS_CANCELED (0xc0010000)
    URB Function: URB_FUNCTION_BULK_OR_INTERRUPT_TRANSFER (0x0009)
    IRP information: 0x01, Direction: PDO -> FDO
    URB bus id: 1
    Device address: 5
    Endpoint: 0x81, Direction: IN
    URB transfer type: URB_BULK (0x03)
    Packet Data Length: 0
    [Request in: 155]
    [Time from request: 1.000101000 seconds]
    [bInterfaceClass: Printer (0x07)]

No.     Time           Source                Destination           Protocol Length Info 
    157 32.814970      host                  1.5.1                 USB      27     URB_FUNCTION_SYNC_RESET_PIPE_AND_CLEAR_STALL

Frame 157: 27 bytes on wire (216 bits), 27 bytes captured (216 bits)
USB URB
    [Source: host]
    [Destination: 1.5.1]
    USBPcap pseudoheader length: 27
    IRP ID: 0xffffaf82021d8ab0
    IRP USBD_STATUS: USBD_STATUS_SUCCESS (0x00000000)
    URB Function: URB_FUNCTION_SYNC_RESET_PIPE_AND_CLEAR_STALL (0x001e)
    IRP information: 0x00, Direction: FDO -> PDO
    URB bus id: 1
    Device address: 5
    Endpoint: 0x81, Direction: IN
    URB transfer type: USB IRP Info (0xfe)
    Packet Data Length: 0
    [Response in: 158]

No.     Time           Source                Destination           Protocol Length Info 
    158 32.815290      1.5.1                 host                  USB      27     URB_FUNCTION_SYNC_RESET_PIPE_AND_CLEAR_STALL

Frame 158: 27 bytes on wire (216 bits), 27 bytes captured (216 bits)
USB URB
    [Source: 1.5.1]
    [Destination: host]
    USBPcap pseudoheader length: 27
    IRP ID: 0xffffaf82021d8ab0
    IRP USBD_STATUS: USBD_STATUS_SUCCESS (0x00000000)
    URB Function: URB_FUNCTION_SYNC_RESET_PIPE_AND_CLEAR_STALL (0x001e)
    IRP information: 0x01, Direction: PDO -> FDO
    URB bus id: 1
    Device address: 5
    Endpoint: 0x81, Direction: IN
    URB transfer type: USB IRP Info (0xfe)
    Packet Data Length: 0
    [Request in: 157]
    [Time from request: 0.000320000 seconds]

No.     Time           Source                Destination           Protocol Length Info 
    159 32.825857      host                  1.5.1                 USB      27     URB_BULK in

Frame 159: 27 bytes on wire (216 bits), 27 bytes captured (216 bits)
USB URB
    [Source: host]
    [Destination: 1.5.1]
    USBPcap pseudoheader length: 27
    IRP ID: 0xffffaf8202364010
    IRP USBD_STATUS: USBD_STATUS_SUCCESS (0x00000000)
    URB Function: URB_FUNCTION_BULK_OR_INTERRUPT_TRANSFER (0x0009)
    IRP information: 0x00, Direction: FDO -> PDO
    URB bus id: 1
    Device address: 5
    Endpoint: 0x81, Direction: IN
    URB transfer type: URB_BULK (0x03)
    Packet Data Length: 0
    [Response in: 160]
    [bInterfaceClass: Printer (0x07)]

No.     Time           Source                Destination           Protocol Length Info 
    160 33.826218      1.5.1                 host                  USB      27     URB_BULK in

Frame 160: 27 bytes on wire (216 bits), 27 bytes captured (216 bits)
USB URB
    [Source: 1.5.1]
    [Destination: host]
    USBPcap pseudoheader length: 27
    IRP ID: 0xffffaf8202364010
    IRP USBD_STATUS: USBD_STATUS_CANCELED (0xc0010000)
    URB Function: URB_FUNCTION_BULK_OR_INTERRUPT_TRANSFER (0x0009)
    IRP information: 0x01, Direction: PDO -> FDO
    URB bus id: 1
    Device address: 5
    Endpoint: 0x81, Direction: IN
    URB transfer type: URB_BULK (0x03)
    Packet Data Length: 0
    [Request in: 159]
    [Time from request: 1.000361000 seconds]
    [bInterfaceClass: Printer (0x07)]

No.     Time           Source                Destination           Protocol Length Info 
    161 33.826253      host                  1.5.1                 USB      27     URB_FUNCTION_SYNC_RESET_PIPE_AND_CLEAR_STALL

Frame 161: 27 bytes on wire (216 bits), 27 bytes captured (216 bits)
USB URB
    [Source: host]
    [Destination: 1.5.1]
    USBPcap pseudoheader length: 27
    IRP ID: 0xffffaf8203989010
    IRP USBD_STATUS: USBD_STATUS_SUCCESS (0x00000000)
    URB Function: URB_FUNCTION_SYNC_RESET_PIPE_AND_CLEAR_STALL (0x001e)
    IRP information: 0x00, Direction: FDO -> PDO
    URB bus id: 1
    Device address: 5
    Endpoint: 0x81, Direction: IN
    URB transfer type: USB IRP Info (0xfe)
    Packet Data Length: 0
    [Response in: 162]

No.     Time           Source                Destination           Protocol Length Info 
    162 33.826710      1.5.1                 host                  USB      27     URB_FUNCTION_SYNC_RESET_PIPE_AND_CLEAR_STALL

Frame 162: 27 bytes on wire (216 bits), 27 bytes captured (216 bits)
USB URB
    [Source: 1.5.1]
    [Destination: host]
    USBPcap pseudoheader length: 27
    IRP ID: 0xffffaf8203989010
    IRP USBD_STATUS: USBD_STATUS_SUCCESS (0x00000000)
    URB Function: URB_FUNCTION_SYNC_RESET_PIPE_AND_CLEAR_STALL (0x001e)
    IRP information: 0x01, Direction: PDO -> FDO
    URB bus id: 1
    Device address: 5
    Endpoint: 0x81, Direction: IN
    URB transfer type: USB IRP Info (0xfe)
    Packet Data Length: 0
    [Request in: 161]
    [Time from request: 0.000457000 seconds]

No.     Time           Source                Destination           Protocol Length Info 
    163 33.939165      host                  1.5.2                 USB      35     URB_BULK out

Frame 163: 35 bytes on wire (280 bits), 35 bytes captured (280 bits)
USB URB
    [Source: host]
    [Destination: 1.5.2]
    USBPcap pseudoheader length: 27
    IRP ID: 0xffffaf8202364010
    IRP USBD_STATUS: USBD_STATUS_SUCCESS (0x00000000)
    URB Function: URB_FUNCTION_BULK_OR_INTERRUPT_TRANSFER (0x0009)
    IRP information: 0x00, Direction: FDO -> PDO
    URB bus id: 1
    Device address: 5
    Endpoint: 0x02, Direction: OUT
    URB transfer type: URB_BULK (0x03)
    Packet Data Length: 8
    [Response in: 164]
    [bInterfaceClass: Printer (0x07)]
Leftover Capture Data: 7b434f4d4d49547d

No.     Time           Source                Destination           Protocol Length Info 
    164 33.939227      1.5.2                 host                  USB      27     URB_BULK out

Frame 164: 27 bytes on wire (216 bits), 27 bytes captured (216 bits)
USB URB
    [Source: 1.5.2]
    [Destination: host]
    USBPcap pseudoheader length: 27
    IRP ID: 0xffffaf8202364010
    IRP USBD_STATUS: USBD_STATUS_SUCCESS (0x00000000)
    URB Function: URB_FUNCTION_BULK_OR_INTERRUPT_TRANSFER (0x0009)
    IRP information: 0x01, Direction: PDO -> FDO
    URB bus id: 1
    Device address: 5
    Endpoint: 0x02, Direction: OUT
    URB transfer type: URB_BULK (0x03)
    Packet Data Length: 0
    [Request in: 163]
    [Time from request: 0.000062000 seconds]
    [bInterfaceClass: Printer (0x07)]

No.     Time           Source                Destination           Protocol Length Info 
    165 33.939245      host                  1.5.1                 USB      27     URB_BULK in

Frame 165: 27 bytes on wire (216 bits), 27 bytes captured (216 bits)
USB URB
    [Source: host]
    [Destination: 1.5.1]
    USBPcap pseudoheader length: 27
    IRP ID: 0xffffaf8202364010
    IRP USBD_STATUS: USBD_STATUS_SUCCESS (0x00000000)
    URB Function: URB_FUNCTION_BULK_OR_INTERRUPT_TRANSFER (0x0009)
    IRP information: 0x00, Direction: FDO -> PDO
    URB bus id: 1
    Device address: 5
    Endpoint: 0x81, Direction: IN
    URB transfer type: URB_BULK (0x03)
    Packet Data Length: 0
    [Response in: 166]
    [bInterfaceClass: Printer (0x07)]

No.     Time           Source                Destination           Protocol Length Info 
    166 34.939219      1.5.1                 host                  USB      27     URB_BULK in

Frame 166: 27 bytes on wire (216 bits), 27 bytes captured (216 bits)
USB URB
    [Source: 1.5.1]
    [Destination: host]
    USBPcap pseudoheader length: 27
    IRP ID: 0xffffaf8202364010
    IRP USBD_STATUS: USBD_STATUS_CANCELED (0xc0010000)
    URB Function: URB_FUNCTION_BULK_OR_INTERRUPT_TRANSFER (0x0009)
    IRP information: 0x01, Direction: PDO -> FDO
    URB bus id: 1
    Device address: 5
    Endpoint: 0x81, Direction: IN
    URB transfer type: URB_BULK (0x03)
    Packet Data Length: 0
    [Request in: 165]
    [Time from request: 0.999974000 seconds]
    [bInterfaceClass: Printer (0x07)]

No.     Time           Source                Destination           Protocol Length Info 
    167 34.939243      host                  1.5.1                 USB      27     URB_FUNCTION_SYNC_RESET_PIPE_AND_CLEAR_STALL

Frame 167: 27 bytes on wire (216 bits), 27 bytes captured (216 bits)
USB URB
    [Source: host]
    [Destination: 1.5.1]
    USBPcap pseudoheader length: 27
    IRP ID: 0xffffaf82236e9ab0
    IRP USBD_STATUS: USBD_STATUS_SUCCESS (0x00000000)
    URB Function: URB_FUNCTION_SYNC_RESET_PIPE_AND_CLEAR_STALL (0x001e)
    IRP information: 0x00, Direction: FDO -> PDO
    URB bus id: 1
    Device address: 5
    Endpoint: 0x81, Direction: IN
    URB transfer type: USB IRP Info (0xfe)
    Packet Data Length: 0
    [Response in: 168]

No.     Time           Source                Destination           Protocol Length Info 
    168 34.939606      1.5.1                 host                  USB      27     URB_FUNCTION_SYNC_RESET_PIPE_AND_CLEAR_STALL

Frame 168: 27 bytes on wire (216 bits), 27 bytes captured (216 bits)
USB URB
    [Source: 1.5.1]
    [Destination: host]
    USBPcap pseudoheader length: 27
    IRP ID: 0xffffaf82236e9ab0
    IRP USBD_STATUS: USBD_STATUS_SUCCESS (0x00000000)
    URB Function: URB_FUNCTION_SYNC_RESET_PIPE_AND_CLEAR_STALL (0x001e)
    IRP information: 0x01, Direction: PDO -> FDO
    URB bus id: 1
    Device address: 5
    Endpoint: 0x81, Direction: IN
    URB transfer type: USB IRP Info (0xfe)
    Packet Data Length: 0
    [Request in: 167]
    [Time from request: 0.000363000 seconds]

No.     Time           Source                Destination           Protocol Length Info 
    169 34.950186      host                  1.5.1                 USB      27     URB_BULK in

Frame 169: 27 bytes on wire (216 bits), 27 bytes captured (216 bits)
USB URB
    [Source: host]
    [Destination: 1.5.1]
    USBPcap pseudoheader length: 27
    IRP ID: 0xffffaf8202784010
    IRP USBD_STATUS: USBD_STATUS_SUCCESS (0x00000000)
    URB Function: URB_FUNCTION_BULK_OR_INTERRUPT_TRANSFER (0x0009)
    IRP information: 0x00, Direction: FDO -> PDO
    URB bus id: 1
    Device address: 5
    Endpoint: 0x81, Direction: IN
    URB transfer type: URB_BULK (0x03)
    Packet Data Length: 0
    [Response in: 170]
    [bInterfaceClass: Printer (0x07)]

No.     Time           Source                Destination           Protocol Length Info 
    170 35.950753      1.5.1                 host                  USB      27     URB_BULK in

Frame 170: 27 bytes on wire (216 bits), 27 bytes captured (216 bits)
USB URB
    [Source: 1.5.1]
    [Destination: host]
    USBPcap pseudoheader length: 27
    IRP ID: 0xffffaf8202784010
    IRP USBD_STATUS: USBD_STATUS_CANCELED (0xc0010000)
    URB Function: URB_FUNCTION_BULK_OR_INTERRUPT_TRANSFER (0x0009)
    IRP information: 0x01, Direction: PDO -> FDO
    URB bus id: 1
    Device address: 5
    Endpoint: 0x81, Direction: IN
    URB transfer type: URB_BULK (0x03)
    Packet Data Length: 0
    [Request in: 169]
    [Time from request: 1.000567000 seconds]
    [bInterfaceClass: Printer (0x07)]

No.     Time           Source                Destination           Protocol Length Info 
    171 35.950825      host                  1.5.1                 USB      27     URB_FUNCTION_SYNC_RESET_PIPE_AND_CLEAR_STALL

Frame 171: 27 bytes on wire (216 bits), 27 bytes captured (216 bits)
USB URB
    [Source: host]
    [Destination: 1.5.1]
    USBPcap pseudoheader length: 27
    IRP ID: 0xffffaf8224253ab0
    IRP USBD_STATUS: USBD_STATUS_SUCCESS (0x00000000)
    URB Function: URB_FUNCTION_SYNC_RESET_PIPE_AND_CLEAR_STALL (0x001e)
    IRP information: 0x00, Direction: FDO -> PDO
    URB bus id: 1
    Device address: 5
    Endpoint: 0x81, Direction: IN
    URB transfer type: USB IRP Info (0xfe)
    Packet Data Length: 0
    [Response in: 172]

No.     Time           Source                Destination           Protocol Length Info 
    172 35.951408      1.5.1                 host                  USB      27     URB_FUNCTION_SYNC_RESET_PIPE_AND_CLEAR_STALL

Frame 172: 27 bytes on wire (216 bits), 27 bytes captured (216 bits)
USB URB
    [Source: 1.5.1]
    [Destination: host]
    USBPcap pseudoheader length: 27
    IRP ID: 0xffffaf8224253ab0
    IRP USBD_STATUS: USBD_STATUS_SUCCESS (0x00000000)
    URB Function: URB_FUNCTION_SYNC_RESET_PIPE_AND_CLEAR_STALL (0x001e)
    IRP information: 0x01, Direction: PDO -> FDO
    URB bus id: 1
    Device address: 5
    Endpoint: 0x81, Direction: IN
    URB transfer type: USB IRP Info (0xfe)
    Packet Data Length: 0
    [Request in: 171]
    [Time from request: 0.000583000 seconds]

No.     Time           Source                Destination           Protocol Length Info 
    173 36.063674      host                  1.5.2                 USB      34     URB_BULK out

Frame 173: 34 bytes on wire (272 bits), 34 bytes captured (272 bits)
USB URB
    [Source: host]
    [Destination: 1.5.2]
    USBPcap pseudoheader length: 27
    IRP ID: 0xffffaf822591c450
    IRP USBD_STATUS: USBD_STATUS_SUCCESS (0x00000000)
    URB Function: URB_FUNCTION_BULK_OR_INTERRUPT_TRANSFER (0x0009)
    IRP information: 0x00, Direction: FDO -> PDO
    URB bus id: 1
    Device address: 5
    Endpoint: 0x02, Direction: OUT
    URB transfer type: URB_BULK (0x03)
    Packet Data Length: 7
    [Response in: 174]
    [bInterfaceClass: Printer (0x07)]
Leftover Capture Data: 1b455a7b4c507d

No.     Time           Source                Destination           Protocol Length Info 
    174 36.063792      1.5.2                 host                  USB      27     URB_BULK out

Frame 174: 27 bytes on wire (216 bits), 27 bytes captured (216 bits)
USB URB
    [Source: 1.5.2]
    [Destination: host]
    USBPcap pseudoheader length: 27
    IRP ID: 0xffffaf822591c450
    IRP USBD_STATUS: USBD_STATUS_SUCCESS (0x00000000)
    URB Function: URB_FUNCTION_BULK_OR_INTERRUPT_TRANSFER (0x0009)
    IRP information: 0x01, Direction: PDO -> FDO
    URB bus id: 1
    Device address: 5
    Endpoint: 0x02, Direction: OUT
    URB transfer type: URB_BULK (0x03)
    Packet Data Length: 0
    [Request in: 173]
    [Time from request: 0.000118000 seconds]
    [bInterfaceClass: Printer (0x07)]

No.     Time           Source                Destination           Protocol Length Info 
    175 36.063904      host                  1.5.1                 USB      27     URB_BULK in

Frame 175: 27 bytes on wire (216 bits), 27 bytes captured (216 bits)
USB URB
    [Source: host]
    [Destination: 1.5.1]
    USBPcap pseudoheader length: 27
    IRP ID: 0xffffaf822591c450
    IRP USBD_STATUS: USBD_STATUS_SUCCESS (0x00000000)
    URB Function: URB_FUNCTION_BULK_OR_INTERRUPT_TRANSFER (0x0009)
    IRP information: 0x00, Direction: FDO -> PDO
    URB bus id: 1
    Device address: 5
    Endpoint: 0x81, Direction: IN
    URB transfer type: URB_BULK (0x03)
    Packet Data Length: 0
    [Response in: 176]
    [bInterfaceClass: Printer (0x07)]

No.     Time           Source                Destination           Protocol Length Info 
    176 37.063895      1.5.1                 host                  USB      27     URB_BULK in

Frame 176: 27 bytes on wire (216 bits), 27 bytes captured (216 bits)
USB URB
    [Source: 1.5.1]
    [Destination: host]
    USBPcap pseudoheader length: 27
    IRP ID: 0xffffaf822591c450
    IRP USBD_STATUS: USBD_STATUS_CANCELED (0xc0010000)
    URB Function: URB_FUNCTION_BULK_OR_INTERRUPT_TRANSFER (0x0009)
    IRP information: 0x01, Direction: PDO -> FDO
    URB bus id: 1
    Device address: 5
    Endpoint: 0x81, Direction: IN
    URB transfer type: URB_BULK (0x03)
    Packet Data Length: 0
    [Request in: 175]
    [Time from request: 0.999991000 seconds]
    [bInterfaceClass: Printer (0x07)]

No.     Time           Source                Destination           Protocol Length Info 
    177 37.063989      host                  1.5.1                 USB      27     URB_FUNCTION_SYNC_RESET_PIPE_AND_CLEAR_STALL

Frame 177: 27 bytes on wire (216 bits), 27 bytes captured (216 bits)
USB URB
    [Source: host]
    [Destination: 1.5.1]
    USBPcap pseudoheader length: 27
    IRP ID: 0xffffaf8203610ab0
    IRP USBD_STATUS: USBD_STATUS_SUCCESS (0x00000000)
    URB Function: URB_FUNCTION_SYNC_RESET_PIPE_AND_CLEAR_STALL (0x001e)
    IRP information: 0x00, Direction: FDO -> PDO
    URB bus id: 1
    Device address: 5
    Endpoint: 0x81, Direction: IN
    URB transfer type: USB IRP Info (0xfe)
    Packet Data Length: 0
    [Response in: 178]

No.     Time           Source                Destination           Protocol Length Info 
    178 37.064448      1.5.1                 host                  USB      27     URB_FUNCTION_SYNC_RESET_PIPE_AND_CLEAR_STALL

Frame 178: 27 bytes on wire (216 bits), 27 bytes captured (216 bits)
USB URB
    [Source: 1.5.1]
    [Destination: host]
    USBPcap pseudoheader length: 27
    IRP ID: 0xffffaf8203610ab0
    IRP USBD_STATUS: USBD_STATUS_SUCCESS (0x00000000)
    URB Function: URB_FUNCTION_SYNC_RESET_PIPE_AND_CLEAR_STALL (0x001e)
    IRP information: 0x01, Direction: PDO -> FDO
    URB bus id: 1
    Device address: 5
    Endpoint: 0x81, Direction: IN
    URB transfer type: USB IRP Info (0xfe)
    Packet Data Length: 0
    [Request in: 177]
    [Time from request: 0.000459000 seconds]

No.     Time           Source                Destination           Protocol Length Info 
    179 37.074925      host                  1.5.1                 USB      27     URB_BULK in

Frame 179: 27 bytes on wire (216 bits), 27 bytes captured (216 bits)
USB URB
    [Source: host]
    [Destination: 1.5.1]
    USBPcap pseudoheader length: 27
    IRP ID: 0xffffaf82026e9010
    IRP USBD_STATUS: USBD_STATUS_SUCCESS (0x00000000)
    URB Function: URB_FUNCTION_BULK_OR_INTERRUPT_TRANSFER (0x0009)
    IRP information: 0x00, Direction: FDO -> PDO
    URB bus id: 1
    Device address: 5
    Endpoint: 0x81, Direction: IN
    URB transfer type: URB_BULK (0x03)
    Packet Data Length: 0
    [Response in: 180]
    [bInterfaceClass: Printer (0x07)]

No.     Time           Source                Destination           Protocol Length Info 
    180 38.075350      1.5.1                 host                  USB      27     URB_BULK in

Frame 180: 27 bytes on wire (216 bits), 27 bytes captured (216 bits)
USB URB
    [Source: 1.5.1]
    [Destination: host]
    USBPcap pseudoheader length: 27
    IRP ID: 0xffffaf82026e9010
    IRP USBD_STATUS: USBD_STATUS_CANCELED (0xc0010000)
    URB Function: URB_FUNCTION_BULK_OR_INTERRUPT_TRANSFER (0x0009)
    IRP information: 0x01, Direction: PDO -> FDO
    URB bus id: 1
    Device address: 5
    Endpoint: 0x81, Direction: IN
    URB transfer type: URB_BULK (0x03)
    Packet Data Length: 0
    [Request in: 179]
    [Time from request: 1.000425000 seconds]
    [bInterfaceClass: Printer (0x07)]

No.     Time           Source                Destination           Protocol Length Info 
    181 38.075374      host                  1.5.1                 USB      27     URB_FUNCTION_SYNC_RESET_PIPE_AND_CLEAR_STALL

Frame 181: 27 bytes on wire (216 bits), 27 bytes captured (216 bits)
USB URB
    [Source: host]
    [Destination: 1.5.1]
    USBPcap pseudoheader length: 27
    IRP ID: 0xffffaf820258d010
    IRP USBD_STATUS: USBD_STATUS_SUCCESS (0x00000000)
    URB Function: URB_FUNCTION_SYNC_RESET_PIPE_AND_CLEAR_STALL (0x001e)
    IRP information: 0x00, Direction: FDO -> PDO
    URB bus id: 1
    Device address: 5
    Endpoint: 0x81, Direction: IN
    URB transfer type: USB IRP Info (0xfe)
    Packet Data Length: 0
    [Response in: 182]

No.     Time           Source                Destination           Protocol Length Info 
    182 38.075720      1.5.1                 host                  USB      27     URB_FUNCTION_SYNC_RESET_PIPE_AND_CLEAR_STALL

Frame 182: 27 bytes on wire (216 bits), 27 bytes captured (216 bits)
USB URB
    [Source: 1.5.1]
    [Destination: host]
    USBPcap pseudoheader length: 27
    IRP ID: 0xffffaf820258d010
    IRP USBD_STATUS: USBD_STATUS_SUCCESS (0x00000000)
    URB Function: URB_FUNCTION_SYNC_RESET_PIPE_AND_CLEAR_STALL (0x001e)
    IRP information: 0x01, Direction: PDO -> FDO
    URB bus id: 1
    Device address: 5
    Endpoint: 0x81, Direction: IN
    URB transfer type: USB IRP Info (0xfe)
    Packet Data Length: 0
    [Request in: 181]
    [Time from request: 0.000346000 seconds]

No.     Time           Source                Destination           Protocol Length Info 
    183 41.310625      host                  1.5.2                 USB      33     URB_BULK out

Frame 183: 33 bytes on wire (264 bits), 33 bytes captured (264 bits)
USB URB
    [Source: host]
    [Destination: 1.5.2]
    USBPcap pseudoheader length: 27
    IRP ID: 0xffffaf8202596ab0
    IRP USBD_STATUS: USBD_STATUS_SUCCESS (0x00000000)
    URB Function: URB_FUNCTION_BULK_OR_INTERRUPT_TRANSFER (0x0009)
    IRP information: 0x00, Direction: FDO -> PDO
    URB bus id: 1
    Device address: 5
    Endpoint: 0x02, Direction: OUT
    URB transfer type: URB_BULK (0x03)
    Packet Data Length: 6
    [Response in: 184]
    [bInterfaceClass: Printer (0x07)]
Leftover Capture Data: 1b7b43463f7d

No.     Time           Source                Destination           Protocol Length Info 
    184 41.310735      1.5.2                 host                  USB      27     URB_BULK out

Frame 184: 27 bytes on wire (216 bits), 27 bytes captured (216 bits)
USB URB
    [Source: 1.5.2]
    [Destination: host]
    USBPcap pseudoheader length: 27
    IRP ID: 0xffffaf8202596ab0
    IRP USBD_STATUS: USBD_STATUS_SUCCESS (0x00000000)
    URB Function: URB_FUNCTION_BULK_OR_INTERRUPT_TRANSFER (0x0009)
    IRP information: 0x01, Direction: PDO -> FDO
    URB bus id: 1
    Device address: 5
    Endpoint: 0x02, Direction: OUT
    URB transfer type: URB_BULK (0x03)
    Packet Data Length: 0
    [Request in: 183]
    [Time from request: 0.000110000 seconds]
    [bInterfaceClass: Printer (0x07)]

No.     Time           Source                Destination           Protocol Length Info 
    185 41.310788      host                  1.5.1                 USB      27     URB_BULK in

Frame 185: 27 bytes on wire (216 bits), 27 bytes captured (216 bits)
USB URB
    [Source: host]
    [Destination: 1.5.1]
    USBPcap pseudoheader length: 27
    IRP ID: 0xffffaf8202596ab0
    IRP USBD_STATUS: USBD_STATUS_SUCCESS (0x00000000)
    URB Function: URB_FUNCTION_BULK_OR_INTERRUPT_TRANSFER (0x0009)
    IRP information: 0x00, Direction: FDO -> PDO
    URB bus id: 1
    Device address: 5
    Endpoint: 0x81, Direction: IN
    URB transfer type: URB_BULK (0x03)
    Packet Data Length: 0
    [Response in: 186]
    [bInterfaceClass: Printer (0x07)]

No.     Time           Source                Destination           Protocol Length Info 
    186 41.339288      1.5.1                 host                  USB      73     URB_BULK in

Frame 186: 73 bytes on wire (584 bits), 73 bytes captured (584 bits)
USB URB
    [Source: 1.5.1]
    [Destination: host]
    USBPcap pseudoheader length: 27
    IRP ID: 0xffffaf8202596ab0
    IRP USBD_STATUS: USBD_STATUS_SUCCESS (0x00000000)
    URB Function: URB_FUNCTION_BULK_OR_INTERRUPT_TRANSFER (0x0009)
    IRP information: 0x01, Direction: PDO -> FDO
    URB bus id: 1
    Device address: 5
    Endpoint: 0x81, Direction: IN
    URB transfer type: URB_BULK (0x03)
    Packet Data Length: 46
    [Request in: 185]
    [Time from request: 0.028500000 seconds]
    [bInterfaceClass: Printer (0x07)]
Leftover Capture Data: 7b4346214c3a4c503b423a3131353b503a4e3b4e3a383b48…

No.     Time           Source                Destination           Protocol Length Info 
    187 43.454890      host                  1.5.2                 USB      34     URB_BULK out

Frame 187: 34 bytes on wire (272 bits), 34 bytes captured (272 bits)
USB URB
    [Source: host]
    [Destination: 1.5.2]
    USBPcap pseudoheader length: 27
    IRP ID: 0xffffaf8202596ab0
    IRP USBD_STATUS: USBD_STATUS_SUCCESS (0x00000000)
    URB Function: URB_FUNCTION_BULK_OR_INTERRUPT_TRANSFER (0x0009)
    IRP information: 0x00, Direction: FDO -> PDO
    URB bus id: 1
    Device address: 5
    Endpoint: 0x02, Direction: OUT
    URB transfer type: URB_BULK (0x03)
    Packet Data Length: 7
    [Response in: 188]
    [bInterfaceClass: Printer (0x07)]
Leftover Capture Data: 1b455a7b4c507d

No.     Time           Source                Destination           Protocol Length Info 
    188 43.454989      1.5.2                 host                  USB      27     URB_BULK out

Frame 188: 27 bytes on wire (216 bits), 27 bytes captured (216 bits)
USB URB
    [Source: 1.5.2]
    [Destination: host]
    USBPcap pseudoheader length: 27
    IRP ID: 0xffffaf8202596ab0
    IRP USBD_STATUS: USBD_STATUS_SUCCESS (0x00000000)
    URB Function: URB_FUNCTION_BULK_OR_INTERRUPT_TRANSFER (0x0009)
    IRP information: 0x01, Direction: PDO -> FDO
    URB bus id: 1
    Device address: 5
    Endpoint: 0x02, Direction: OUT
    URB transfer type: URB_BULK (0x03)
    Packet Data Length: 0
    [Request in: 187]
    [Time from request: 0.000099000 seconds]
    [bInterfaceClass: Printer (0x07)]

No.     Time           Source                Destination           Protocol Length Info 
    189 43.455011      host                  1.5.1                 USB      27     URB_BULK in

Frame 189: 27 bytes on wire (216 bits), 27 bytes captured (216 bits)
USB URB
    [Source: host]
    [Destination: 1.5.1]
    USBPcap pseudoheader length: 27
    IRP ID: 0xffffaf82036d2420
    IRP USBD_STATUS: USBD_STATUS_SUCCESS (0x00000000)
    URB Function: URB_FUNCTION_BULK_OR_INTERRUPT_TRANSFER (0x0009)
    IRP information: 0x00, Direction: FDO -> PDO
    URB bus id: 1
    Device address: 5
    Endpoint: 0x81, Direction: IN
    URB transfer type: URB_BULK (0x03)
    Packet Data Length: 0
    [Response in: 190]
    [bInterfaceClass: Printer (0x07)]

No.     Time           Source                Destination           Protocol Length Info 
    190 44.454951      1.5.1                 host                  USB      27     URB_BULK in

Frame 190: 27 bytes on wire (216 bits), 27 bytes captured (216 bits)
USB URB
    [Source: 1.5.1]
    [Destination: host]
    USBPcap pseudoheader length: 27
    IRP ID: 0xffffaf82036d2420
    IRP USBD_STATUS: USBD_STATUS_CANCELED (0xc0010000)
    URB Function: URB_FUNCTION_BULK_OR_INTERRUPT_TRANSFER (0x0009)
    IRP information: 0x01, Direction: PDO -> FDO
    URB bus id: 1
    Device address: 5
    Endpoint: 0x81, Direction: IN
    URB transfer type: URB_BULK (0x03)
    Packet Data Length: 0
    [Request in: 189]
    [Time from request: 0.999940000 seconds]
    [bInterfaceClass: Printer (0x07)]

No.     Time           Source                Destination           Protocol Length Info 
    191 44.455031      host                  1.5.1                 USB      27     URB_FUNCTION_SYNC_RESET_PIPE_AND_CLEAR_STALL

Frame 191: 27 bytes on wire (216 bits), 27 bytes captured (216 bits)
USB URB
    [Source: host]
    [Destination: 1.5.1]
    USBPcap pseudoheader length: 27
    IRP ID: 0xffffaf82027fdab0
    IRP USBD_STATUS: USBD_STATUS_SUCCESS (0x00000000)
    URB Function: URB_FUNCTION_SYNC_RESET_PIPE_AND_CLEAR_STALL (0x001e)
    IRP information: 0x00, Direction: FDO -> PDO
    URB bus id: 1
    Device address: 5
    Endpoint: 0x81, Direction: IN
    URB transfer type: USB IRP Info (0xfe)
    Packet Data Length: 0
    [Response in: 192]

No.     Time           Source                Destination           Protocol Length Info 
    192 44.455350      1.5.1                 host                  USB      27     URB_FUNCTION_SYNC_RESET_PIPE_AND_CLEAR_STALL

Frame 192: 27 bytes on wire (216 bits), 27 bytes captured (216 bits)
USB URB
    [Source: 1.5.1]
    [Destination: host]
    USBPcap pseudoheader length: 27
    IRP ID: 0xffffaf82027fdab0
    IRP USBD_STATUS: USBD_STATUS_SUCCESS (0x00000000)
    URB Function: URB_FUNCTION_SYNC_RESET_PIPE_AND_CLEAR_STALL (0x001e)
    IRP information: 0x01, Direction: PDO -> FDO
    URB bus id: 1
    Device address: 5
    Endpoint: 0x81, Direction: IN
    URB transfer type: USB IRP Info (0xfe)
    Packet Data Length: 0
    [Request in: 191]
    [Time from request: 0.000319000 seconds]

No.     Time           Source                Destination           Protocol Length Info 
    193 44.465865      host                  1.5.1                 USB      27     URB_BULK in

Frame 193: 27 bytes on wire (216 bits), 27 bytes captured (216 bits)
USB URB
    [Source: host]
    [Destination: 1.5.1]
    USBPcap pseudoheader length: 27
    IRP ID: 0xffffaf820275cab0
    IRP USBD_STATUS: USBD_STATUS_SUCCESS (0x00000000)
    URB Function: URB_FUNCTION_BULK_OR_INTERRUPT_TRANSFER (0x0009)
    IRP information: 0x00, Direction: FDO -> PDO
    URB bus id: 1
    Device address: 5
    Endpoint: 0x81, Direction: IN
    URB transfer type: URB_BULK (0x03)
    Packet Data Length: 0
    [Response in: 194]
    [bInterfaceClass: Printer (0x07)]

No.     Time           Source                Destination           Protocol Length Info 
    194 45.466323      1.5.1                 host                  USB      27     URB_BULK in

Frame 194: 27 bytes on wire (216 bits), 27 bytes captured (216 bits)
USB URB
    [Source: 1.5.1]
    [Destination: host]
    USBPcap pseudoheader length: 27
    IRP ID: 0xffffaf820275cab0
    IRP USBD_STATUS: USBD_STATUS_CANCELED (0xc0010000)
    URB Function: URB_FUNCTION_BULK_OR_INTERRUPT_TRANSFER (0x0009)
    IRP information: 0x01, Direction: PDO -> FDO
    URB bus id: 1
    Device address: 5
    Endpoint: 0x81, Direction: IN
    URB transfer type: URB_BULK (0x03)
    Packet Data Length: 0
    [Request in: 193]
    [Time from request: 1.000458000 seconds]
    [bInterfaceClass: Printer (0x07)]

No.     Time           Source                Destination           Protocol Length Info 
    195 45.466390      host                  1.5.1                 USB      27     URB_FUNCTION_SYNC_RESET_PIPE_AND_CLEAR_STALL

Frame 195: 27 bytes on wire (216 bits), 27 bytes captured (216 bits)
USB URB
    [Source: host]
    [Destination: 1.5.1]
    USBPcap pseudoheader length: 27
    IRP ID: 0xffffaf82300344f0
    IRP USBD_STATUS: USBD_STATUS_SUCCESS (0x00000000)
    URB Function: URB_FUNCTION_SYNC_RESET_PIPE_AND_CLEAR_STALL (0x001e)
    IRP information: 0x00, Direction: FDO -> PDO
    URB bus id: 1
    Device address: 5
    Endpoint: 0x81, Direction: IN
    URB transfer type: USB IRP Info (0xfe)
    Packet Data Length: 0
    [Response in: 196]

No.     Time           Source                Destination           Protocol Length Info 
    196 45.466714      1.5.1                 host                  USB      27     URB_FUNCTION_SYNC_RESET_PIPE_AND_CLEAR_STALL

Frame 196: 27 bytes on wire (216 bits), 27 bytes captured (216 bits)
USB URB
    [Source: 1.5.1]
    [Destination: host]
    USBPcap pseudoheader length: 27
    IRP ID: 0xffffaf82300344f0
    IRP USBD_STATUS: USBD_STATUS_SUCCESS (0x00000000)
    URB Function: URB_FUNCTION_SYNC_RESET_PIPE_AND_CLEAR_STALL (0x001e)
    IRP information: 0x01, Direction: PDO -> FDO
    URB bus id: 1
    Device address: 5
    Endpoint: 0x81, Direction: IN
    URB transfer type: USB IRP Info (0xfe)
    Packet Data Length: 0
    [Request in: 195]
    [Time from request: 0.000324000 seconds]

No.     Time           Source                Destination           Protocol Length Info 
    197 45.579214      host                  1.5.2                 USB      75     URB_BULK out

Frame 197: 75 bytes on wire (600 bits), 75 bytes captured (600 bits)
USB URB
    [Source: host]
    [Destination: 1.5.2]
    USBPcap pseudoheader length: 27
    IRP ID: 0xffffaf8202434ab0
    IRP USBD_STATUS: USBD_STATUS_SUCCESS (0x00000000)
    URB Function: URB_FUNCTION_BULK_OR_INTERRUPT_TRANSFER (0x0009)
    IRP information: 0x00, Direction: FDO -> PDO
    URB bus id: 1
    Device address: 5
    Endpoint: 0x02, Direction: OUT
    URB transfer type: URB_BULK (0x03)
    Packet Data Length: 48
    [Response in: 198]
    [bInterfaceClass: Printer (0x07)]
Leftover Capture Data: 1b7b50483f7d1b7b4d593f7d1b7b5153543a42417d1b7b53…

No.     Time           Source                Destination           Protocol Length Info 
    198 45.579284      1.5.2                 host                  USB      27     URB_BULK out

Frame 198: 27 bytes on wire (216 bits), 27 bytes captured (216 bits)
USB URB
    [Source: 1.5.2]
    [Destination: host]
    USBPcap pseudoheader length: 27
    IRP ID: 0xffffaf8202434ab0
    IRP USBD_STATUS: USBD_STATUS_SUCCESS (0x00000000)
    URB Function: URB_FUNCTION_BULK_OR_INTERRUPT_TRANSFER (0x0009)
    IRP information: 0x01, Direction: PDO -> FDO
    URB bus id: 1
    Device address: 5
    Endpoint: 0x02, Direction: OUT
    URB transfer type: URB_BULK (0x03)
    Packet Data Length: 0
    [Request in: 197]
    [Time from request: 0.000070000 seconds]
    [bInterfaceClass: Printer (0x07)]

No.     Time           Source                Destination           Protocol Length Info 
    199 45.579337      host                  1.5.1                 USB      27     URB_BULK in

Frame 199: 27 bytes on wire (216 bits), 27 bytes captured (216 bits)
USB URB
    [Source: host]
    [Destination: 1.5.1]
    USBPcap pseudoheader length: 27
    IRP ID: 0xffffaf8202434ab0
    IRP USBD_STATUS: USBD_STATUS_SUCCESS (0x00000000)
    URB Function: URB_FUNCTION_BULK_OR_INTERRUPT_TRANSFER (0x0009)
    IRP information: 0x00, Direction: FDO -> PDO
    URB bus id: 1
    Device address: 5
    Endpoint: 0x81, Direction: IN
    URB transfer type: URB_BULK (0x03)
    Packet Data Length: 0
    [Response in: 200]
    [bInterfaceClass: Printer (0x07)]

No.     Time           Source                Destination           Protocol Length Info 
    200 45.592222      1.5.1                 host                  USB      65     URB_BULK in

Frame 200: 65 bytes on wire (520 bits), 65 bytes captured (520 bits)
USB URB
    [Source: 1.5.1]
    [Destination: host]
    USBPcap pseudoheader length: 27
    IRP ID: 0xffffaf8202434ab0
    IRP USBD_STATUS: USBD_STATUS_SUCCESS (0x00000000)
    URB Function: URB_FUNCTION_BULK_OR_INTERRUPT_TRANSFER (0x0009)
    IRP information: 0x01, Direction: PDO -> FDO
    URB bus id: 1
    Device address: 5
    Endpoint: 0x81, Direction: IN
    URB transfer type: URB_BULK (0x03)
    Packet Data Length: 38
    [Request in: 199]
    [Time from request: 0.012885000 seconds]
    [bInterfaceClass: Printer (0x07)]
Leftover Capture Data: 7b50482154443a303836343b44443a3230333b4d3a4b796f…

No.     Time           Source                Destination           Protocol Length Info 
    201 45.592314      host                  1.5.1                 USB      27     URB_BULK in

Frame 201: 27 bytes on wire (216 bits), 27 bytes captured (216 bits)
USB URB
    [Source: host]
    [Destination: 1.5.1]
    USBPcap pseudoheader length: 27
    IRP ID: 0xffffaf8202434ab0
    IRP USBD_STATUS: USBD_STATUS_SUCCESS (0x00000000)
    URB Function: URB_FUNCTION_BULK_OR_INTERRUPT_TRANSFER (0x0009)
    IRP information: 0x00, Direction: FDO -> PDO
    URB bus id: 1
    Device address: 5
    Endpoint: 0x81, Direction: IN
    URB transfer type: URB_BULK (0x03)
    Packet Data Length: 0
    [Response in: 202]
    [bInterfaceClass: Printer (0x07)]

No.     Time           Source                Destination           Protocol Length Info 
    202 45.599028      1.5.1                 host                  USB      78     URB_BULK in

Frame 202: 78 bytes on wire (624 bits), 78 bytes captured (624 bits)
USB URB
    [Source: 1.5.1]
    [Destination: host]
    USBPcap pseudoheader length: 27
    IRP ID: 0xffffaf8202434ab0
    IRP USBD_STATUS: USBD_STATUS_SUCCESS (0x00000000)
    URB Function: URB_FUNCTION_BULK_OR_INTERRUPT_TRANSFER (0x0009)
    IRP information: 0x01, Direction: PDO -> FDO
    URB bus id: 1
    Device address: 5
    Endpoint: 0x81, Direction: IN
    URB transfer type: URB_BULK (0x03)
    Packet Data Length: 51
    [Request in: 201]
    [Time from request: 0.006714000 seconds]
    [bInterfaceClass: Printer (0x07)]
Leftover Capture Data: 7b4d592146533a3531324d3b464d3a53544d3b52533a3132…

No.     Time           Source                Destination           Protocol Length Info 
    203 45.599149      host                  1.5.1                 USB      27     URB_BULK in

Frame 203: 27 bytes on wire (216 bits), 27 bytes captured (216 bits)
USB URB
    [Source: host]
    [Destination: 1.5.1]
    USBPcap pseudoheader length: 27
    IRP ID: 0xffffaf8202434ab0
    IRP USBD_STATUS: USBD_STATUS_SUCCESS (0x00000000)
    URB Function: URB_FUNCTION_BULK_OR_INTERRUPT_TRANSFER (0x0009)
    IRP information: 0x00, Direction: FDO -> PDO
    URB bus id: 1
    Device address: 5
    Endpoint: 0x81, Direction: IN
    URB transfer type: URB_BULK (0x03)
    Packet Data Length: 0
    [Response in: 204]
    [bInterfaceClass: Printer (0x07)]

No.     Time           Source                Destination           Protocol Length Info 
    204 45.599718      1.5.1                 host                  USB      150    URB_BULK in

Frame 204: 150 bytes on wire (1200 bits), 150 bytes captured (1200 bits)
USB URB
    [Source: 1.5.1]
    [Destination: host]
    USBPcap pseudoheader length: 27
    IRP ID: 0xffffaf8202434ab0
    IRP USBD_STATUS: USBD_STATUS_SUCCESS (0x00000000)
    URB Function: URB_FUNCTION_BULK_OR_INTERRUPT_TRANSFER (0x0009)
    IRP information: 0x01, Direction: PDO -> FDO
    URB bus id: 1
    Device address: 5
    Endpoint: 0x81, Direction: IN
    URB transfer type: URB_BULK (0x03)
    Packet Data Length: 123
    [Request in: 203]
    [Time from request: 0.000569000 seconds]
    [bInterfaceClass: Printer (0x07)]
Leftover Capture Data: 7b5153543a42413a41443a3030303636363033383443393b…

No.     Time           Source                Destination           Protocol Length Info 
    205 45.600092      host                  1.5.1                 USB      27     URB_BULK in

Frame 205: 27 bytes on wire (216 bits), 27 bytes captured (216 bits)
USB URB
    [Source: host]
    [Destination: 1.5.1]
    USBPcap pseudoheader length: 27
    IRP ID: 0xffffaf8202434ab0
    IRP USBD_STATUS: USBD_STATUS_SUCCESS (0x00000000)
    URB Function: URB_FUNCTION_BULK_OR_INTERRUPT_TRANSFER (0x0009)
    IRP information: 0x00, Direction: FDO -> PDO
    URB bus id: 1
    Device address: 5
    Endpoint: 0x81, Direction: IN
    URB transfer type: URB_BULK (0x03)
    Packet Data Length: 0
    [Response in: 206]
    [bInterfaceClass: Printer (0x07)]

No.     Time           Source                Destination           Protocol Length Info 
    206 45.600951      1.5.1                 host                  USB      37     URB_BULK in

Frame 206: 37 bytes on wire (296 bits), 37 bytes captured (296 bits)
USB URB
    [Source: 1.5.1]
    [Destination: host]
    USBPcap pseudoheader length: 27
    IRP ID: 0xffffaf8202434ab0
    IRP USBD_STATUS: USBD_STATUS_SUCCESS (0x00000000)
    URB Function: URB_FUNCTION_BULK_OR_INTERRUPT_TRANSFER (0x0009)
    IRP information: 0x01, Direction: PDO -> FDO
    URB bus id: 1
    Device address: 5
    Endpoint: 0x81, Direction: IN
    URB transfer type: URB_BULK (0x03)
    Packet Data Length: 10
    [Request in: 205]
    [Time from request: 0.000859000 seconds]
    [bInterfaceClass: Printer (0x07)]
Leftover Capture Data: 2544415441454e44250a

No.     Time           Source                Destination           Protocol Length Info 
    207 45.601344      host                  1.5.1                 USB      27     URB_BULK in

Frame 207: 27 bytes on wire (216 bits), 27 bytes captured (216 bits)
USB URB
    [Source: host]
    [Destination: 1.5.1]
    USBPcap pseudoheader length: 27
    IRP ID: 0xffffaf8202434ab0
    IRP USBD_STATUS: USBD_STATUS_SUCCESS (0x00000000)
    URB Function: URB_FUNCTION_BULK_OR_INTERRUPT_TRANSFER (0x0009)
    IRP information: 0x00, Direction: FDO -> PDO
    URB bus id: 1
    Device address: 5
    Endpoint: 0x81, Direction: IN
    URB transfer type: URB_BULK (0x03)
    Packet Data Length: 0
    [Response in: 208]
    [bInterfaceClass: Printer (0x07)]

No.     Time           Source                Destination           Protocol Length Info 
    208 45.601550      1.5.1                 host                  USB      38     URB_BULK in

Frame 208: 38 bytes on wire (304 bits), 38 bytes captured (304 bits)
USB URB
    [Source: 1.5.1]
    [Destination: host]
    USBPcap pseudoheader length: 27
    IRP ID: 0xffffaf8202434ab0
    IRP USBD_STATUS: USBD_STATUS_SUCCESS (0x00000000)
    URB Function: URB_FUNCTION_BULK_OR_INTERRUPT_TRANSFER (0x0009)
    IRP information: 0x01, Direction: PDO -> FDO
    URB bus id: 1
    Device address: 5
    Endpoint: 0x81, Direction: IN
    URB transfer type: URB_BULK (0x03)
    Packet Data Length: 11
    [Request in: 207]
    [Time from request: 0.000206000 seconds]
    [bInterfaceClass: Printer (0x07)]
Leftover Capture Data: 7b5359533a52554e3a307d

No.     Time           Source                Destination           Protocol Length Info 
    209 45.701777      host                  1.5.2                 USB      48     URB_BULK out

Frame 209: 48 bytes on wire (384 bits), 48 bytes captured (384 bits)
USB URB
    [Source: host]
    [Destination: 1.5.2]
    USBPcap pseudoheader length: 27
    IRP ID: 0xffffaf8202434ab0
    IRP USBD_STATUS: USBD_STATUS_SUCCESS (0x00000000)
    URB Function: URB_FUNCTION_BULK_OR_INTERRUPT_TRANSFER (0x0009)
    IRP information: 0x00, Direction: FDO -> PDO
    URB bus id: 1
    Device address: 5
    Endpoint: 0x02, Direction: OUT
    URB transfer type: URB_BULK (0x03)
    Packet Data Length: 21
    [Response in: 210]
    [bInterfaceClass: Printer (0x07)]
Leftover Capture Data: 1b7b5359533a52554e3a6c6c202f642f464f4e547d

No.     Time           Source                Destination           Protocol Length Info 
    210 45.701828      1.5.2                 host                  USB      27     URB_BULK out

Frame 210: 27 bytes on wire (216 bits), 27 bytes captured (216 bits)
USB URB
    [Source: 1.5.2]
    [Destination: host]
    USBPcap pseudoheader length: 27
    IRP ID: 0xffffaf8202434ab0
    IRP USBD_STATUS: USBD_STATUS_SUCCESS (0x00000000)
    URB Function: URB_FUNCTION_BULK_OR_INTERRUPT_TRANSFER (0x0009)
    IRP information: 0x01, Direction: PDO -> FDO
    URB bus id: 1
    Device address: 5
    Endpoint: 0x02, Direction: OUT
    URB transfer type: URB_BULK (0x03)
    Packet Data Length: 0
    [Request in: 209]
    [Time from request: 0.000051000 seconds]
    [bInterfaceClass: Printer (0x07)]

No.     Time           Source                Destination           Protocol Length Info 
    211 45.701886      host                  1.5.1                 USB      27     URB_BULK in

Frame 211: 27 bytes on wire (216 bits), 27 bytes captured (216 bits)
USB URB
    [Source: host]
    [Destination: 1.5.1]
    USBPcap pseudoheader length: 27
    IRP ID: 0xffffaf8202434ab0
    IRP USBD_STATUS: USBD_STATUS_SUCCESS (0x00000000)
    URB Function: URB_FUNCTION_BULK_OR_INTERRUPT_TRANSFER (0x0009)
    IRP information: 0x00, Direction: FDO -> PDO
    URB bus id: 1
    Device address: 5
    Endpoint: 0x81, Direction: IN
    URB transfer type: URB_BULK (0x03)
    Packet Data Length: 0
    [Response in: 212]
    [bInterfaceClass: Printer (0x07)]

No.     Time           Source                Destination           Protocol Length Info 
    212 45.759192      1.5.1                 host                  USB      88     URB_BULK in

Frame 212: 88 bytes on wire (704 bits), 88 bytes captured (704 bits)
USB URB
    [Source: 1.5.1]
    [Destination: host]
    USBPcap pseudoheader length: 27
    IRP ID: 0xffffaf8202434ab0
    IRP USBD_STATUS: USBD_STATUS_SUCCESS (0x00000000)
    URB Function: URB_FUNCTION_BULK_OR_INTERRUPT_TRANSFER (0x0009)
    IRP information: 0x01, Direction: PDO -> FDO
    URB bus id: 1
    Device address: 5
    Endpoint: 0x81, Direction: IN
    URB transfer type: URB_BULK (0x03)
    Packet Data Length: 61
    [Request in: 211]
    [Time from request: 0.057306000 seconds]
    [bInterfaceClass: Printer (0x07)]
Leftover Capture Data: 2d72772d2d2d2d722d2d2020203120757365722020202020…

No.     Time           Source                Destination           Protocol Length Info 
    213 45.759262      host                  1.5.1                 USB      27     URB_BULK in

Frame 213: 27 bytes on wire (216 bits), 27 bytes captured (216 bits)
USB URB
    [Source: host]
    [Destination: 1.5.1]
    USBPcap pseudoheader length: 27
    IRP ID: 0xffffaf8202434ab0
    IRP USBD_STATUS: USBD_STATUS_SUCCESS (0x00000000)
    URB Function: URB_FUNCTION_BULK_OR_INTERRUPT_TRANSFER (0x0009)
    IRP information: 0x00, Direction: FDO -> PDO
    URB bus id: 1
    Device address: 5
    Endpoint: 0x81, Direction: IN
    URB transfer type: URB_BULK (0x03)
    Packet Data Length: 0
    [Response in: 214]
    [bInterfaceClass: Printer (0x07)]

No.     Time           Source                Destination           Protocol Length Info 
    214 45.759877      1.5.1                 host                  USB      38     URB_BULK in

Frame 214: 38 bytes on wire (304 bits), 38 bytes captured (304 bits)
USB URB
    [Source: 1.5.1]
    [Destination: host]
    USBPcap pseudoheader length: 27
    IRP ID: 0xffffaf8202434ab0
    IRP USBD_STATUS: USBD_STATUS_SUCCESS (0x00000000)
    URB Function: URB_FUNCTION_BULK_OR_INTERRUPT_TRANSFER (0x0009)
    IRP information: 0x01, Direction: PDO -> FDO
    URB bus id: 1
    Device address: 5
    Endpoint: 0x81, Direction: IN
    URB transfer type: URB_BULK (0x03)
    Packet Data Length: 11
    [Request in: 213]
    [Time from request: 0.000615000 seconds]
    [bInterfaceClass: Printer (0x07)]
Leftover Capture Data: 7b5359533a52554e3a307d

No.     Time           Source                Destination           Protocol Length Info 
    215 45.860477      host                  1.5.2                 USB      51     URB_BULK out

Frame 215: 51 bytes on wire (408 bits), 51 bytes captured (408 bits)
USB URB
    [Source: host]
    [Destination: 1.5.2]
    USBPcap pseudoheader length: 27
    IRP ID: 0xffffaf8202664010
    IRP USBD_STATUS: USBD_STATUS_SUCCESS (0x00000000)
    URB Function: URB_FUNCTION_BULK_OR_INTERRUPT_TRANSFER (0x0009)
    IRP information: 0x00, Direction: FDO -> PDO
    URB bus id: 1
    Device address: 5
    Endpoint: 0x02, Direction: OUT
    URB transfer type: URB_BULK (0x03)
    Packet Data Length: 24
    [Response in: 216]
    [bInterfaceClass: Printer (0x07)]
Leftover Capture Data: 1b7b5359533a52554e3a6c6c202f642f475241504849437d

No.     Time           Source                Destination           Protocol Length Info 
    216 45.860533      1.5.2                 host                  USB      27     URB_BULK out

Frame 216: 27 bytes on wire (216 bits), 27 bytes captured (216 bits)
USB URB
    [Source: 1.5.2]
    [Destination: host]
    USBPcap pseudoheader length: 27
    IRP ID: 0xffffaf8202664010
    IRP USBD_STATUS: USBD_STATUS_SUCCESS (0x00000000)
    URB Function: URB_FUNCTION_BULK_OR_INTERRUPT_TRANSFER (0x0009)
    IRP information: 0x01, Direction: PDO -> FDO
    URB bus id: 1
    Device address: 5
    Endpoint: 0x02, Direction: OUT
    URB transfer type: URB_BULK (0x03)
    Packet Data Length: 0
    [Request in: 215]
    [Time from request: 0.000056000 seconds]
    [bInterfaceClass: Printer (0x07)]

No.     Time           Source                Destination           Protocol Length Info 
    217 45.860586      host                  1.5.1                 USB      27     URB_BULK in

Frame 217: 27 bytes on wire (216 bits), 27 bytes captured (216 bits)
USB URB
    [Source: host]
    [Destination: 1.5.1]
    USBPcap pseudoheader length: 27
    IRP ID: 0xffffaf8202664010
    IRP USBD_STATUS: USBD_STATUS_SUCCESS (0x00000000)
    URB Function: URB_FUNCTION_BULK_OR_INTERRUPT_TRANSFER (0x0009)
    IRP information: 0x00, Direction: FDO -> PDO
    URB bus id: 1
    Device address: 5
    Endpoint: 0x81, Direction: IN
    URB transfer type: URB_BULK (0x03)
    Packet Data Length: 0
    [Response in: 218]
    [bInterfaceClass: Printer (0x07)]

No.     Time           Source                Destination           Protocol Length Info 
    218 45.917534      1.5.1                 host                  USB      38     URB_BULK in

Frame 218: 38 bytes on wire (304 bits), 38 bytes captured (304 bits)
USB URB
    [Source: 1.5.1]
    [Destination: host]
    USBPcap pseudoheader length: 27
    IRP ID: 0xffffaf8202664010
    IRP USBD_STATUS: USBD_STATUS_SUCCESS (0x00000000)
    URB Function: URB_FUNCTION_BULK_OR_INTERRUPT_TRANSFER (0x0009)
    IRP information: 0x01, Direction: PDO -> FDO
    URB bus id: 1
    Device address: 5
    Endpoint: 0x81, Direction: IN
    URB transfer type: URB_BULK (0x03)
    Packet Data Length: 11
    [Request in: 217]
    [Time from request: 0.056948000 seconds]
    [bInterfaceClass: Printer (0x07)]
Leftover Capture Data: 7b5359533a52554e3a307d

No.     Time           Source                Destination           Protocol Length Info 
    219 46.018086      host                  1.5.2                 USB      33     URB_BULK out

Frame 219: 33 bytes on wire (264 bits), 33 bytes captured (264 bits)
USB URB
    [Source: host]
    [Destination: 1.5.2]
    USBPcap pseudoheader length: 27
    IRP ID: 0xffffaf82025fb560
    IRP USBD_STATUS: USBD_STATUS_SUCCESS (0x00000000)
    URB Function: URB_FUNCTION_BULK_OR_INTERRUPT_TRANSFER (0x0009)
    IRP information: 0x00, Direction: FDO -> PDO
    URB bus id: 1
    Device address: 5
    Endpoint: 0x02, Direction: OUT
    URB transfer type: URB_BULK (0x03)
    Packet Data Length: 6
    [Response in: 220]
    [bInterfaceClass: Printer (0x07)]
Leftover Capture Data: 1b7b464e3f7d

No.     Time           Source                Destination           Protocol Length Info 
    220 46.018131      1.5.2                 host                  USB      27     URB_BULK out

Frame 220: 27 bytes on wire (216 bits), 27 bytes captured (216 bits)
USB URB
    [Source: 1.5.2]
    [Destination: host]
    USBPcap pseudoheader length: 27
    IRP ID: 0xffffaf82025fb560
    IRP USBD_STATUS: USBD_STATUS_SUCCESS (0x00000000)
    URB Function: URB_FUNCTION_BULK_OR_INTERRUPT_TRANSFER (0x0009)
    IRP information: 0x01, Direction: PDO -> FDO
    URB bus id: 1
    Device address: 5
    Endpoint: 0x02, Direction: OUT
    URB transfer type: URB_BULK (0x03)
    Packet Data Length: 0
    [Request in: 219]
    [Time from request: 0.000045000 seconds]
    [bInterfaceClass: Printer (0x07)]

No.     Time           Source                Destination           Protocol Length Info 
    221 46.018184      host                  1.5.1                 USB      27     URB_BULK in

Frame 221: 27 bytes on wire (216 bits), 27 bytes captured (216 bits)
USB URB
    [Source: host]
    [Destination: 1.5.1]
    USBPcap pseudoheader length: 27
    IRP ID: 0xffffaf8202664010
    IRP USBD_STATUS: USBD_STATUS_SUCCESS (0x00000000)
    URB Function: URB_FUNCTION_BULK_OR_INTERRUPT_TRANSFER (0x0009)
    IRP information: 0x00, Direction: FDO -> PDO
    URB bus id: 1
    Device address: 5
    Endpoint: 0x81, Direction: IN
    URB transfer type: URB_BULK (0x03)
    Packet Data Length: 0
    [Response in: 222]
    [bInterfaceClass: Printer (0x07)]

No.     Time           Source                Destination           Protocol Length Info 
    222 46.076999      1.5.1                 host                  USB      1404   URB_BULK in

Frame 222: 1404 bytes on wire (11232 bits), 1404 bytes captured (11232 bits)
USB URB
    [Source: 1.5.1]
    [Destination: host]
    USBPcap pseudoheader length: 27
    IRP ID: 0xffffaf8202664010
    IRP USBD_STATUS: USBD_STATUS_SUCCESS (0x00000000)
    URB Function: URB_FUNCTION_BULK_OR_INTERRUPT_TRANSFER (0x0009)
    IRP information: 0x01, Direction: PDO -> FDO
    URB bus id: 1
    Device address: 5
    Endpoint: 0x81, Direction: IN
    URB transfer type: URB_BULK (0x03)
    Packet Data Length: 1377
    [Request in: 221]
    [Time from request: 0.058815000 seconds]
    [bInterfaceClass: Printer (0x07)]
Leftover Capture Data: 7b464e214e353a41524142532c4e313a66283636292c4c3a…

No.     Time           Source                Destination           Protocol Length Info 
    223 46.178156      host                  1.5.2                 USB      33     URB_BULK out

Frame 223: 33 bytes on wire (264 bits), 33 bytes captured (264 bits)
USB URB
    [Source: host]
    [Destination: 1.5.2]
    USBPcap pseudoheader length: 27
    IRP ID: 0xffffaf82026cc6a0
    IRP USBD_STATUS: USBD_STATUS_SUCCESS (0x00000000)
    URB Function: URB_FUNCTION_BULK_OR_INTERRUPT_TRANSFER (0x0009)
    IRP information: 0x00, Direction: FDO -> PDO
    URB bus id: 1
    Device address: 5
    Endpoint: 0x02, Direction: OUT
    URB transfer type: URB_BULK (0x03)
    Packet Data Length: 6
    [Response in: 224]
    [bInterfaceClass: Printer (0x07)]
Leftover Capture Data: 1b7b47523f7d

No.     Time           Source                Destination           Protocol Length Info 
    224 46.178285      1.5.2                 host                  USB      27     URB_BULK out

Frame 224: 27 bytes on wire (216 bits), 27 bytes captured (216 bits)
USB URB
    [Source: 1.5.2]
    [Destination: host]
    USBPcap pseudoheader length: 27
    IRP ID: 0xffffaf82026cc6a0
    IRP USBD_STATUS: USBD_STATUS_SUCCESS (0x00000000)
    URB Function: URB_FUNCTION_BULK_OR_INTERRUPT_TRANSFER (0x0009)
    IRP information: 0x01, Direction: PDO -> FDO
    URB bus id: 1
    Device address: 5
    Endpoint: 0x02, Direction: OUT
    URB transfer type: URB_BULK (0x03)
    Packet Data Length: 0
    [Request in: 223]
    [Time from request: 0.000129000 seconds]
    [bInterfaceClass: Printer (0x07)]

No.     Time           Source                Destination           Protocol Length Info 
    225 46.178343      host                  1.5.1                 USB      27     URB_BULK in

Frame 225: 27 bytes on wire (216 bits), 27 bytes captured (216 bits)
USB URB
    [Source: host]
    [Destination: 1.5.1]
    USBPcap pseudoheader length: 27
    IRP ID: 0xffffaf8226be1ab0
    IRP USBD_STATUS: USBD_STATUS_SUCCESS (0x00000000)
    URB Function: URB_FUNCTION_BULK_OR_INTERRUPT_TRANSFER (0x0009)
    IRP information: 0x00, Direction: FDO -> PDO
    URB bus id: 1
    Device address: 5
    Endpoint: 0x81, Direction: IN
    URB transfer type: URB_BULK (0x03)
    Packet Data Length: 0
    [Response in: 226]
    [bInterfaceClass: Printer (0x07)]

No.     Time           Source                Destination           Protocol Length Info 
    226 46.232155      1.5.1                 host                  USB      32     URB_BULK in

Frame 226: 32 bytes on wire (256 bits), 32 bytes captured (256 bits)
USB URB
    [Source: 1.5.1]
    [Destination: host]
    USBPcap pseudoheader length: 27
    IRP ID: 0xffffaf8226be1ab0
    IRP USBD_STATUS: USBD_STATUS_SUCCESS (0x00000000)
    URB Function: URB_FUNCTION_BULK_OR_INTERRUPT_TRANSFER (0x0009)
    IRP information: 0x01, Direction: PDO -> FDO
    URB bus id: 1
    Device address: 5
    Endpoint: 0x81, Direction: IN
    URB transfer type: URB_BULK (0x03)
    Packet Data Length: 5
    [Request in: 225]
    [Time from request: 0.053812000 seconds]
    [bInterfaceClass: Printer (0x07)]
Leftover Capture Data: 7b4752217d

No.     Time           Source                Destination           Protocol Length Info 
    227 46.333176      host                  1.5.2                 USB      36     URB_BULK out

Frame 227: 36 bytes on wire (288 bits), 36 bytes captured (288 bits)
USB URB
    [Source: host]
    [Destination: 1.5.2]
    USBPcap pseudoheader length: 27
    IRP ID: 0xffffaf8202369ab0
    IRP USBD_STATUS: USBD_STATUS_SUCCESS (0x00000000)
    URB Function: URB_FUNCTION_BULK_OR_INTERRUPT_TRANSFER (0x0009)
    IRP information: 0x00, Direction: FDO -> PDO
    URB bus id: 1
    Device address: 5
    Endpoint: 0x02, Direction: OUT
    URB transfer type: URB_BULK (0x03)
    Packet Data Length: 9
    [Response in: 228]
    [bInterfaceClass: Printer (0x07)]
Leftover Capture Data: 1b7b5153543a42417d

No.     Time           Source                Destination           Protocol Length Info 
    228 46.333274      1.5.2                 host                  USB      27     URB_BULK out

Frame 228: 27 bytes on wire (216 bits), 27 bytes captured (216 bits)
USB URB
    [Source: 1.5.2]
    [Destination: host]
    USBPcap pseudoheader length: 27
    IRP ID: 0xffffaf8202369ab0
    IRP USBD_STATUS: USBD_STATUS_SUCCESS (0x00000000)
    URB Function: URB_FUNCTION_BULK_OR_INTERRUPT_TRANSFER (0x0009)
    IRP information: 0x01, Direction: PDO -> FDO
    URB bus id: 1
    Device address: 5
    Endpoint: 0x02, Direction: OUT
    URB transfer type: URB_BULK (0x03)
    Packet Data Length: 0
    [Request in: 227]
    [Time from request: 0.000098000 seconds]
    [bInterfaceClass: Printer (0x07)]

No.     Time           Source                Destination           Protocol Length Info 
    229 46.333348      host                  1.5.1                 USB      27     URB_BULK in

Frame 229: 27 bytes on wire (216 bits), 27 bytes captured (216 bits)
USB URB
    [Source: host]
    [Destination: 1.5.1]
    USBPcap pseudoheader length: 27
    IRP ID: 0xffffaf8202369ab0
    IRP USBD_STATUS: USBD_STATUS_SUCCESS (0x00000000)
    URB Function: URB_FUNCTION_BULK_OR_INTERRUPT_TRANSFER (0x0009)
    IRP information: 0x00, Direction: FDO -> PDO
    URB bus id: 1
    Device address: 5
    Endpoint: 0x81, Direction: IN
    URB transfer type: URB_BULK (0x03)
    Packet Data Length: 0
    [Response in: 230]
    [bInterfaceClass: Printer (0x07)]

No.     Time           Source                Destination           Protocol Length Info 
    230 46.387943      1.5.1                 host                  USB      150    URB_BULK in

Frame 230: 150 bytes on wire (1200 bits), 150 bytes captured (1200 bits)
USB URB
    [Source: 1.5.1]
    [Destination: host]
    USBPcap pseudoheader length: 27
    IRP ID: 0xffffaf8202369ab0
    IRP USBD_STATUS: USBD_STATUS_SUCCESS (0x00000000)
    URB Function: URB_FUNCTION_BULK_OR_INTERRUPT_TRANSFER (0x0009)
    IRP information: 0x01, Direction: PDO -> FDO
    URB bus id: 1
    Device address: 5
    Endpoint: 0x81, Direction: IN
    URB transfer type: URB_BULK (0x03)
    Packet Data Length: 123
    [Request in: 229]
    [Time from request: 0.054595000 seconds]
    [bInterfaceClass: Printer (0x07)]
Leftover Capture Data: 7b5153543a42413a41443a3030303636363033383443393b…

No.     Time           Source                Destination           Protocol Length Info 
    231 46.489671      host                  1.5.2                 USB      33     URB_BULK out

Frame 231: 33 bytes on wire (264 bits), 33 bytes captured (264 bits)
USB URB
    [Source: host]
    [Destination: 1.5.2]
    USBPcap pseudoheader length: 27
    IRP ID: 0xffffaf8202664010
    IRP USBD_STATUS: USBD_STATUS_SUCCESS (0x00000000)
    URB Function: URB_FUNCTION_BULK_OR_INTERRUPT_TRANSFER (0x0009)
    IRP information: 0x00, Direction: FDO -> PDO
    URB bus id: 1
    Device address: 5
    Endpoint: 0x02, Direction: OUT
    URB transfer type: URB_BULK (0x03)
    Packet Data Length: 6
    [Response in: 232]
    [bInterfaceClass: Printer (0x07)]
Leftover Capture Data: 1b7b42543f7d

No.     Time           Source                Destination           Protocol Length Info 
    232 46.489716      1.5.2                 host                  USB      27     URB_BULK out

Frame 232: 27 bytes on wire (216 bits), 27 bytes captured (216 bits)
USB URB
    [Source: 1.5.2]
    [Destination: host]
    USBPcap pseudoheader length: 27
    IRP ID: 0xffffaf8202664010
    IRP USBD_STATUS: USBD_STATUS_SUCCESS (0x00000000)
    URB Function: URB_FUNCTION_BULK_OR_INTERRUPT_TRANSFER (0x0009)
    IRP information: 0x01, Direction: PDO -> FDO
    URB bus id: 1
    Device address: 5
    Endpoint: 0x02, Direction: OUT
    URB transfer type: URB_BULK (0x03)
    Packet Data Length: 0
    [Request in: 231]
    [Time from request: 0.000045000 seconds]
    [bInterfaceClass: Printer (0x07)]

No.     Time           Source                Destination           Protocol Length Info 
    233 46.489769      host                  1.5.1                 USB      27     URB_BULK in

Frame 233: 27 bytes on wire (216 bits), 27 bytes captured (216 bits)
USB URB
    [Source: host]
    [Destination: 1.5.1]
    USBPcap pseudoheader length: 27
    IRP ID: 0xffffaf8202664010
    IRP USBD_STATUS: USBD_STATUS_SUCCESS (0x00000000)
    URB Function: URB_FUNCTION_BULK_OR_INTERRUPT_TRANSFER (0x0009)
    IRP information: 0x00, Direction: FDO -> PDO
    URB bus id: 1
    Device address: 5
    Endpoint: 0x81, Direction: IN
    URB transfer type: URB_BULK (0x03)
    Packet Data Length: 0
    [Response in: 234]
    [bInterfaceClass: Printer (0x07)]

No.     Time           Source                Destination           Protocol Length Info 
    234 46.543487      1.5.1                 host                  USB      43     URB_BULK in

Frame 234: 43 bytes on wire (344 bits), 43 bytes captured (344 bits)
USB URB
    [Source: 1.5.1]
    [Destination: host]
    USBPcap pseudoheader length: 27
    IRP ID: 0xffffaf8202664010
    IRP USBD_STATUS: USBD_STATUS_SUCCESS (0x00000000)
    URB Function: URB_FUNCTION_BULK_OR_INTERRUPT_TRANSFER (0x0009)
    IRP information: 0x01, Direction: PDO -> FDO
    URB bus id: 1
    Device address: 5
    Endpoint: 0x81, Direction: IN
    URB transfer type: URB_BULK (0x03)
    Packet Data Length: 16
    [Request in: 233]
    [Time from request: 0.053718000 seconds]
    [bInterfaceClass: Printer (0x07)]
Leftover Capture Data: 7b425421563a31362e343b43483a437d

No.     Time           Source                Destination           Protocol Length Info 
    235 46.644361      host                  1.5.2                 USB      36     URB_BULK out

Frame 235: 36 bytes on wire (288 bits), 36 bytes captured (288 bits)
USB URB
    [Source: host]
    [Destination: 1.5.2]
    USBPcap pseudoheader length: 27
    IRP ID: 0xffffaf822568a010
    IRP USBD_STATUS: USBD_STATUS_SUCCESS (0x00000000)
    URB Function: URB_FUNCTION_BULK_OR_INTERRUPT_TRANSFER (0x0009)
    IRP information: 0x00, Direction: FDO -> PDO
    URB bus id: 1
    Device address: 5
    Endpoint: 0x02, Direction: OUT
    URB transfer type: URB_BULK (0x03)
    Packet Data Length: 9
    [Response in: 236]
    [bInterfaceClass: Printer (0x07)]
Leftover Capture Data: 1b7b5153543a50527d

No.     Time           Source                Destination           Protocol Length Info 
    236 46.644425      1.5.2                 host                  USB      27     URB_BULK out

Frame 236: 27 bytes on wire (216 bits), 27 bytes captured (216 bits)
USB URB
    [Source: 1.5.2]
    [Destination: host]
    USBPcap pseudoheader length: 27
    IRP ID: 0xffffaf822568a010
    IRP USBD_STATUS: USBD_STATUS_SUCCESS (0x00000000)
    URB Function: URB_FUNCTION_BULK_OR_INTERRUPT_TRANSFER (0x0009)
    IRP information: 0x01, Direction: PDO -> FDO
    URB bus id: 1
    Device address: 5
    Endpoint: 0x02, Direction: OUT
    URB transfer type: URB_BULK (0x03)
    Packet Data Length: 0
    [Request in: 235]
    [Time from request: 0.000064000 seconds]
    [bInterfaceClass: Printer (0x07)]

No.     Time           Source                Destination           Protocol Length Info 
    237 46.644475      host                  1.5.1                 USB      27     URB_BULK in

Frame 237: 27 bytes on wire (216 bits), 27 bytes captured (216 bits)
USB URB
    [Source: host]
    [Destination: 1.5.1]
    USBPcap pseudoheader length: 27
    IRP ID: 0xffffaf82022deab0
    IRP USBD_STATUS: USBD_STATUS_SUCCESS (0x00000000)
    URB Function: URB_FUNCTION_BULK_OR_INTERRUPT_TRANSFER (0x0009)
    IRP information: 0x00, Direction: FDO -> PDO
    URB bus id: 1
    Device address: 5
    Endpoint: 0x81, Direction: IN
    URB transfer type: URB_BULK (0x03)
    Packet Data Length: 0
    [Response in: 238]
    [bInterfaceClass: Printer (0x07)]

No.     Time           Source                Destination           Protocol Length Info 
    238 46.693369      1.5.1                 host                  USB      55     URB_BULK in

Frame 238: 55 bytes on wire (440 bits), 55 bytes captured (440 bits)
USB URB
    [Source: 1.5.1]
    [Destination: host]
    USBPcap pseudoheader length: 27
    IRP ID: 0xffffaf82022deab0
    IRP USBD_STATUS: USBD_STATUS_SUCCESS (0x00000000)
    URB Function: URB_FUNCTION_BULK_OR_INTERRUPT_TRANSFER (0x0009)
    IRP information: 0x01, Direction: PDO -> FDO
    URB bus id: 1
    Device address: 5
    Endpoint: 0x81, Direction: IN
    URB transfer type: URB_BULK (0x03)
    Packet Data Length: 28
    [Request in: 237]
    [Time from request: 0.048894000 seconds]
    [bInterfaceClass: Printer (0x07)]
Leftover Capture Data: 7b5153543a50523a453a4e3b4c3a593b503a593b423a483b…

No.     Time           Source                Destination           Protocol Length Info 
    239 46.794005      host                  1.5.2                 USB      36     URB_BULK out

Frame 239: 36 bytes on wire (288 bits), 36 bytes captured (288 bits)
USB URB
    [Source: host]
    [Destination: 1.5.2]
    USBPcap pseudoheader length: 27
    IRP ID: 0xffffaf82022deab0
    IRP USBD_STATUS: USBD_STATUS_SUCCESS (0x00000000)
    URB Function: URB_FUNCTION_BULK_OR_INTERRUPT_TRANSFER (0x0009)
    IRP information: 0x00, Direction: FDO -> PDO
    URB bus id: 1
    Device address: 5
    Endpoint: 0x02, Direction: OUT
    URB transfer type: URB_BULK (0x03)
    Packet Data Length: 9
    [Response in: 240]
    [bInterfaceClass: Printer (0x07)]
Leftover Capture Data: 1b7b5153543a4d457d

No.     Time           Source                Destination           Protocol Length Info 
    240 46.794051      1.5.2                 host                  USB      27     URB_BULK out

Frame 240: 27 bytes on wire (216 bits), 27 bytes captured (216 bits)
USB URB
    [Source: 1.5.2]
    [Destination: host]
    USBPcap pseudoheader length: 27
    IRP ID: 0xffffaf82022deab0
    IRP USBD_STATUS: USBD_STATUS_SUCCESS (0x00000000)
    URB Function: URB_FUNCTION_BULK_OR_INTERRUPT_TRANSFER (0x0009)
    IRP information: 0x01, Direction: PDO -> FDO
    URB bus id: 1
    Device address: 5
    Endpoint: 0x02, Direction: OUT
    URB transfer type: URB_BULK (0x03)
    Packet Data Length: 0
    [Request in: 239]
    [Time from request: 0.000046000 seconds]
    [bInterfaceClass: Printer (0x07)]

No.     Time           Source                Destination           Protocol Length Info 
    241 46.794104      host                  1.5.1                 USB      27     URB_BULK in

Frame 241: 27 bytes on wire (216 bits), 27 bytes captured (216 bits)
USB URB
    [Source: host]
    [Destination: 1.5.1]
    USBPcap pseudoheader length: 27
    IRP ID: 0xffffaf82022deab0
    IRP USBD_STATUS: USBD_STATUS_SUCCESS (0x00000000)
    URB Function: URB_FUNCTION_BULK_OR_INTERRUPT_TRANSFER (0x0009)
    IRP information: 0x00, Direction: FDO -> PDO
    URB bus id: 1
    Device address: 5
    Endpoint: 0x81, Direction: IN
    URB transfer type: URB_BULK (0x03)
    Packet Data Length: 0
    [Response in: 242]
    [bInterfaceClass: Printer (0x07)]

No.     Time           Source                Destination           Protocol Length Info 
    242 46.842814      1.5.1                 host                  USB      47     URB_BULK in

Frame 242: 47 bytes on wire (376 bits), 47 bytes captured (376 bits)
USB URB
    [Source: 1.5.1]
    [Destination: host]
    USBPcap pseudoheader length: 27
    IRP ID: 0xffffaf82022deab0
    IRP USBD_STATUS: USBD_STATUS_SUCCESS (0x00000000)
    URB Function: URB_FUNCTION_BULK_OR_INTERRUPT_TRANSFER (0x0009)
    IRP information: 0x01, Direction: PDO -> FDO
    URB bus id: 1
    Device address: 5
    Endpoint: 0x81, Direction: IN
    URB transfer type: URB_BULK (0x03)
    Packet Data Length: 20
    [Request in: 241]
    [Time from request: 0.048710000 seconds]
    [bInterfaceClass: Printer (0x07)]
Leftover Capture Data: 7b5153543a4d453a302c3130302c302e302c307d

No.     Time           Source                Destination           Protocol Length Info 
    243 46.943589      host                  1.5.2                 USB      33     URB_BULK out

Frame 243: 33 bytes on wire (264 bits), 33 bytes captured (264 bits)
USB URB
    [Source: host]
    [Destination: 1.5.2]
    USBPcap pseudoheader length: 27
    IRP ID: 0xffffaf82026d3860
    IRP USBD_STATUS: USBD_STATUS_SUCCESS (0x00000000)
    URB Function: URB_FUNCTION_BULK_OR_INTERRUPT_TRANSFER (0x0009)
    IRP information: 0x00, Direction: FDO -> PDO
    URB bus id: 1
    Device address: 5
    Endpoint: 0x02, Direction: OUT
    URB transfer type: URB_BULK (0x03)
    Packet Data Length: 6
    [Response in: 244]
    [bInterfaceClass: Printer (0x07)]
Leftover Capture Data: 1b7b4d593f7d

No.     Time           Source                Destination           Protocol Length Info 
    244 46.943634      1.5.2                 host                  USB      27     URB_BULK out

Frame 244: 27 bytes on wire (216 bits), 27 bytes captured (216 bits)
USB URB
    [Source: 1.5.2]
    [Destination: host]
    USBPcap pseudoheader length: 27
    IRP ID: 0xffffaf82026d3860
    IRP USBD_STATUS: USBD_STATUS_SUCCESS (0x00000000)
    URB Function: URB_FUNCTION_BULK_OR_INTERRUPT_TRANSFER (0x0009)
    IRP information: 0x01, Direction: PDO -> FDO
    URB bus id: 1
    Device address: 5
    Endpoint: 0x02, Direction: OUT
    URB transfer type: URB_BULK (0x03)
    Packet Data Length: 0
    [Request in: 243]
    [Time from request: 0.000045000 seconds]
    [bInterfaceClass: Printer (0x07)]

No.     Time           Source                Destination           Protocol Length Info 
    245 46.943690      host                  1.5.1                 USB      27     URB_BULK in

Frame 245: 27 bytes on wire (216 bits), 27 bytes captured (216 bits)
USB URB
    [Source: host]
    [Destination: 1.5.1]
    USBPcap pseudoheader length: 27
    IRP ID: 0xffffaf82026d3860
    IRP USBD_STATUS: USBD_STATUS_SUCCESS (0x00000000)
    URB Function: URB_FUNCTION_BULK_OR_INTERRUPT_TRANSFER (0x0009)
    IRP information: 0x00, Direction: FDO -> PDO
    URB bus id: 1
    Device address: 5
    Endpoint: 0x81, Direction: IN
    URB transfer type: URB_BULK (0x03)
    Packet Data Length: 0
    [Response in: 246]
    [bInterfaceClass: Printer (0x07)]

No.     Time           Source                Destination           Protocol Length Info 
    246 47.002307      1.5.1                 host                  USB      78     URB_BULK in

Frame 246: 78 bytes on wire (624 bits), 78 bytes captured (624 bits)
USB URB
    [Source: 1.5.1]
    [Destination: host]
    USBPcap pseudoheader length: 27
    IRP ID: 0xffffaf82026d3860
    IRP USBD_STATUS: USBD_STATUS_SUCCESS (0x00000000)
    URB Function: URB_FUNCTION_BULK_OR_INTERRUPT_TRANSFER (0x0009)
    IRP information: 0x01, Direction: PDO -> FDO
    URB bus id: 1
    Device address: 5
    Endpoint: 0x81, Direction: IN
    URB transfer type: URB_BULK (0x03)
    Packet Data Length: 51
    [Request in: 245]
    [Time from request: 0.058617000 seconds]
    [bInterfaceClass: Printer (0x07)]
Leftover Capture Data: 7b4d592146533a3531324d3b464d3a53544d3b52533a3132…

No.     Time           Source                Destination           Protocol Length Info 
    247 47.103523      host                  1.5.2                 USB      36     URB_BULK out

Frame 247: 36 bytes on wire (288 bits), 36 bytes captured (288 bits)
USB URB
    [Source: host]
    [Destination: 1.5.2]
    USBPcap pseudoheader length: 27
    IRP ID: 0xffffaf8202369ab0
    IRP USBD_STATUS: USBD_STATUS_SUCCESS (0x00000000)
    URB Function: URB_FUNCTION_BULK_OR_INTERRUPT_TRANSFER (0x0009)
    IRP information: 0x00, Direction: FDO -> PDO
    URB bus id: 1
    Device address: 5
    Endpoint: 0x02, Direction: OUT
    URB transfer type: URB_BULK (0x03)
    Packet Data Length: 9
    [Response in: 248]
    [bInterfaceClass: Printer (0x07)]
Leftover Capture Data: 1b7b5153543a48577d

No.     Time           Source                Destination           Protocol Length Info 
    248 47.103704      1.5.2                 host                  USB      27     URB_BULK out

Frame 248: 27 bytes on wire (216 bits), 27 bytes captured (216 bits)
USB URB
    [Source: 1.5.2]
    [Destination: host]
    USBPcap pseudoheader length: 27
    IRP ID: 0xffffaf8202369ab0
    IRP USBD_STATUS: USBD_STATUS_SUCCESS (0x00000000)
    URB Function: URB_FUNCTION_BULK_OR_INTERRUPT_TRANSFER (0x0009)
    IRP information: 0x01, Direction: PDO -> FDO
    URB bus id: 1
    Device address: 5
    Endpoint: 0x02, Direction: OUT
    URB transfer type: URB_BULK (0x03)
    Packet Data Length: 0
    [Request in: 247]
    [Time from request: 0.000181000 seconds]
    [bInterfaceClass: Printer (0x07)]

No.     Time           Source                Destination           Protocol Length Info 
    249 47.103796      host                  1.5.1                 USB      27     URB_BULK in

Frame 249: 27 bytes on wire (216 bits), 27 bytes captured (216 bits)
USB URB
    [Source: host]
    [Destination: 1.5.1]
    USBPcap pseudoheader length: 27
    IRP ID: 0xffffaf8203631140
    IRP USBD_STATUS: USBD_STATUS_SUCCESS (0x00000000)
    URB Function: URB_FUNCTION_BULK_OR_INTERRUPT_TRANSFER (0x0009)
    IRP information: 0x00, Direction: FDO -> PDO
    URB bus id: 1
    Device address: 5
    Endpoint: 0x81, Direction: IN
    URB transfer type: URB_BULK (0x03)
    Packet Data Length: 0
    [Response in: 250]
    [bInterfaceClass: Printer (0x07)]

No.     Time           Source                Destination           Protocol Length Info 
    250 47.152912      1.5.1                 host                  USB      43     URB_BULK in

Frame 250: 43 bytes on wire (344 bits), 43 bytes captured (344 bits)
USB URB
    [Source: 1.5.1]
    [Destination: host]
    USBPcap pseudoheader length: 27
    IRP ID: 0xffffaf8203631140
    IRP USBD_STATUS: USBD_STATUS_SUCCESS (0x00000000)
    URB Function: URB_FUNCTION_BULK_OR_INTERRUPT_TRANSFER (0x0009)
    IRP information: 0x01, Direction: PDO -> FDO
    URB bus id: 1
    Device address: 5
    Endpoint: 0x81, Direction: IN
    URB transfer type: URB_BULK (0x03)
    Packet Data Length: 16
    [Request in: 249]
    [Time from request: 0.049116000 seconds]
    [bInterfaceClass: Printer (0x07)]
Leftover Capture Data: 7b5153543a48573a52657632302e307d

No.     Time           Source                Destination           Protocol Length Info 
    251 47.253749      host                  1.5.2                 USB      33     URB_BULK out

Frame 251: 33 bytes on wire (264 bits), 33 bytes captured (264 bits)
USB URB
    [Source: host]
    [Destination: 1.5.2]
    USBPcap pseudoheader length: 27
    IRP ID: 0xffffaf820275cab0
    IRP USBD_STATUS: USBD_STATUS_SUCCESS (0x00000000)
    URB Function: URB_FUNCTION_BULK_OR_INTERRUPT_TRANSFER (0x0009)
    IRP information: 0x00, Direction: FDO -> PDO
    URB bus id: 1
    Device address: 5
    Endpoint: 0x02, Direction: OUT
    URB transfer type: URB_BULK (0x03)
    Packet Data Length: 6
    [Response in: 252]
    [bInterfaceClass: Printer (0x07)]
Leftover Capture Data: 1b7b50483f7d

No.     Time           Source                Destination           Protocol Length Info 
    252 47.253794      1.5.2                 host                  USB      27     URB_BULK out

Frame 252: 27 bytes on wire (216 bits), 27 bytes captured (216 bits)
USB URB
    [Source: 1.5.2]
    [Destination: host]
    USBPcap pseudoheader length: 27
    IRP ID: 0xffffaf820275cab0
    IRP USBD_STATUS: USBD_STATUS_SUCCESS (0x00000000)
    URB Function: URB_FUNCTION_BULK_OR_INTERRUPT_TRANSFER (0x0009)
    IRP information: 0x01, Direction: PDO -> FDO
    URB bus id: 1
    Device address: 5
    Endpoint: 0x02, Direction: OUT
    URB transfer type: URB_BULK (0x03)
    Packet Data Length: 0
    [Request in: 251]
    [Time from request: 0.000045000 seconds]
    [bInterfaceClass: Printer (0x07)]

No.     Time           Source                Destination           Protocol Length Info 
    253 47.253868      host                  1.5.1                 USB      27     URB_BULK in

Frame 253: 27 bytes on wire (216 bits), 27 bytes captured (216 bits)
USB URB
    [Source: host]
    [Destination: 1.5.1]
    USBPcap pseudoheader length: 27
    IRP ID: 0xffffaf820275cab0
    IRP USBD_STATUS: USBD_STATUS_SUCCESS (0x00000000)
    URB Function: URB_FUNCTION_BULK_OR_INTERRUPT_TRANSFER (0x0009)
    IRP information: 0x00, Direction: FDO -> PDO
    URB bus id: 1
    Device address: 5
    Endpoint: 0x81, Direction: IN
    URB transfer type: URB_BULK (0x03)
    Packet Data Length: 0
    [Response in: 254]
    [bInterfaceClass: Printer (0x07)]

No.     Time           Source                Destination           Protocol Length Info 
    254 47.303324      1.5.1                 host                  USB      65     URB_BULK in

Frame 254: 65 bytes on wire (520 bits), 65 bytes captured (520 bits)
USB URB
    [Source: 1.5.1]
    [Destination: host]
    USBPcap pseudoheader length: 27
    IRP ID: 0xffffaf820275cab0
    IRP USBD_STATUS: USBD_STATUS_SUCCESS (0x00000000)
    URB Function: URB_FUNCTION_BULK_OR_INTERRUPT_TRANSFER (0x0009)
    IRP information: 0x01, Direction: PDO -> FDO
    URB bus id: 1
    Device address: 5
    Endpoint: 0x81, Direction: IN
    URB transfer type: URB_BULK (0x03)
    Packet Data Length: 38
    [Request in: 253]
    [Time from request: 0.049456000 seconds]
    [bInterfaceClass: Printer (0x07)]
Leftover Capture Data: 7b50482154443a303836343b44443a3230333b4d3a4b796f…

No.     Time           Source                Destination           Protocol Length Info 
    255 47.404379      host                  1.5.2                 USB      36     URB_BULK out

Frame 255: 36 bytes on wire (288 bits), 36 bytes captured (288 bits)
USB URB
    [Source: host]
    [Destination: 1.5.2]
    USBPcap pseudoheader length: 27
    IRP ID: 0xffffaf82024be010
    IRP USBD_STATUS: USBD_STATUS_SUCCESS (0x00000000)
    URB Function: URB_FUNCTION_BULK_OR_INTERRUPT_TRANSFER (0x0009)
    IRP information: 0x00, Direction: FDO -> PDO
    URB bus id: 1
    Device address: 5
    Endpoint: 0x02, Direction: OUT
    URB transfer type: URB_BULK (0x03)
    Packet Data Length: 9
    [Response in: 256]
    [bInterfaceClass: Printer (0x07)]
Leftover Capture Data: 1b7b5153543a50577d

No.     Time           Source                Destination           Protocol Length Info 
    256 47.404424      1.5.2                 host                  USB      27     URB_BULK out

Frame 256: 27 bytes on wire (216 bits), 27 bytes captured (216 bits)
USB URB
    [Source: 1.5.2]
    [Destination: host]
    USBPcap pseudoheader length: 27
    IRP ID: 0xffffaf82024be010
    IRP USBD_STATUS: USBD_STATUS_SUCCESS (0x00000000)
    URB Function: URB_FUNCTION_BULK_OR_INTERRUPT_TRANSFER (0x0009)
    IRP information: 0x01, Direction: PDO -> FDO
    URB bus id: 1
    Device address: 5
    Endpoint: 0x02, Direction: OUT
    URB transfer type: URB_BULK (0x03)
    Packet Data Length: 0
    [Request in: 255]
    [Time from request: 0.000045000 seconds]
    [bInterfaceClass: Printer (0x07)]

No.     Time           Source                Destination           Protocol Length Info 
    257 47.404479      host                  1.5.1                 USB      27     URB_BULK in

Frame 257: 27 bytes on wire (216 bits), 27 bytes captured (216 bits)
USB URB
    [Source: host]
    [Destination: 1.5.1]
    USBPcap pseudoheader length: 27
    IRP ID: 0xffffaf82026cc6a0
    IRP USBD_STATUS: USBD_STATUS_SUCCESS (0x00000000)
    URB Function: URB_FUNCTION_BULK_OR_INTERRUPT_TRANSFER (0x0009)
    IRP information: 0x00, Direction: FDO -> PDO
    URB bus id: 1
    Device address: 5
    Endpoint: 0x81, Direction: IN
    URB transfer type: URB_BULK (0x03)
    Packet Data Length: 0
    [Response in: 258]
    [bInterfaceClass: Printer (0x07)]

No.     Time           Source                Destination           Protocol Length Info 
    258 47.453160      1.5.1                 host                  USB      41     URB_BULK in

Frame 258: 41 bytes on wire (328 bits), 41 bytes captured (328 bits)
USB URB
    [Source: 1.5.1]
    [Destination: host]
    USBPcap pseudoheader length: 27
    IRP ID: 0xffffaf82026cc6a0
    IRP USBD_STATUS: USBD_STATUS_SUCCESS (0x00000000)
    URB Function: URB_FUNCTION_BULK_OR_INTERRUPT_TRANSFER (0x0009)
    IRP information: 0x01, Direction: PDO -> FDO
    URB bus id: 1
    Device address: 5
    Endpoint: 0x81, Direction: IN
    URB transfer type: URB_BULK (0x03)
    Packet Data Length: 14
    [Request in: 257]
    [Time from request: 0.048681000 seconds]
    [bInterfaceClass: Printer (0x07)]
Leftover Capture Data: 7b5153543a50573a32302c33307d

No.     Time           Source                Destination           Protocol Length Info 
    259 47.554883      host                  1.5.2                 USB      33     URB_BULK out

Frame 259: 33 bytes on wire (264 bits), 33 bytes captured (264 bits)
USB URB
    [Source: host]
    [Destination: 1.5.2]
    USBPcap pseudoheader length: 27
    IRP ID: 0xffffaf82024be010
    IRP USBD_STATUS: USBD_STATUS_SUCCESS (0x00000000)
    URB Function: URB_FUNCTION_BULK_OR_INTERRUPT_TRANSFER (0x0009)
    IRP information: 0x00, Direction: FDO -> PDO
    URB bus id: 1
    Device address: 5
    Endpoint: 0x02, Direction: OUT
    URB transfer type: URB_BULK (0x03)
    Packet Data Length: 6
    [Response in: 260]
    [bInterfaceClass: Printer (0x07)]
Leftover Capture Data: 1b7b43463f7d

No.     Time           Source                Destination           Protocol Length Info 
    260 47.554929      1.5.2                 host                  USB      27     URB_BULK out

Frame 260: 27 bytes on wire (216 bits), 27 bytes captured (216 bits)
USB URB
    [Source: 1.5.2]
    [Destination: host]
    USBPcap pseudoheader length: 27
    IRP ID: 0xffffaf82024be010
    IRP USBD_STATUS: USBD_STATUS_SUCCESS (0x00000000)
    URB Function: URB_FUNCTION_BULK_OR_INTERRUPT_TRANSFER (0x0009)
    IRP information: 0x01, Direction: PDO -> FDO
    URB bus id: 1
    Device address: 5
    Endpoint: 0x02, Direction: OUT
    URB transfer type: URB_BULK (0x03)
    Packet Data Length: 0
    [Request in: 259]
    [Time from request: 0.000046000 seconds]
    [bInterfaceClass: Printer (0x07)]

No.     Time           Source                Destination           Protocol Length Info 
    261 47.554984      host                  1.5.1                 USB      27     URB_BULK in

Frame 261: 27 bytes on wire (216 bits), 27 bytes captured (216 bits)
USB URB
    [Source: host]
    [Destination: 1.5.1]
    USBPcap pseudoheader length: 27
    IRP ID: 0xffffaf82026cc6a0
    IRP USBD_STATUS: USBD_STATUS_SUCCESS (0x00000000)
    URB Function: URB_FUNCTION_BULK_OR_INTERRUPT_TRANSFER (0x0009)
    IRP information: 0x00, Direction: FDO -> PDO
    URB bus id: 1
    Device address: 5
    Endpoint: 0x81, Direction: IN
    URB transfer type: URB_BULK (0x03)
    Packet Data Length: 0
    [Response in: 262]
    [bInterfaceClass: Printer (0x07)]

No.     Time           Source                Destination           Protocol Length Info 
    262 47.607381      1.5.1                 host                  USB      73     URB_BULK in

Frame 262: 73 bytes on wire (584 bits), 73 bytes captured (584 bits)
USB URB
    [Source: 1.5.1]
    [Destination: host]
    USBPcap pseudoheader length: 27
    IRP ID: 0xffffaf82026cc6a0
    IRP USBD_STATUS: USBD_STATUS_SUCCESS (0x00000000)
    URB Function: URB_FUNCTION_BULK_OR_INTERRUPT_TRANSFER (0x0009)
    IRP information: 0x01, Direction: PDO -> FDO
    URB bus id: 1
    Device address: 5
    Endpoint: 0x81, Direction: IN
    URB transfer type: URB_BULK (0x03)
    Packet Data Length: 46
    [Request in: 261]
    [Time from request: 0.052397000 seconds]
    [bInterfaceClass: Printer (0x07)]
Leftover Capture Data: 7b4346214c3a4c503b423a3131353b503a4e3b4e3a383b48…

No.     Time           Source                Destination           Protocol Length Info 
    263 47.708103      host                  1.5.2                 USB      36     URB_BULK out

Frame 263: 36 bytes on wire (288 bits), 36 bytes captured (288 bits)
USB URB
    [Source: host]
    [Destination: 1.5.2]
    USBPcap pseudoheader length: 27
    IRP ID: 0xffffaf82026cc6a0
    IRP USBD_STATUS: USBD_STATUS_SUCCESS (0x00000000)
    URB Function: URB_FUNCTION_BULK_OR_INTERRUPT_TRANSFER (0x0009)
    IRP information: 0x00, Direction: FDO -> PDO
    URB bus id: 1
    Device address: 5
    Endpoint: 0x02, Direction: OUT
    URB transfer type: URB_BULK (0x03)
    Packet Data Length: 9
    [Response in: 264]
    [bInterfaceClass: Printer (0x07)]
Leftover Capture Data: 1b7b5153543a53537d

No.     Time           Source                Destination           Protocol Length Info 
    264 47.708237      1.5.2                 host                  USB      27     URB_BULK out

Frame 264: 27 bytes on wire (216 bits), 27 bytes captured (216 bits)
USB URB
    [Source: 1.5.2]
    [Destination: host]
    USBPcap pseudoheader length: 27
    IRP ID: 0xffffaf82026cc6a0
    IRP USBD_STATUS: USBD_STATUS_SUCCESS (0x00000000)
    URB Function: URB_FUNCTION_BULK_OR_INTERRUPT_TRANSFER (0x0009)
    IRP information: 0x01, Direction: PDO -> FDO
    URB bus id: 1
    Device address: 5
    Endpoint: 0x02, Direction: OUT
    URB transfer type: URB_BULK (0x03)
    Packet Data Length: 0
    [Request in: 263]
    [Time from request: 0.000134000 seconds]
    [bInterfaceClass: Printer (0x07)]

No.     Time           Source                Destination           Protocol Length Info 
    265 47.708393      host                  1.5.1                 USB      27     URB_BULK in

Frame 265: 27 bytes on wire (216 bits), 27 bytes captured (216 bits)
USB URB
    [Source: host]
    [Destination: 1.5.1]
    USBPcap pseudoheader length: 27
    IRP ID: 0xffffaf82026cc6a0
    IRP USBD_STATUS: USBD_STATUS_SUCCESS (0x00000000)
    URB Function: URB_FUNCTION_BULK_OR_INTERRUPT_TRANSFER (0x0009)
    IRP information: 0x00, Direction: FDO -> PDO
    URB bus id: 1
    Device address: 5
    Endpoint: 0x81, Direction: IN
    URB transfer type: URB_BULK (0x03)
    Packet Data Length: 0
    [Response in: 266]
    [bInterfaceClass: Printer (0x07)]

No.     Time           Source                Destination           Protocol Length Info 
    266 47.763789      1.5.1                 host                  USB      50     URB_BULK in

Frame 266: 50 bytes on wire (400 bits), 50 bytes captured (400 bits)
USB URB
    [Source: 1.5.1]
    [Destination: host]
    USBPcap pseudoheader length: 27
    IRP ID: 0xffffaf82026cc6a0
    IRP USBD_STATUS: USBD_STATUS_SUCCESS (0x00000000)
    URB Function: URB_FUNCTION_BULK_OR_INTERRUPT_TRANSFER (0x0009)
    IRP information: 0x01, Direction: PDO -> FDO
    URB bus id: 1
    Device address: 5
    Endpoint: 0x81, Direction: IN
    URB transfer type: URB_BULK (0x03)
    Packet Data Length: 23
    [Request in: 265]
    [Time from request: 0.055396000 seconds]
    [bInterfaceClass: Printer (0x07)]
Leftover Capture Data: 7b5153543a53533a3131353230302c4e2c382c312c487d

No.     Time           Source                Destination           Protocol Length Info 
    267 47.864221      host                  1.5.2                 USB      52     URB_BULK out

Frame 267: 52 bytes on wire (416 bits), 52 bytes captured (416 bits)
USB URB
    [Source: host]
    [Destination: 1.5.2]
    USBPcap pseudoheader length: 27
    IRP ID: 0xffffaf8203662ab0
    IRP USBD_STATUS: USBD_STATUS_SUCCESS (0x00000000)
    URB Function: URB_FUNCTION_BULK_OR_INTERRUPT_TRANSFER (0x0009)
    IRP information: 0x00, Direction: FDO -> PDO
    URB bus id: 1
    Device address: 5
    Endpoint: 0x02, Direction: OUT
    URB transfer type: URB_BULK (0x03)
    Packet Data Length: 25
    [Response in: 268]
    [bInterfaceClass: Printer (0x07)]
Leftover Capture Data: 1b7b5359533a52554e3a6765746c616e6775616765202d73…

No.     Time           Source                Destination           Protocol Length Info 
    268 47.864297      1.5.2                 host                  USB      27     URB_BULK out

Frame 268: 27 bytes on wire (216 bits), 27 bytes captured (216 bits)
USB URB
    [Source: 1.5.2]
    [Destination: host]
    USBPcap pseudoheader length: 27
    IRP ID: 0xffffaf8203662ab0
    IRP USBD_STATUS: USBD_STATUS_SUCCESS (0x00000000)
    URB Function: URB_FUNCTION_BULK_OR_INTERRUPT_TRANSFER (0x0009)
    IRP information: 0x01, Direction: PDO -> FDO
    URB bus id: 1
    Device address: 5
    Endpoint: 0x02, Direction: OUT
    URB transfer type: URB_BULK (0x03)
    Packet Data Length: 0
    [Request in: 267]
    [Time from request: 0.000076000 seconds]
    [bInterfaceClass: Printer (0x07)]

No.     Time           Source                Destination           Protocol Length Info 
    269 47.864321      host                  1.5.1                 USB      27     URB_BULK in

Frame 269: 27 bytes on wire (216 bits), 27 bytes captured (216 bits)
USB URB
    [Source: host]
    [Destination: 1.5.1]
    USBPcap pseudoheader length: 27
    IRP ID: 0xffffaf8225927ab0
    IRP USBD_STATUS: USBD_STATUS_SUCCESS (0x00000000)
    URB Function: URB_FUNCTION_BULK_OR_INTERRUPT_TRANSFER (0x0009)
    IRP information: 0x00, Direction: FDO -> PDO
    URB bus id: 1
    Device address: 5
    Endpoint: 0x81, Direction: IN
    URB transfer type: URB_BULK (0x03)
    Packet Data Length: 0
    [Response in: 270]
    [bInterfaceClass: Printer (0x07)]

No.     Time           Source                Destination           Protocol Length Info 
    270 47.917518      1.5.1                 host                  USB      57     URB_BULK in

Frame 270: 57 bytes on wire (456 bits), 57 bytes captured (456 bits)
USB URB
    [Source: 1.5.1]
    [Destination: host]
    USBPcap pseudoheader length: 27
    IRP ID: 0xffffaf8225927ab0
    IRP USBD_STATUS: USBD_STATUS_SUCCESS (0x00000000)
    URB Function: URB_FUNCTION_BULK_OR_INTERRUPT_TRANSFER (0x0009)
    IRP information: 0x01, Direction: PDO -> FDO
    URB bus id: 1
    Device address: 5
    Endpoint: 0x81, Direction: IN
    URB transfer type: URB_BULK (0x03)
    Packet Data Length: 30
    [Request in: 269]
    [Time from request: 0.053197000 seconds]
    [bInterfaceClass: Printer (0x07)]
Leftover Capture Data: 46502c44502c49504c2c455343502c5a53696d2c4453696d…

No.     Time           Source                Destination           Protocol Length Info 
    271 47.917610      host                  1.5.1                 USB      27     URB_BULK in

Frame 271: 27 bytes on wire (216 bits), 27 bytes captured (216 bits)
USB URB
    [Source: host]
    [Destination: 1.5.1]
    USBPcap pseudoheader length: 27
    IRP ID: 0xffffaf8202652ab0
    IRP USBD_STATUS: USBD_STATUS_SUCCESS (0x00000000)
    URB Function: URB_FUNCTION_BULK_OR_INTERRUPT_TRANSFER (0x0009)
    IRP information: 0x00, Direction: FDO -> PDO
    URB bus id: 1
    Device address: 5
    Endpoint: 0x81, Direction: IN
    URB transfer type: URB_BULK (0x03)
    Packet Data Length: 0
    [Response in: 272]
    [bInterfaceClass: Printer (0x07)]

No.     Time           Source                Destination           Protocol Length Info 
    272 47.917949      1.5.1                 host                  USB      38     URB_BULK in

Frame 272: 38 bytes on wire (304 bits), 38 bytes captured (304 bits)
USB URB
    [Source: 1.5.1]
    [Destination: host]
    USBPcap pseudoheader length: 27
    IRP ID: 0xffffaf8202652ab0
    IRP USBD_STATUS: USBD_STATUS_SUCCESS (0x00000000)
    URB Function: URB_FUNCTION_BULK_OR_INTERRUPT_TRANSFER (0x0009)
    IRP information: 0x01, Direction: PDO -> FDO
    URB bus id: 1
    Device address: 5
    Endpoint: 0x81, Direction: IN
    URB transfer type: URB_BULK (0x03)
    Packet Data Length: 11
    [Request in: 271]
    [Time from request: 0.000339000 seconds]
    [bInterfaceClass: Printer (0x07)]
Leftover Capture Data: 7b5359533a52554e3a307d

No.     Time           Source                Destination           Protocol Length Info 
    273 48.018747      host                  1.5.2                 USB      30     URB_BULK out

Frame 273: 30 bytes on wire (240 bits), 30 bytes captured (240 bits)
USB URB
    [Source: host]
    [Destination: 1.5.2]
    USBPcap pseudoheader length: 27
    IRP ID: 0xffffaf8202652ab0
    IRP USBD_STATUS: USBD_STATUS_SUCCESS (0x00000000)
    URB Function: URB_FUNCTION_BULK_OR_INTERRUPT_TRANSFER (0x0009)
    IRP information: 0x00, Direction: FDO -> PDO
    URB bus id: 1
    Device address: 5
    Endpoint: 0x02, Direction: OUT
    URB transfer type: URB_BULK (0x03)
    Packet Data Length: 3
    [Response in: 274]
    [bInterfaceClass: Printer (0x07)]
Leftover Capture Data: 1b455a

No.     Time           Source                Destination           Protocol Length Info 
    274 48.018818      1.5.2                 host                  USB      27     URB_BULK out

Frame 274: 27 bytes on wire (216 bits), 27 bytes captured (216 bits)
USB URB
    [Source: 1.5.2]
    [Destination: host]
    USBPcap pseudoheader length: 27
    IRP ID: 0xffffaf8202652ab0
    IRP USBD_STATUS: USBD_STATUS_SUCCESS (0x00000000)
    URB Function: URB_FUNCTION_BULK_OR_INTERRUPT_TRANSFER (0x0009)
    IRP information: 0x01, Direction: PDO -> FDO
    URB bus id: 1
    Device address: 5
    Endpoint: 0x02, Direction: OUT
    URB transfer type: URB_BULK (0x03)
    Packet Data Length: 0
    [Request in: 273]
    [Time from request: 0.000071000 seconds]
    [bInterfaceClass: Printer (0x07)]

No.     Time           Source                Destination           Protocol Length Info 
    275 48.018872      host                  1.5.1                 USB      27     URB_BULK in

Frame 275: 27 bytes on wire (216 bits), 27 bytes captured (216 bits)
USB URB
    [Source: host]
    [Destination: 1.5.1]
    USBPcap pseudoheader length: 27
    IRP ID: 0xffffaf8202652ab0
    IRP USBD_STATUS: USBD_STATUS_SUCCESS (0x00000000)
    URB Function: URB_FUNCTION_BULK_OR_INTERRUPT_TRANSFER (0x0009)
    IRP information: 0x00, Direction: FDO -> PDO
    URB bus id: 1
    Device address: 5
    Endpoint: 0x81, Direction: IN
    URB transfer type: URB_BULK (0x03)
    Packet Data Length: 0
    [Response in: 276]
    [bInterfaceClass: Printer (0x07)]

No.     Time           Source                Destination           Protocol Length Info 
    276 49.018902      1.5.1                 host                  USB      27     URB_BULK in

Frame 276: 27 bytes on wire (216 bits), 27 bytes captured (216 bits)
USB URB
    [Source: 1.5.1]
    [Destination: host]
    USBPcap pseudoheader length: 27
    IRP ID: 0xffffaf8202652ab0
    IRP USBD_STATUS: USBD_STATUS_CANCELED (0xc0010000)
    URB Function: URB_FUNCTION_BULK_OR_INTERRUPT_TRANSFER (0x0009)
    IRP information: 0x01, Direction: PDO -> FDO
    URB bus id: 1
    Device address: 5
    Endpoint: 0x81, Direction: IN
    URB transfer type: URB_BULK (0x03)
    Packet Data Length: 0
    [Request in: 275]
    [Time from request: 1.000030000 seconds]
    [bInterfaceClass: Printer (0x07)]

No.     Time           Source                Destination           Protocol Length Info 
    277 49.018927      host                  1.5.1                 USB      27     URB_FUNCTION_SYNC_RESET_PIPE_AND_CLEAR_STALL

Frame 277: 27 bytes on wire (216 bits), 27 bytes captured (216 bits)
USB URB
    [Source: host]
    [Destination: 1.5.1]
    USBPcap pseudoheader length: 27
    IRP ID: 0xffffaf8230ebd870
    IRP USBD_STATUS: USBD_STATUS_SUCCESS (0x00000000)
    URB Function: URB_FUNCTION_SYNC_RESET_PIPE_AND_CLEAR_STALL (0x001e)
    IRP information: 0x00, Direction: FDO -> PDO
    URB bus id: 1
    Device address: 5
    Endpoint: 0x81, Direction: IN
    URB transfer type: USB IRP Info (0xfe)
    Packet Data Length: 0
    [Response in: 278]

No.     Time           Source                Destination           Protocol Length Info 
    278 49.019243      1.5.1                 host                  USB      27     URB_FUNCTION_SYNC_RESET_PIPE_AND_CLEAR_STALL

Frame 278: 27 bytes on wire (216 bits), 27 bytes captured (216 bits)
USB URB
    [Source: 1.5.1]
    [Destination: host]
    USBPcap pseudoheader length: 27
    IRP ID: 0xffffaf8230ebd870
    IRP USBD_STATUS: USBD_STATUS_SUCCESS (0x00000000)
    URB Function: URB_FUNCTION_SYNC_RESET_PIPE_AND_CLEAR_STALL (0x001e)
    IRP information: 0x01, Direction: PDO -> FDO
    URB bus id: 1
    Device address: 5
    Endpoint: 0x81, Direction: IN
    URB transfer type: USB IRP Info (0xfe)
    Packet Data Length: 0
    [Request in: 277]
    [Time from request: 0.000316000 seconds]

No.     Time           Source                Destination           Protocol Length Info 
    279 49.029854      host                  1.5.1                 USB      27     URB_BULK in

Frame 279: 27 bytes on wire (216 bits), 27 bytes captured (216 bits)
USB URB
    [Source: host]
    [Destination: 1.5.1]
    USBPcap pseudoheader length: 27
    IRP ID: 0xffffaf8202652ab0
    IRP USBD_STATUS: USBD_STATUS_SUCCESS (0x00000000)
    URB Function: URB_FUNCTION_BULK_OR_INTERRUPT_TRANSFER (0x0009)
    IRP information: 0x00, Direction: FDO -> PDO
    URB bus id: 1
    Device address: 5
    Endpoint: 0x81, Direction: IN
    URB transfer type: URB_BULK (0x03)
    Packet Data Length: 0
    [Response in: 280]
    [bInterfaceClass: Printer (0x07)]

No.     Time           Source                Destination           Protocol Length Info 
    280 50.030219      1.5.1                 host                  USB      27     URB_BULK in

Frame 280: 27 bytes on wire (216 bits), 27 bytes captured (216 bits)
USB URB
    [Source: 1.5.1]
    [Destination: host]
    USBPcap pseudoheader length: 27
    IRP ID: 0xffffaf8202652ab0
    IRP USBD_STATUS: USBD_STATUS_CANCELED (0xc0010000)
    URB Function: URB_FUNCTION_BULK_OR_INTERRUPT_TRANSFER (0x0009)
    IRP information: 0x01, Direction: PDO -> FDO
    URB bus id: 1
    Device address: 5
    Endpoint: 0x81, Direction: IN
    URB transfer type: URB_BULK (0x03)
    Packet Data Length: 0
    [Request in: 279]
    [Time from request: 1.000365000 seconds]
    [bInterfaceClass: Printer (0x07)]

No.     Time           Source                Destination           Protocol Length Info 
    281 50.030244      host                  1.5.1                 USB      27     URB_FUNCTION_SYNC_RESET_PIPE_AND_CLEAR_STALL

Frame 281: 27 bytes on wire (216 bits), 27 bytes captured (216 bits)
USB URB
    [Source: host]
    [Destination: 1.5.1]
    USBPcap pseudoheader length: 27
    IRP ID: 0xffffaf8230ebd870
    IRP USBD_STATUS: USBD_STATUS_SUCCESS (0x00000000)
    URB Function: URB_FUNCTION_SYNC_RESET_PIPE_AND_CLEAR_STALL (0x001e)
    IRP information: 0x00, Direction: FDO -> PDO
    URB bus id: 1
    Device address: 5
    Endpoint: 0x81, Direction: IN
    URB transfer type: USB IRP Info (0xfe)
    Packet Data Length: 0
    [Response in: 282]

No.     Time           Source                Destination           Protocol Length Info 
    282 50.030560      1.5.1                 host                  USB      27     URB_FUNCTION_SYNC_RESET_PIPE_AND_CLEAR_STALL

Frame 282: 27 bytes on wire (216 bits), 27 bytes captured (216 bits)
USB URB
    [Source: 1.5.1]
    [Destination: host]
    USBPcap pseudoheader length: 27
    IRP ID: 0xffffaf8230ebd870
    IRP USBD_STATUS: USBD_STATUS_SUCCESS (0x00000000)
    URB Function: URB_FUNCTION_SYNC_RESET_PIPE_AND_CLEAR_STALL (0x001e)
    IRP information: 0x01, Direction: PDO -> FDO
    URB bus id: 1
    Device address: 5
    Endpoint: 0x81, Direction: IN
    URB transfer type: USB IRP Info (0xfe)
    Packet Data Length: 0
    [Request in: 281]
    [Time from request: 0.000316000 seconds]
